id,title,body,category,priority,title_length,body_length
129,Batch: consolidamento dati contabili - disponibilità negoziazione,"Data entry: modifica scheda informativa cliente Ferrante-Majewski s.r.l.. Aggiornamento campi email rbernardi@miniati.it e refernete admin_01. Modifica puramente formale per completezza anagrafica. Attività amministartiva standard di basso livello, gestibile in background.",Amministrazione,bassa,65,273
130,URGENTE: Account bloccato giulia.verdi - errore 500 su sys ordini,"Duplicazione righe in visualizzazione esrtatto conto Toso, Baracca e Cilea e figli. Le fatture appaiono due volte nella lista a video. Il saldo finale è corretto, è solo un errore visivo che confonde gli operatori. Richiesta pulizia della view nel modulo ordnii. con login fallito con crash",Amministrazione,alta,65,290
131,Log: inserimento anagrafica Fermi e figli,"Discrepanza IVA su fattura estera 8811/20. Il applicativo calcola un importo diverso da quello atteso per il cliente Fermi e figli. Differenza di pochi euro, ma impedisce la validazione contabile. Richiesta check configurazione aliquote nel modulo ordini.. Segnalato anche versione",Amministrazione,media,41,281
132,Rallentamento fatturazione: salvataggio impiega 40 secondi (troppo) con login fallito,"Impossibile allegare PDF al record della fattura 7565/20. Il bottone 'Upload' non risponde o dà errore di permessi. Il documento deve essere archiviato digitalmente entro fine mese. Problema limitato alla funzione di upload, il resto funziona. - relativo a aggiornamento per timeout condizioni commercialir",Amministrazione,media,85,306
133,Log: inserimento anagrafica Botticelli e figli con memory leak,"Monitoraggio passivo dei log modulo gestione utenti per statistiche utilizzo. Analisi a posteriori dei tracciati per identificare trend di lnugo periodo. Non ci sono errori attvii o malfunzionamenti. Attività di studio per future ottimizzazioni, senza impatto attuale.",Amministrazione,bassa,62,268
134,Manutenzione: pulizia account inattivi con sincronizzazione con bug con listino,"Errore validazione codice fiscale per nuovo cliente Calgari, Fusani e Pertile e figli. Il sistema lo segna come errato anche se è formalmente valido. Impedisce il salvataggio della scheda cliente. Necessario bypassare il controllo o correggere l'algoritmo di validazione.. Segnalato anche gestione ",Amministrazione,media,79,298
135,Account bloccato: utente admin_01 fermo (troppi tentativi) per bug - disponibilità - condizioni commerciali,Malfunzionamento export Excel per report mensile. La generazione del file si interrompe a mteà con errore generico. I dati a video sono corretti. Serve il file esportato per riunione di domani mattina. Workaround richiesto.,Amministrazione,alta,107,223
136,Log: inserimento anagrafica Casini Group sconto,Nota di aggiornamento anagrafica per cliente aCsini Group nel sistema reportistica. Inseriti dati nuovo referente admin_01 a puro titolo informativo per il database. Nessuna azione di sincronizzazione richiesta al momento. Semplice data entry per tenere ordinato lo storico contatti. per crash con negoziazionez,Amministrazione,bassa,47,311
137,Archivio: documentazione storica 1970 - disponibilità per login fallito per crash,"Timeout puntuale durante la ricerca fatture per data. La query va in error solo se si seleziona un intervallo superiore a 30 giorni. Costringe gli operatori a fare rcierche frazionate. Molto scomodo per l'operatività quotidiana, serve ottimizzazione.",Amministrazione,media,81,250
138,Errore stampa: impossibile stampare fattura 6966/20 (cliente aspetta),Proposta di manutenzione ordinaria: pulizia account inattivi da lungo periodo. Lista di 8 utenti che non accedono da mesi. Attività di igiene del database da schedulare come task di routine. Nessun impatto sugli utenti attivi o sul servizio di produzione. - relativo a assistenza,Amministrazione,media,69,279
139,Log: inserimento anagrafica Olivetti-Serao s.r.l.,Procedura di backup storico: export fatture anno 2002 per acrhivio sicurezza. Generazione file statico in fomrato XML da conservare server-side. Operazione a bassa priorità da accoadre ai job notturni o weekend. Serve solo per compliance e non per attività correnti.,Amministrazione,bassa,49,266
140,Monitoraggio: log modulo utenti (nessun bug),"Mancato allineamento incassi: il bonifico di 894.08 non risulta in contabilità. In banca è presente, ma il modulo ordini non lo ha importato automaticamente. Necessario inserimento manuale o forzatura sync per chiudere la posizioen del cliente Botticelli-Monduzzi SPA. Il pb. riguarda solo i bonifici di ieri.",Amministrazione,media,44,309
141,Errore critico: impossibile completare pagamento ordine ORD-77888,"Discrepanza IVA su fattura estera 6073/23. Il sys clacola un importo diverso da quello atteso per il cliente Bonanno, Franceschi e Poerio e figli. Differenza di pochi euro, ma impedisce la validazione contabile. Richiesta verifica configurazione aliquote nel modulo clienti.",Amministrazione,alta,65,274
142,Rallentamento fatturazione: salvataggio impiega 40 secondi (troppo),Proposta di manutenzione rodinaria: pulizia account inattivi da lunog periodo. Lista di 5 utenti che non accedono da mesi. Attività di igiene del database da schedulare come task di routine. Nessun impatto sugli utenti attivi o sul servizio di produzione.,Amministrazione,media,67,255
143,Blocco sys durante elaborazione fattura 3097/21 per Morrocco SPA con condizioni commerciali - sincronizzazione - memory leak,"Attività di background: archiviazione documenti storici cliente Morrocco SPA per anno 2016. Si tratta di spostare vecchi file (fatture, contratti) nell'archivio morto per liberare spazio. Nessuna urgenza operativa: il task può girare nei momenti di inattività del system. Operaizone di manutenzione ordinaria del database. per preventivo - listino per performancep",Amministrazione,bassa,124,364
144,Account bloccato: utente operatore_23 fermo (troppi tentativi) negoziazione performance,"Data entry: modifica scehda informativa cliente Mascagni Group. Aggiornamento campi emial pomponio92@borsellino-piane.net e refreente operatore_23. Modifica puramente formale per completezza anagrafica. Attività amminisrtativa standard di basso livello, gestibile in background. per timeout - negoziazione",Amministrazione,alta,87,305
145,Vulnerabilità security: patch richiesta entro 30gg,Errore generazione PDF report vendite mensile. Il report esce con formattazione sballata nelle ultime pagine. I dati sono leggibili ma il documento è brutto da inviare al board. Correggere template di stampa.. Segnalato anche sistema - bonifico per pagamento listinoe,Tecnico,media,50,267
146,Warning disco: server sviluppo al 85% (rischio saturazione),"Richiesta patch di sicurezza per libreria obsoleta in magazzino. Vulnerabilità media segnalata dal security sca.n Non c'è exploit attivo, ma la policy richiede aggiornamento entro 30 giorin. Pianificare installazione patch in ambiente di tset. con pianificare condizioni commerciali",Tecnico,bassa,59,282
147,Pianificazione: upgrade minore v2.5.4 condizioni commerciali,"Curiosità su dati storici cliente: ho notato record vecchi di 5 anni. Non creano problemi, ma volevo capire la policy di retention. Solo per mia informazione personale, nessuna azione correttiva richiesta. Chiudere il ticket dopo breve risopsta informativa.",Tecnico,bassa,60,257
148,Servizio magazzino non risponde - blocco operativo vendite,"Il servizio di invio email automatiche si è inceppato per 2 ore. Ora ha ripreso, ma c'è una coda di 50 email in attesa. Monitorare lo smaltimento della coda per assicurarsi che non si blocchi di nuovo. Verificare configurazione SMTP relay.l",Tecnico,media,58,240
149,Info: codice OutOfMemoryError (falso positivo),"Timeout sporadici durante l'update delle anagrafiche su fattruazione. Succede cicra 1 volta su 10 tentativi. Riprova e funziona. Indice di instabilità del database che va indagata, anche se non blocca il lavoro.",Tecnico,media,46,211
150,"Emergenza: perdita dati cliente Saffi, Tonisto e Morandi Group su ambiente test condizioni commerciali per preventivo","Il sistema etst è completamente bloccato da questa mattina. Impossibile accedere al modulo fatturazione e gestione ordini. Circa 9 utenti bloccati inclusi reparti amministrativi e commerciali. Errore restituito: 500. Tutte operazioni business ferme includendo emissione fatture per clienti Saffi, Tonisto e Morandi Group e conferma ordin.i Intervento urgentissimo richiesto. urgente",Tecnico,alta,117,382
151,acc. negato parziale: cartella specifica inaccessibile,Glitch visuale nella tabella ordini: la colonna 'Totale' a volte appare vuota. Facenod refresh della pagina i dati compaiono. issue intermittente che genera confusione nel reparto vendite. Non blocca gli ordini ma genera chiamate di assistenza inutili. con pianificare - condizioni commerciali,Tecnico,media,54,293
152,Nota: monitoraggio passivo test,"Richiesta PDF aggiornato del manuale utente modulo magazzino. La versione sul server è obsoleta (manca capitolo 5). Non serve per attività correnti, ma per completezza archivio documentale. Inviare file quando disponibile., problema su utente",Tecnico,media,31,242
153,Domanda: funzionamento teorico preventivi,Suggerimento per futura roadmap evolutiva del modulo magazzino. Sarebbe utile valutare una ristrutturazione dei menu per il prossimo major update. Nessuna fretta: inserire in wishlist per discussione trimestrale. Proposta puramente estetica/funzionael per il futuro.c,Tecnico,bassa,41,267
154,Domanda: funzionamento teorico preventivi,Crash critico del modulo reportistica durante elaborazione ordini cliente. Il sys. si blocca quando si tenta di confermare ordine ORD-50434 per Paoletti-Borsiere s.r.l.. Errore OutOfMemoryError impedisce completamento transazioni. Il reparto comm non può processare ordini per 1057.59. Necessario ripristino immediato servizio su ambiente pre-produzione.,Tecnico,alta,41,354
155,Glitch intermittente: tabella ordini a volte vuota,"Timeout sporadici durante l'update delle anagrafiche su ordini. Succede circa 1 volta su 10 tentativi. Riprova e funziona. Indice di instabilità del database che va indagata, anche se non blocca il lavoro.",Tecnico,media,50,205
156,Pianificazione: upgrade minore v2.3.1,"Domanda generica su logica funzionamento scnoti in Linea Premium. Serve per aggiornare il wiki interno e formare i junior. Il sistema funziona come atteso, si richiede solo conferma teorica della formula. Da gestire a tempo preso come attività di knowledge sharing.",Tecnico,bassa,37,265
157,Performance degradate: dashboard impiega 15s (utenti lamentano),Crash critical del modulo reportistica durante elaborazione ordini cliente. Il sistema si blocca qaundo si tenta di confermare ordine ORD-84144 per Polani Group. error OutOfMemoryError impedisce completamento transazioni. Il reparto commerciale non può processare ordini per 1144.34. Necessario ripristino immediato servizio su ambiente sviluppo.,Tecnico,alta,63,346
158,Coda email bloccata: 50 messaggi in attesa (ritardo comunicazioni),Feedback su usabilità interfaccia reoprtistica: i colori dei grafici sono poco leggibili. Problema puramente cosmetico che non impatta le funzionalità. Valutare restyling grafico quando si metterà mano al frontend. Segnalazione di bassa priorità per backlog UX.,Tecnico,media,66,261
159,Analisi: statistiche log magazzino,"Sessione di test esplorativo su ambiente staging per nuovi assunti. Utilizzo sandbox per prendere confidenza con le funzioni base. Nessun output atteso, solo attività didattica. Non richiede supervisione senior.d",Tecnico,bassa,34,212
160,Formattazione rotta: PDF report illeggibile per importo per pianificare per listino,Lentezza eccessiva nel caricamento della dashboard gestione utenti. Impiega 15 secondi per aprirsi invece dei soliti 2. Il sistema è utilizzabile ma la navigazione è frustrante per gli utenti. Probabile query non ottimizzata su DB pre-produzione. con preventivo,Tecnico,media,83,261
161,Wishlist: estetica interfaccia vendite lieve con ordine urgente,"Il servizio vendite non risponde da 10 ore causando down completo operativo totale. Impossibile per utenti commerciali accedere per generare preventivi. Clienti Pontecorvo e figli attendono offerte con scadenza oggi. Nessun workaround disponibile, applicativo mostra OutOfMemoryError. Impatto critico su vendite e relazioni clienti. Assistenza urgentissimo necessaria. - relativo a assistenza - ordine urgente importo con listinoa",Tecnico,alta,63,430
162,Test: funzionalità sandbox demo,"Il servizio di invio email automatiche si è inceppato per 2 ore. Ora ha ripreso, ma c'è una coda di 50 email in attesa. Monitorare lo smaltimento della coda per assicurarsi che non si blocchi di nuovo. Verificare configurazione SMTP relay. per lieve",Tecnico,media,31,249
163,Analisi: statistiche log clienti,"Crash critico del modulo clienit durante elaborazione ordini cliente. Il sistema si blocca quando si tenta di confermare ordine ORD-95902 per Pirelli, Ortolani e Simeoni e figli. error SQL_ERRRO_1045 impedisce completamento transazioni. Il reparto commerciale non può processare ordini per 760.49. Necessario ripristino immediato servizio su ambiente pre-produzione. con sconto suggerimento",Tecnico,alta,32,390
164,Query lenta: ricerca clienti senza indice (full scan),Erorre generazione PDF report vendite mensile. Il report esce con formattazione sballata nelle ultime pagine. I dati sono leggibili ma il docuemnto è brutto da inviare al board. Correggere template di stampa.,Tecnico,bassa,53,208
165,Instabilità DB: timeout random su update anagrafiche - bonifico disponibilità,"Richiesta patch di sicurezza per libreria obsoleta in catalogo. Vulnerabilità media segnalata dal security scan. Non c'è exploit attivo, ma la policy richiede update entro 30 giorni. Pianificare installazione patch in ambiente di test.",Tecnico,media,77,235
166,Query lenta: ricerca clienti senza indice (full scan) per preventivo,"Sessione di test esplorativo su ambiente staging per nuovi assunti. Utilizzo sandbox per prendere confidenza con le funzioni base. Nessun output atteso, solo attività didattica. Non richiede supervisione senior.",Tecnico,media,68,211
167,Blocco inserimento ordini ORD-65395 - err. 500 con pagamento - condizioni commerciali - condizioni commerciali,error generazione PDF report vendite mensile. Il report esce con formattazione sballata nelle ultime pagine. I dati sono leggibili ma il documento è brutto da ivniare al board. Correggere template di stampa. - importog,Tecnico,bassa,110,218
168,Disallineamento magazzino: giacenze web vs ERP errate importo - listino,Errore generazione PDF repotr vendite mensile. Il report esce con formattazione sballata nelle ultime pagine. I dati snoo leggibili ma il documento è brutot da inivare al board. Correggere template di stampa.,Tecnico,media,71,208
169,Test: funzionalità sandbox produzione,Il ssitema produzione è completamente bloccato da questa mattina. Impossiible accedere al modulo fatturazione e gestione ordini. Circa 8 utenti bloccati inclusi reparti amministrativi e commerciali. error restituito: OutOfMemoryError. Tutte operazioni business ferme includendo emsisione fatture per clienti Saragat-Trapani e figli e conferma ordini. Intervento urgentissimo richeisto.r,Tecnico,alta,37,386
170,Pianificazione: upgrade minore v3.0.0,"Domanda generica su logica funzionamento sconti in Linea Accessori. Serve per aggiornare il wiki interno e formare i junior. Il sistema funziona come atteso, si richiede solo conferma teorica della formula. Da gestire a tempo perso come attività di knowledge sharing.",Tecnico,bassa,37,267
171,Nota: monitoraggio passivo staging per preventivo per fattura,"Pianificazione attività di shadowign per upgrade system CRM. Vorrei assistere alle operazioni della prossima settimana per imparare. Nessun intervento attivo richiesto, solo presenza come osservatore. Attività di formazioen interna on-the-job.",Tecnico,media,61,243
172,err. job notturno: 5 record scartati su 1000,"Richiesta PDF aggiornato del manuale utente modulo assistenza. La versione sul server è obsoleta (manca capitolo 5). Non serve per attività correnti, ma per completezza archivoi documentale. Inviare file quando disponibile. - condizioni commerciali - suggerimentoe",Tecnico,bassa,44,264
173,Bug funzionale: sconto IVA non calcolato su estero - bonifico,Il job notturno di importazioen dati ha saltato 5 record su 1000. Errore di validazione sui campi data. I restanti 995 record sono ok. Analizzare i 5 csarti e capire perché il formato data era errato.,Tecnico,media,61,200
174,Info: tracciamento attività catalogo,"Domanda geenrica su logcia funzionamento sconti in Linea Enterprise. Serve per aggiornare il wiki interno e formare i junior. Il sistema funziona come atteso, si richiede solo conferma teorica della formula. Da gestire a tempo peros come attività di knowledge sharing. per bonifico con suggerimento con suggerimento",Tecnico,bassa,36,315
175,Nota: monitoraggio passivo staging - ordine urgente - preventivo,Glitch visuale nella tabella ordiin: la colonna 'Totale' a volte appare vuota. Facendo refresh della pagina i dati compaiono. pb intermitetnte che genera confusione nel reparto vendite. Non blocca gli ordini ma genera chiamate di assistenza inutili. - relativo a sistemas,Tecnico,alta,64,271
176,"Emergenza: perdita dati cliente Pisano, Calvo e Lanfranchi Group su ambiente pre-produzione con preventivo lieve","Richiesta PDF aggiornato del manuale utente modulo catalogo. La versione sul server è obsoleta (manca capitolo 5). Non serve per attività correnti, ma per completezza archivio documentale. Inviare file quando disponibile. per lieve",Tecnico,alta,112,231
177,Performance degradate: dashboard impiega 15s (utenti lamentano),Sistema compeltamente bloccato durante generazione preventivi per cliente Rocca e figli. Il modulo fatturazione va in crash con errore 502 quando si tenta calcolo per Linea Pro. Team commerciale impossibilitato a inviare offerte. Scadenza opportunità entro entro oggi. Rirpistino urg. necessario per non eprdere vendita. file ordine urgente con fattura - lieve,Tecnico,alta,63,360
178,URGENTE: Sistema test down - impossibile accedere a fatturazione per sconto disponibilità,Glitch visuale nella tabella ordini: la colonna 'Totale' a volte appare vuota. Facendo erfresh della pagina i dati compaiono. pb nitermittente che genera confusione nel reparto vendite. Non blocca gli ordini ma genera chiamate di assistenaz inutili.. Segnalato anche contratto,Tecnico,alta,89,276
179,Blocco inserimento ordini ORD-16415 - errore ERR_TIMEOUT,Il system test è completamente bloccato da questa mattina. Impossibile accedere al modulo fatzione e gestione ordini. Circa 6 utenti bloccati inclusi reparti amministrativi e commerciali. error restituito: ERR_TIMEUOT. Tutte operazoini business ferme includendo emissione fatture per clienti Pininfarina SPA e conferma ordiin. Intervento urgentissimo richiesto.o,Tecnico,alta,56,362
180,Sistema bloccato durante generazione preventivi per Franzese s.r.l. - negoziazione,"Log del sevrer application pieno di warning 'Connection Reest'. Il servizio non è mai andato down, ma i log crescono di 1GB al giorno. Rischio saturazione disco se non si indaga la causa. Situazione da monitorare e correggere prima che diventi critica.. Segnalato anche timeout",Tecnico,alta,82,277
181,Storico: dati transazioni passati,"Il servizio di invio email automatiche si è inceppato per 2 ore. Ora ha ripreso, ma c'è una coda di 50 email in attesa. Monitorare lo smaltimento della ocda per assicurarsi che non si blocchi di nuovo. checkre configurazione SMTP relay.",Tecnico,bassa,33,236
182,Crash critico modulo fatzione durante elaborazione ordini cliente,Il job notturno di importazione dati ha saltato 5 record su 1000. error di valiadzione sui camip data. I restanti 995 record sono ok. Analizzare i 5 scarti e capire perché il formato data era errato.. Segnalato anche contattare supporto - preventivov,Tecnico,alta,65,250
183,err. job notturno: 5 record scartati su 1000,"Richiesta patch di sicurezza per libreria obsoleta in clienti. Vulnerabilità emdia segnalata dal security scan. Non c'è exploit attivo, ma la policy rcihiede aggiornamento entro 30 giorni. Pianificare installazione patch in ambiente di test.",Tecnico,bassa,44,241
184,Wishlist: estetica interfaccia reportistica scadenza con disponibilità con disponibilità,Nota di osservazione su ambiente demo: performance stabili. Tracciamento periodico KPI di sistema per reportistica mensile. Tutti i parametri sono nella norma. Ticket aperto solo per loggare l'avvenuto controllo di routine.p,Tecnico,media,88,224
185,Coda email bloccata: 50 messaggi in attesa (ritardo comunicazioni) listino - sconto,"Pianificazione attività di shadowing per upgrade sistema ERP. Vorrei assistere alle opearzioni della prossima settimana per imparare. Nessun intervento attivo richiesto, solo presenza come osservatore. Attività di formazione interna on-the-job.",Tecnico,media,83,244
186,urg.: Sistema pre-produzione down - impossibile accedere a fatt.zione per preventivo,"Il serviizo di invio email automatiche si è inceppato per 2 or.e Ora ha ripreso, ma c'è una coda di 50 email in attesa. Monitorare lo smaltimento della coda per assicurarsi che non si blocchi di nuovo. checkre configurazione SMTP relay. negoziazione",Tecnico,media,84,249
187,Emergenza: perdita dati cliente Gonzaga-Bellò Group su ambiente pre-produzione - scadenza,"Log del serevr application pieno di warning 'Connection Reset'. Il servizio non è mai andato down, ma i log crescono di 1GB al giorno. Rischio saturazione disco se non si indaga la causa. Situazione da monitorare e correggere rpima che diventi critica.",Tecnico,alta,89,252
188,Analisi: statistiche log catalogo,"Cuirosità su dati storici cliente: ho notato record vecchi di 5 anni. Non creano problemi, ma volevo caipre la oplicy di retention. Solo per mia informazione personale, nessuna azione correttiva richiesta. Chiudere il ticket dopo breve risposta informativa. per lieved",Tecnico,bassa,33,268
189,sys. bloccato durante generazione preventivi per Pistoletto-Mantegazza SPA,Disallineamento giacenze magazzino tra ERP e e-commerce. Alcuni articoli risultano disponibili online ma sono a zero in magazzino. Rischio ordini non evadibili. Forzare una sincronizzazione completa stanotte. fattura,Tecnico,alta,74,216
190,Bug funzionale: sconto IVA non calcolato su estero,Disallineamento giacenze magazzino tra ERP e e-commerce. Alcuni articoli risultano disponibili online ma sono a zero in magazzino. Rischio ordini non evadibili. Forzare una sincronizzazione completa stanotte.v,Tecnico,media,50,209
191,Wishlist: estetica interfaccia catalogo per pianificare negoziazione,Query di ricerca clietni lenta: manca indice sulla colonna 'Partita IVA'. Ogni ricerca fa full table scan. Creare indice per migliorare tempi di risposta. Attività di tuning DB standard.o,Tecnico,bassa,68,187
192,Performance degradate: dashboard impiega 15s (utenti lamentano) - disponibilità per pagamento - listino,Errore generazione PDF report vendite mensile. Il report esce con formattazione sballata nelle ultime pagine. I dati sono leggibili ma il documento è brutto da inviare al board. Correggere template di stampa. per bonifico,Tecnico,media,103,221
193,URGENTE: sys demo down - impossibile accedere a fatt.zione con ordine urgente,"Il servizio ordini non risponde da 10 ore causando down completo operativo totale. Impossibile per utenti commerciali accedere per generare preventivi. Clienti Persico s.r.l. attendono offerte con scadenza oggi. Nessun workaround disponibile, sys mostra 504. Impatto critical su vendite e relazioni clienti. Assistenza urgente necessaria. listino per pianificare",Tecnico,alta,77,362
194,Info: tracciamento attività magazzino,Crash critical del modulo magazzino durante elaborazione ordini cliente. Il sys si blocca quando si tenta di confermare ordine ORD-94650 per Pizzo-Scarfoglio SAP. problem 500 impedisce completamento transazioni. Il reparto commerciale non può processare ordini per 1094.06. Necessario ripristino immediato servizio su ambiente demo.,Tecnico,alta,37,332
195,Formattazione rotta: PDF report illeggibile - listino per pianificare con fattura,Segnalazione glitch grafico minore su clienti in risoluzione 4K. Il fooetr si sovrappone leggermente ma i bottoni funzionano. Difetto visivo marginale da correggere quando capiterà occasione. Non impatta l'operatività degli utenti standard.. Segnalato anche accesso,Tecnico,bassa,81,265
196,Instabilità DB: timeout random su update anagrafiche,"L'utente mario.rossi segnala problem 'Access Denied' su una specifica cartella. I permessi sembrano corretti a sistema. L'utente può lavorare su altre cartelle, ma quella specifica è inaccessibile. checkre ACL su file server. per pianificare",Tecnico,media,52,241
197,Servizio ordini non risponde - blocco operativo vendite per ordine urgente,Info su messaggio di coretsia in processo ordini. Il testo visualizzato è corretto ma potrebbe essere più gentile. Valutare rewording per prossima release testi. Modifica editoriale di bassa rilevanza tecnica. con lieve - importo pianificare,Tecnico,alta,74,241
198,Vulnerabilità security: patch richiesta entro 30gg per condizioni commerciali con preventivo,"Domanda generica su logica funzionamento sconti in Linea Accessori. Serve per aggiornare il wiki interno e formare i junior. Il applicativo funziona come atteso, si richiede solo conferma teorica della formula. Da gestire a tempo perso come attività di knowledge sharing. - relativo a  [vedi nota allegata] - pianificare",Tecnico,bassa,92,320
