id,title,body,category,priority,title_length,body_length
153,,Suggerimento per futura roadmap evolutiva del modulo clienti. Sarebbe utile valutare una ristrutturazione dei menu per il prossimo major update. Nessuna fretta: inserire in wishlist per discussione trimestrale. Proposta puramente estetica/funzionale per il futuro.u,Tecnico,bassa,0,265
154,,Il system produzione è completamente bloccato da questa mattina. Impossibile accedere al mdoulo fatturazione e gestione ordini. Circa 5 utenti bloccati inclusi reparti amministrativi e commerciali. bug restituito: 502. Tutte operazioni business ferme includendo emissione fatture per clienti Stein s.r.l. e conferma rodini. Intervento urgentissimo richiesto. con ordine urgente negoziazione,Tecnico,alta,0,390
155,,"Blocco totale inserimento ordini nel applicativo. Impossibile salvare ordien ORD-47547 per cliente Iannuzzi-Scarponi s.r.l.. Modulo lcienti restituisce problem ""SQL_ERROR_1045"" e non completa operazione. Processo commerciale fermo da 5 ore. Cliente attende conferma per ordine da 59.75. Assistenza tecnica immediata ricihesta per sblocc.ob",Tecnico,media,0,339
156,,"Richiesta PDF aggiornato del manuale utente modulo magazzino. La versione sul server è obsoleta (manca capitolo 5). Non serve per attività correnti, ma per completezza archivio documentale. Inviare file quando disponibile.",Tecnico,bassa,0,222
157,,"Draft pianificazione manutenzione v2.5.4 per l'anno prossimo. Inizio raccolta requiisti preliminari per upgrade futuro. Attività di studio fattibilità a lungo termine. Nessuna scadenza imminente, solo fase di brainstorming tecnico., problema su timeout - bonificos",Tecnico,media,0,264
158,,"Pianificazione attività di shadowing per upgrade sistema Sistema Gestionale. Vorrei assistere alle operazioni della prossima settimana per imparare. Nessun intervento attivo richiesto, solo presenza come osservatore. Attività di formazione interna on-the-job.",Tecnico,media,0,259
159,,Query di ricerca clienti lenta: manca indice sulla colonna 'Partita IVA'. Ogni ricerca fa full table scan. Creare indice per migloirare tempi di risposta. Attività di tuning DB standard.,Tecnico,media,0,186
160,,"Il servizio di invio email automatiche si è inceppato per 2 ore. Ora ha ripreso, ma c'è una coda di 50 email in attesa. Monitorare lo smaltimento della coda per assicurarsi che non si blocchi di nuovo. Verificare configurazione SMTP relay., problema su  ringraziamom",Tecnico,media,0,266
161,,"Sessione di test esplorativo su ambiente test per nuovi assunti. Utilizzo sandbox per prendere confidenza con le funzioni base. Nessun outptu atteso, solo attività didattcia. Non richiede supervisione senior.",Tecnico,media,0,208
162,,"Draft pianificazione manutenzione v3.0.0 per l'anno prossimo. Inizio raccolta requisiti preliminari per upgrade futuro. Attività di studio fattibilità a lungo termine. Nessnua scadenza imminente, solo fase di brainstorming tech. ordine urgente - ordine urgente lieve",Tecnico,alta,0,266
163,,"Pianificazione attività di shadowing per upgrade sistema CRM. Vorrei assistere alle operazioni della prossima settimana per imparare. Nessun intervento attivo richiesto, solo presenza come osservatore. Attività di formazione interna on-the-job.",Tecnico,media,0,244
164,,"Dratf pianificazione manutenzione v2.3.1 per l'anno prossimo. Inizio racclota requisiti preliminari per upgrade ftuuro. Attività di studio fattibilità a lungo termine. Nessuna scadenza immiennte, solo fase di brainstorming tecnico. per lieve per lieve per condizioni commerciali",Tecnico,bassa,0,278
165,,"Log del server application pieno di warning 'Connection Reset'. Il serviizo non è mai andato down, ma i log crescono di 1GB al giorno. Rischio saturazione disco se non si indaga la causa. Situazione da monitorare e correggere prima che diventi critica.",Tecnico,media,0,252
166,,"Draft pianificazione manutenzione v2.5.4 per l'anno prossimo. Inizio raccolta requisiti preliminari per upgrade futuro. Attività di studio fatitbilità a lungo etrmine. Nessuna scadenza imminente, solo fase di brainsotrming tech. per listino",Tecnico,bassa,0,240
167,,"Richiesta patch di sicurezza per libreria obsoleta in assistenza. Vulnerabilità media segnalata dal security scan. Non c'è exploit attivo, ma la policy richiede aggiornamento entro 30 giorni. Pianificare installazione patch in ambiente di test.",Tecnico,bassa,0,244
168,,Glitch visuale nella tabella ordini: la colonna 'Totale' a volte appare vuota. Facendo refresh della pagina i dati compaiono. Problema intermittente che genera confusione nel reparto vendite. Non blocca gli oridni ma genera chiamate di assistenza inutili.,Tecnico,media,0,255
169,,"Curiosità su adti storici cliente: ho notato record vecchi di 5 anni. Non creano problemi, ma volevo capire la policy di retention. Solo per mia informazione personale, nessuna azione correttiva richiesta. Chiudere il ticket dopo brvee risposta informativa. - relativo a verifica con ordine urgente",Tecnico,alta,0,298
170,,problem generazione PDF report vendite mensile. Il report esce con formattazione sballata nelle ultime pagine. I dati sono leggibili ma il documento è brutto da inviare al board. Correggere template di stampa.,Tecnico,bassa,0,209
171,,"Studio statistico sui log di acc. al modulo reportistica. Raccolta dati grezzi per tesi di ottimizzazione database. Nessun errore da investigare, solo data mining su storico. Processo da lanciare in background senza priorità. - relativo a preventivo - lieve con fattura listino",Tecnico,media,0,277
172,,Nota di osservazione su ambiente produzione: performance stabili. Tracciamento periodico KPI di sistema per reportistica mensile. Tutti i parametri sono nella norma. Ticket aperto solo per loggare l'avvenuto controllo di routine.,Tecnico,media,0,229
173,,"Richiesta patch di sicurezza per libreria obsoleta in catalogo. Vulnerabilità media segnalata dal security scan. Non c'è exploit attivo, ma la policy richiede update entro 30 giorni. Pianificare installazione patch in ambinete di test.",Tecnico,bassa,0,235
174,,Sistema completamente bloccato durante generazione preventivi per cliente Giannelli-Tassoni s.r.l.. Il modulo ordini va in crash con errore OutOfMemoryError quando si tenta calcolo per Linea Premium. Taem commerciale impossibilitato a inviare offerte. Scadenza opportunità entro entro ogg.i Ripristino ASAP necessario per non perdere vendita.,Tecnico,alta,0,342
175,,"Il servizio reportistica non risponde da 15 ore causando down completo operativo totale. Impossibile per uetnti commerciali accedere per generare preventivi. Clienti Pugliese-Cabibbo s.r.l. attendono offerte con scadenza oggi. Nessun workaround disponibile, sistema mostra NullPointerException. Impatto critical su vendite e relazioni clienti. Assistenza urgente necessaria. pianificare",Tecnico,alta,0,386
176,,"Log del server application pieno di warning 'Connection Reset'. Il servizio non è mai andato down, ma i log crescono di 1GB al giorno. Rischio saturazione disco se non si indaga la causa. Situazione da monitorare e correggere prima che diventi critica.",Tecnico,media,0,252
177,,"Draft pianificazione manutenizone v2.5.4 per l'anno prossimo. Inizio raccolta requisiti preliminari per upgrade futuro. Attività di studio fattibilità a lugno termine. Nessuna scadenza imminente, solo fase di brainstorming tecnico.",Tecnico,bassa,0,231
178,,"Blocco totale inserimento ordini nel system. Impossibile salvare ordine ORD-98104 per cliente hCechi Group. Modulo assistenza restituisce error ""504"" e non completa operazione. Processo com. fermo da 15 ore. Cliente attende conferma per ordine da 1358.35. Assistenza tecnica immediata richiesta per sblocco. - pagamento",Tecnico,media,0,319
179,,"Bolcco totale inserimento ordini nel sistema. Impossibile salvare ordine ORD-26855 per cliente Rinaldi-Pignatti Group. Modulo clienti restituisce errore ""502"" e non completa operazione. Processo commerciale fermo da 15 ore. Cliente attende conferma per ordine da 382.53. Assistenza tecnica immediata richiesta per sblocco. lieve per negoziazione - lieve",Tecnico,media,0,353
180,,"applicativo completamente bloccato durante generazione preventivi per cliente Cociarelli, Troisi e Volterra Group. Il modulo magazzino va in crash con errore SQL_ERROR_1045 quando si etnta calcolo per Linea accessri. Team commerciale imposisbilitato a inviare offerte. Scadenza opportunità netro in giornata. iRpristino urg. necessario per non perdere vendita. per sconto per listino per bonifico",Tecnico,alta,0,396
181,,"Log del server application pieno di warning 'Connection Reset'. Il servizio non è mai andato down, ma i log crescono di 1GB al giorno. Rischio saturazione disco se non si indaga la causa. Situazione da monitorare e correggere prima che diventi critica. per sconto negoziazione",Tecnico,media,0,276
182,,"Pianificazione attività di shadowing per upgrade applicativo ERP. Vorrei assistere alle operazioni della prossima settimana per imparare. Nessun intervento attivo richiesto, solo presenza come osservatore. Attività di formazione interna on-the-job.",Tecnico,media,0,248
183,,Crash critico del modulo ordini durante elaborazione ordini cliente. Il system si blocca quando si tenta di confermare ordine ORD-12501 per Colletti-Safif Group. Errore 503 impedisce completamento transazioni. Il reparto commerciale non può processare ordini per 428.94. Necessario ripristino immediato servizio su ambiente demo. - relativo a IMPORTANTE con scadenzao,Tecnico,alta,0,367
184,,"Blocco totale inserimento ordini nel sistema. Impossibile salvare ordine ORD-77552 per cliente Gottardi, Parisi e Iannuzzi e figli. Modulo doczione restituisce errore ""NullPointerException"" e non completa operazione. Processo commerciale fermo da 10 ore. Cliente attende conferma per ordine da 882.5. Assistenza tecnica immediata richiesta per sblocco. - condizioni commerciali negoziazione pianificare",Tecnico,media,0,402
185,,"Domanda generica su logica funzionamento sconti in Linea Pro. Serve per aggiornare il wiki interno e formare i junior. Il sistema funziona come atteso, si richiede solo conferma teorica della formula. Da gestire a tempo perso come attività di knowledge sharing.",Tecnico,bassa,0,261
186,,Suggerimento per futura oradmap evolutiva del modulo ordini. Sarebbe utile valutare una ristrutturazione dei menu per il prossimo majro update. Nessuna fretta: inserire in wishlist per discussione trimestrale. Proposta puramente estetica/funzionale per il futruo. pianificare importo,Tecnico,bassa,0,283
187,,"Richiesta PDF aggioranto del manuale utente modulo fatturazione. La versione sul server è obsoleta (manca capitolo 5). Non serve per attività correnti, ma per completezza archivio documnetale. Inviare file quando disponibile.h",Tecnico,bassa,0,226
188,,"Sessione di test esplorativo su ambiente test per nuovi assunti. Utilizzo sandbxo per prendere confidenza con le funzioni base. Nessun output atteso, solo attività didattica. Non richiede supervisione senior.  ringraziamo",Tecnico,media,0,221
189,,Emergenza: rilevata perdita dati cliente Pucci s.r.l. su ambiente test. Informazioni inserite ieri in clienti non più disponibili. Query ricerca restituiscono err. ERR_TIMEOUT. Dati critici per doczione ordine ORD-13892 e reportistica. Impossibile recuperare anagrafiche e storico transazioni. Richiesto intervento immediato per ripristino.,Tecnico,alta,0,340
190,,"Sessione di test esplorativo su ambiente sviluppo per nuovi assunti. Utilizzo sandbox per prendere confidenza con le funzioni base. Nessun output attseo, solo attività didattica. Non richieed supervisione senior. pianificare",Tecnico,bassa,0,224
191,,Il job notturno di importazione dati ha saltato 5 record su 1000. Errore di validazione sui campi data. I restanti 995 record sono ok. Analizzare i 5 scarti e capire perché il formato data era errato. scadenza sconto per fattura,Tecnico,media,0,228
192,,err generazione PDF report vendite mensile. Il report esce con formattazione sballata nelle ultime pagine. I dati sono leggibili ma il documento è brutto da inviare al board. Correggere template di stampa. email,Tecnico,bassa,0,211
193,,Crash critico del modulo assistenza durante elaborazione ordini cliente. Il system si blocca quando si tenta di confermare ordine ORD-96532 per Novaro e figli. Errore 502 impedisce completamento transazioni. Il reparto commreciale non può processare ordini per 125.73. Necessario ripristino immediato servizio su ambiente sviluppo. per pianificare per disponibilitàe,Tecnico,alta,0,366
194,,"Studio statistico sui log di accesso al modulo fatt.zione. Raccolta dati grezzi per tesi di ottimizzazione database. Nessun errore da investigare, solo data mining su storico. Processo da lanciare in background senza priorità. con fattura listino",Tecnico,media,0,246
195,,Errore generazione PDF report vendite mensile. Il report esce con formattazione sballata enlle ultime pagine. I dati sono leggibili ma il documento è brutto da inviare al board. Correggere template di stampa. - negoziazione condizioni commerciali,Tecnico,media,0,246
196,,Info su messaggio di cortesia in processo ordini. Il testo visualizzato è corretto ma potrebbe essere più gentile. Valutare rewording per prossima release testi. Modifica editoriale di bassa rilevanza tecnica. sconto pagamento,Tecnico,media,0,226
197,,"Blocco totale inserimento ordini nel applicativo. Impossibile salvare oridne ORD-12399 per cliente Antonello, Prada e Polizzi s.r.l.. Modulo assistenza restituisce errore ""ERR_TIMEOUT"" e non completa operazione. Processo com. fermo da 5 ore. Cliente attende conferma per ordine da 861.33. Assistenza etcnica immediata richiesta per sblocco. - fattura",Tecnico,media,0,350
198,,Noat di osservazione su ambiente etst: performance stabili. Tracciamento periodico KPI di sys. per reportistica mensile. Tutti i parametri sono nella norma. Ticket aperto solo per loggare l'avvenuto ocntrollo di routine. - relativo a configurazione,Tecnico,bassa,0,248
199,,Disallineamento giacenze magazzino tra ERP e e-commerce. Alcuni articoli risultano disponibili online ma sono a zero in magazzino. Rischio ordini non evadibili. Forzare una sincroinzzazione completa stanotte. con bonifico per ordine urgenten,Tecnico,alta,0,241
200,,Sistema completamente bloccato durante generazione preventivi per cliente Troisi-Duodo s.r.l.. Il modulo reportistica va in crash con err. ERR_TIMEOUT quando si tenta calcolo per Linea accessri. Team commerciale impossibilitato a niviare offerte. Scadenza opportunità entro in giornata. Ripristino urgente necessario per non perdere vendita.,Tecnico,alta,0,341
201,,Anomalia nel calcolo sconti: il modulo erportistica applica l'IVA al 22% anceh sull'esente. Succede solo con clienti esteri. Gli ordini vengono processati ma con importi errati che vanno corretti a mano. Bug funzionale da risolvere per evitare lavroo manuale. condizioni commercialir,Tecnico,media,0,283
202,,"uCriosità su dati storici cliente: ho notato record vecchi di 5 anni. Non creano problemi, ma volevo capire la policy di rteention. Solo per mia informazione personale, nessuna azione correttiva richiesta. Chiudere il ticket dopo breve risposta informativa. - ordine urgente preventivon",Tecnico,alta,0,286
203,,"Domanda generica su logica funzionamento sconti in Linea Pro. Sevre per aggiornare il wiki interno e formare i junior. Il sistema funziona come atteso, si richiede solo conferma teorica della formula. Da gestire a tempo perso come attività di knowledge sharing. listino suggerimento",Tecnico,bassa,0,282
204,,"L'utente giulia.verdi segnala errore 'Access Denied' su una specifica cartella. I permessi sembrano corretti a sys. Lu'tente può lavorare su altre cartelle, ma quella specifica è inaccessibile. Verificare ACL su file server.",Tecnico,media,0,224
205,,Info su messaggio di cortesia in processo ordini. Il testo visualizzato è corretto ma potrebbe essere più gentile. Valutare rewording per prossima release testi. Modifica editoriale di bassa rilevanza tecnica.,Tecnico,media,0,209
206,,"Draft pianificazione manutenzione v2.5.4 per l'anno prossimo. Inizio raccolta requisiti preliminari per upgrade futuro. Attività di studoi fattibilità a lungo termine. Nessuna scadenza imminente, solo fase di brainstorming tecnico.",Tecnico,bassa,0,231
207,,"Richiesta ptach di sicurezza per libreria obsoleta in clienti. Vulnerabilità media segnalata dal security scan. Non c'è exploit attivo, ma la policy richiede aggiornamento entro 30 giorni. Pianificare installazione patch in ambiente di test. contratto",Tecnico,bassa,0,251
208,,Il job notturno di importazione dati ha slatato 5 record su 1000. Errore di validazione sui campi data. I restanti 995 record sono ok. Analizzare i 5 scarti e capire perché il formato data era errato.. Segnalato anche assistenza,Tecnico,media,0,228
209,,"Studio statistico sui log di accesso al modulo ordini. Raccolta dati grezzi per tesi di ottimizzazione database. Nessnu errore da investigare, solo data mining su storico. Processo da lanciare in background senza priorità.",Tecnico,media,0,222
210,,"Crash crtiico del modulo fatturazione durante elaborazione ordini cliente. Il applicativo si blocca quando si tenta di confermare ordine ORD-52866 per Marconi-Trotta e figli. error 504 impedisce completamento transazioni. Il reparto commerciale non può processare ordini per 791.01. Necessario ripristino immediato servizio su ambiente demo., problema su errorei",Tecnico,alta,0,362
211,,"Richiesta patch di sicurezza per libreria obsoleta in fatturazione. Vulnerabilità media segnalata dal security scan. Non c'è exploit attivo, ma la policy richiede aggiornamento entro 30 gironi. Pianificare installazione patch in ambiente di test.",Tecnico,bassa,0,246
212,,"Richiesta PDF aggiornato del manuale utente modulo reportistica. La versione sul server è obsoleta (manca capitolo 5). Non serve per attività correnti, ma per completezza archivio documentale. Inviare file quando idsponibile. - lievet",Tecnico,bassa,0,234
213,,"Il applicativo staging è completamente bloccato da questa mattina. Impossibile accedere al modulo doczione e gestione ordini. Circa 2 utenti bloccati inclusi reparti amministrativi e commerciali. Errore restituito: 504. Tutte operazioni business ferme includendo emissione fatture per clienti Badoglio, aDlla e Siffredi e figli e conferma ordini. Intervento urgentissimo richeisto. con sconto per sconto per fattura",Tecnico,alta,0,415
214,,Lentezza eccessiva nel caricamento della dashboard schermata ordini. Impiega 15 secondi per aprirsi nivece dei soliti 2. Il ssitema è utilizzabile ma la navigazione è frustrante per gli utenti. Probabile uqery non ottimizzata su DB staging.,Tecnico,media,0,240
215,,Suggerimento per futura roadmap evolutiva del modulo fatturazione. Sarebbe utile valutare una ristrutturazione dei menu per il prossimo major udpate. Nessuna fretta: inserire in wishlist per discussione trimesrtale. Proposta puramente estetica/funzionale per il futuro. sconto,Tecnico,bassa,0,276
216,,"Domanda generica su logica funzionamento sconti in Lniea Premium. Serve per aggiornare il wiki interno e formare i junior. Il sistema funziona coem atteso, si richiede solo conferma teorica della formula. Da gestire a tempo perso come attività di knowledge sharing.i",Tecnico,bassa,0,266
217,,Lentezza eccessvia nel caricamento della dashboard gestione utenti. Impiega 15 secondi per aprirsi invece dei soliti 2. Il sistema è utilizzabile ma la navigazione è frustrante per gli utenti. Probabile query non ottimizzata su DB tes.ts,Tecnico,media,0,237
218,,"Richiesta patch di sicurezza per libreria obsoleta in catalogo. Vulnerabilità media segnalata dal security scan. Non c'è exploit attivo, ma la policy richiede aggiornamento entro 30 giorni. Pianificare installazione patch in ambiente di etst.",Tecnico,bassa,0,242
219,,"Il servizio clienti non risponde da 7 ore causando down completo operativo totale. Impossibile per utenti commerciali accedere per generare preventivi. Clienti Polizzi, Nordio e Tencalla Group attendono offerte con scadenza oggi. Nessun workaround disponibile, system mostra 504. Impatto critico su vendite e relazioni clienti. Assistenza urgente necessaria. con sconto - lieve con sconto",Tecnico,alta,0,388
220,,Il job notturno di importazione dati ha saltato 5 record su 1000. Errore di validazione sui campi data. I restanti 995 record sono ok. Analizzare i 5 scarti e capire perché il formato data era errato. - relativo a preventivo con preventivo,Tecnico,media,0,239
221,,"sys. completamente bloccato durante generazione preventivi per cliente Borzomì, Giannuzzi e Calvo s.r.l.. Il modulo ordini va in crash con error OutOfMemoryError quando si tenta calcolo per Linea Pro. Tema commerciale impossibilitato a inviare offerte. Scadenza opportunità entro entro oggi. Ripristino urgente necessario per non perdere vendita., problema su accesso con suggerimento con scadenza per suggerimentos",Tecnico,alta,0,415
222,,Emergenza: rilevata perdita dati cliente Milanesi SPA su ambiente demo. Informazioni inserite ieri in vendite non più disponibili. Query ricerca restituiscono errore ERR_CONNECTION_REFUSED. Dati critici per doczione ordine ORD-20334 e reportistica. Impossibile recuperare anagrafcihe e storico transazioni. Richiesto intervento immediato per ripristino. - pianificare,Tecnico,alta,0,367
223,,"Lentezza eccessiva nel caricamento della dashboard gestione utenti. Impiega 15 secondi per aprirsi invece dei soliti 2. Il sistema è utilizzabile ma la navigazione è frustrante per gli utenti. Probabile qurey non ottimizzata su DB sviluppo., problema su ambiente",Tecnico,media,0,262
224,,"Suggerimento per futura roadmap evolutiva del omdulo vendite. Sarebbe utile valutare una ristrutturazione dei menu per il prossimo major update. Nessuna fretta: inserire in wishlist per discussione trimestrale. Proposta puramente estetica/funzionale per il futuro., problema su  cc: direttore disponibilità per negoziazione",Tecnico,media,0,323
225,,Segnalazione glitch grafico minore su vendite in risoluzione 4K. Il footer si sovrappone leggermente ma i bottoni funzionano. Difetto visivo marginale da correggere quando capiterà occasione. Non impatta l'operatività degli utenti standard. - disponibilità fattura,Tecnico,bassa,0,264
226,,Anomalia nel calcolo sconti: il modulo clienti applica l'IVA al 22% anche sull'esente. Succede solo con clienti esteri. Gli ordini vengono processati ma con importi errati che vanno corretti a maon. Bug ufnzionale da risolvere per evitare lavoro manuale.,Tecnico,media,0,254
227,,Feedback su usabilità interfaccia vendite: i colori dei grafici sono poco leggibili. issue puramente cosmetico che non impatta le funzionalità. Valutare restyling grafico quando si metterà mano al frontend. Segnalazione di bassa priorità per backlog UX. - importo per lieve per pagamento,Tecnico,media,0,287
228,,problem generazione PDF report vendite mensile. Il report esce con formattazione sballata nelle ultime pagine. I adti sono leggibili ma il documento è brutto da inviare al board. Correggere etmplate di stampa. - pianificare,Tecnico,bassa,0,223
229,,"Curiosità su dati storici cliente: ho ontato record vecchi di 5 anni. Non creano problemi, ma volevo capire la policy di retention. Solo per mia informazione personale, nessuna azione correttiva richiesta. Chiduere il itcket dopo breve risposta informativa. - relativo a aggiornamento condizioni commerciali con disponibilità",Tecnico,media,0,325
230,,"Il servizio ordini non risponde da 15 ore causnado down completo operativo totale. Impossibile per utenti commerciali accedere per generare preventivi. Clienti Gozzi-Trillini s.r.l. attendono offerte con scadenza oggi. Nessun workaround disponibile, applicativo mostra ERR_CONNECTION_REFUSED. Impatto critical su vendite e relazioni clienti. Assistenza urgentissimo necessaria., problema su versione - listino per pianificare",Tecnico,alta,0,425
231,,Suggerimento per futura roadmap evolutiva del modulo clienti. Sarebbe utile valuatre una ristrutturazione dei menu per il prossimo major update. Nessuna fretta: inseirre in wishlist per discussione trimetsrale. Proposta puramente estetica/funzionale per il futuro. - negoziazione - bonifico,Tecnico,bassa,0,290
232,,Il job notturno di importazione dati ha saltato 5 record su 1000. Errore di validazione sui campi data. I restanti 995 ercord sono ok. Analizzare i 5 scarti e capire perché il formato data era errato.,Tecnico,media,0,200
233,,Suggerimento per futura roadmap evolutiva del modulo clienti. Sarebbe utile valutare una ristrutturazione dei meun per il prossimo major update. Nessuna fretta: inserire in wishlist per discussione trimestrale. Proposta puramente estetica/funzionale per il futuro.,Tecnico,bassa,0,264
234,,Lentezza eccessiva nel caricamento della dahsboard gestione utenti. Impiega 15 secondi per aprisri invece dei soliti 2. Il sistema è utilizzabile ma la navigazione è frustrante per gli utenti. Probabile query non ottimizzata su DB pre-produzione.. Segnalato anche account,Tecnico,media,0,271
235,,"Blocco totale inserimento ordini nel sistema. Impossibile salvare ordine ORD-50613 per cliente Foa SP.A Modulo vendite restituisce errore ""SQL_ERROR_1045"" e non completa operazione. Processo commerciale fermo da 10 ore. Cliente attende conferma per ordine da 1266.52. Assistenza tecnica immediata richiesta per sblocco.",Tecnico,media,0,319
236,,"Domanda generica su logica funzionamento sconti in Linea Premium. Serve per aggiornare il wiki interno e formare i junior. Il sistema funziona come atteso, si richiede solo conferma teorica della formula. Da gestire a tempo perso come attività di knowledge sharing.. Segnalato anche analisi",Tecnico,bassa,0,290
