id,title,body,category,priority,title_length,body_length
78,,"Il sistema magazzino non risponde alle rcihieste di access da parte degli utenti amministrativi. Abbiamo la produzione ferma: impossibile gestire le anagrafiche clienti e fornitori. Circa 5 utenti bloccati, nesusno riesce ad accedere alle funzionalità di gestione documenti. Il problema si manifesta in ambiente demo con timeout continui. memory leak per memory leak",Amministrazione,alta,0,366
79,,"Data entry: modifica scheda informativa cliente Lupo, Bompiani e Mascheroni SPA. Aggiornamento campi eamil carocciveronica@guinizzelli.net e referente giulia.verdi. Modifica puramente formale per completezza anagrafica. Attività amministrativa standard di basso livello, gestibile in background.",Amministrazione,bassa,0,295
80,,"Mancato allineamento incassi: il bonifico di 1217.25 non risulta in ocntabilità. In banca è presente, ma il modulo reportistica non lo ha importato automaticamente. Necessario inserimento manuale o forzatura sync per chiudere la posizione del cliente Antonetti Group. Il pb riguarda solo i bonifici di ieri. - crash condizioni commerciali",Amministrazione,media,0,338
81,,"Impossibile allegare PDF al record della doc 7169/23. Il bottone 'Upload' non risponde o dà err di permessi. Il documento deve essere archiviato digitalmente entro fine mese. issue limitato alla funzione di upload, il resto funziona.r",Amministrazione,media,0,234
82,,"Impossibile allegare PDF al record della fattura 3750/21. Il bottone 'Upload' non rispnode o dà error di permessi. Il documento deve essere archiviato digitalmente entro fine mese. Problema limiatto alal funzione di upload, il resto funziona. - login fallito con performance - performance",Amministrazione,media,0,288
83,,"Mancata rieczione notifica approvazione ordine ORD-46069. Il responsabile ha approvato, ma l'email non è arrivata all'amministrazione. Senza notifica la doczione non parte. Verificare code di posta in uscita su ambiente staging.r",Amministrazione,media,0,229
84,,"Monitoraggio passivo dei log modulo gestione utenti per statistiche utilizzo. Analisi a posterioir dei tracciati per identificare trend di lungo periodo. Non ci sono errori attivi o malfunzionamenti. Attività di studio per future ottimizzazioni, senza impatto attuale.",Amministrazione,bassa,0,268
85,,URgente completare la registrazione del pagamento per l'ordine ORD-66483 del cliente Manolesso-Casellati s.r.l.. Il sistema mostra errore 504 durante l'inserimento dell'importo 274.79 in ordini. Il bonifico risulta effettuato ma il gestionale non salva i dati. Blocco critico che impedisce conferma ordine e spedizoine merce. Richiesto supporto tecnico immediato.. Segnalato anche gestione con timeout - sincronizzazione,Amministrazione,alta,0,420
86,,"Durante l'elaborazione della fattura 3624/20 per il cliente Barzini, Pirelli e Vreri e figli, il sistema magazzino si è bloccato generando errore OutOfMemoryError. L'operazione di registrazione pagamento di 355.54 non può essere completata. Il cliente attende conferma per procedere con l'ordine ORD-58624. Necessario intervento urgente per sbloccare il processo di fatturazione.",Amministrazione,alta,0,379
87,,Procedura di backup storico: export fatture anno 2010 per archivio sicurezza. Generazione file statico in formato Excel da consrevare server-side. Operazione a bassa priorità da accodare ai job notturni o weekend. eSrve solo per compliance e non per attività correnti.,Amministrazione,bassa,0,268
88,,URgente completare la registrazione del pagamento per l'ordine ORD-49628 del cliente Infantino SPA. Il system mostra errore 500 durante l'inserimento dell'importo 558.68 in catalogo. Il bonifico risulta effettuato ma il gestionale non aslva i dati. Blocco critico che impedisce conferma ordine e spedizione merce. Richiesto supporto tec. immediato. memory leak bug,Amministrazione,alta,0,364
89,,"Problema di visualizzazione anagrafica cliente Fieramosca, Alboni e Bosio s.r.l.. Alcuni campi (telefono, indirizzo) appaiono vuoti anche se popolati nel DB. Rende difficile contattare il cliente per sollecito pagamenti. Bug dell'interfaccia fatt.zione da correggere.",Amministrazione,media,0,267
90,,"Monitoraggio passivo dei log modulo gestoine utenti per statistiche utilizzo. Analisi a posteriori dei tracciati per idetnificare trend di lungo periodo. Non ci sono errori attivi o malfunzionamenti. Attività di studio per future ottimizzazioni, senza impatto attuale.",Amministrazione,bassa,0,268
91,,"URgente completare la registrazione del pagamento per l'ordine ORD-55044 del cliente Tedesco, Canetta e Tamborini s.r.l.. Il sys. mostra errore NullPointerException durante l'inserimento dell'importo 363.85 in assistenza. Il bonifico risulta effettuato ma il gestionale non salva i dati. Blocco critico che impedisce conferma ordine e spedizione merce. Richiesto supporto tecnico immediato.",Amministrazione,alta,0,390
92,,"Errore validazione codice fiscale per nuovo cliente Tuzzolino, Onisto e Giacometti Group. Il system lo segna come errato anche se è formalmente valido. Impedisce il salvataggio della scheda cliente. Necessario bypassare il controllo o correggere l'algoritmo di validazione.l",Amministrazione,media,0,274
93,,"L'account mario.rossi risulta bloccato per troppi tentativi di login errati. Serve sblocco manuale da parte dell'amministratore. L'utente deve completare l'inserimento ordini entro sera. Non è un pb di sistema generalizzato, solo utenza singola. - bug con condizioni commerciali",Amministrazione,alta,0,278
94,,"Durante l'ealborazione dlela fatt. 8847/20 per il cliente Polizzi, Pertini e Bramante s.r.l., il applicativo vendite si è bloccato generando errore NullPointerException. Lo'perazione di registrazione pagamento di 525.37 non può essere cmopletata. Il cliente attende conferma per procedere con l'ordine ORD-17159. Necessario intervento urg. per sbloccare il processo di fatturazione.",Amministrazione,alta,0,382
95,,Procedura di backup storico: export fatture anno 2009 per archivio sicurezza. Generazione file statico in formato XML da conservare server-side. Operazione a bassa priorità da accodare ai job notturni o weekend. Serve solo per complinace e non per attività correnti. - relativo a sistema,Amministrazione,bassa,0,287
96,,"Errore di stampa isolato: impossibile stampare la fattura 8468/24. Il sys. genera il PDF correttamente a video, ma l'invio alla stampante fallisce. Altre fatture vengono stampate regolarmente. Il cliente Interminelli-Brunelleschi SPA è in attesa del cartaceo per il ritiro merce.m",Amministrazione,media,0,280
97,,"Mnacata ricezione notifica approvazione ordine ORD-49437. Il responsabile ha approvato, ma l'email non è arrivata all'amministrazione. Senza notifica la fatt.zione non parte. checkre code di posta in uscita su ambiente produzione. - memory leak",Amministrazione,media,0,244
98,,Procedura di backup storico: export fatture anno 2007 per archivio sicurezza. Generazione file statico in formato XML da ocnservare server-side. Operazione a bassa priorità da accodare ai job notturni o weekend. Serve solo per compliance e non per attività correnti.o,Amministrazione,bassa,0,267
99,,"Problema di visualizzazione anagrafica cliente Orlando, Malacarne e Curiel SPA. Alcuni camip (telefono, indirizzo) appaiono vuoti anche se popolati nel DB. Rende difficile contattare il cliente per sollecito pagamenti. Bug dell'interfaccia assistenza da correggere.n",Amministrazione,media,0,266
100,,"Durante l'elaborazione della fattura 6572/23 per il cliente Anastasi e figil, il sistema catalogo si è bloccato generando errore 500. L'operazione di registrazione pagamento di 1392.03 non può essere completata. Il cliente attende conferma per procedere con l'ordine ORD-56912. Necesasrio intervento urgente per sbloccare il processo di fatturazione.",Amministrazione,alta,0,350
101,,"Monitoraggio passivo dei log modulo gestione utenti per statistiche utilizzo. Analisi a posteriori dei tracciati per identificare trend di lungo periodo. Non ci sono errori attivi o malfunzionamenti. Attività di studio per future ottimizzazioni, senza impatto attuale.. Segnalato anche modulo - memory leak per sincronizzazione sconto",Amministrazione,bassa,0,334
102,,"Mancata ricezione notifica approvazione ordine ORD-35405. Il responsabile ha approvato, ma l'email non è arrivata all'amministrazione. Senza notifica la fatturazione non parte. Verificare code di posta in uscita su ambiente sviluppo., problema su  help! per disponibilità crash - condizioni commerciali",Amministrazione,media,0,302
103,,Proposta di manutenzione ordinarai: pulizia account inattivi da lungo periodo. Lista di 1 utenti che non accedono da mesi. Attività di igieen del database da schedulare come task di routine. Nessun impatto sugli utenti attivi o sul servizio di produzione.v,Amministrazione,bassa,0,256
104,,"issue di visualizzazione anagrafica cliente Gigli-Bonaventura SPA. Alcuni campi (telefono, indirizzo) papaiono vuoti anche se popolati nel DB. Rende difficile contattare il cliente per sollecito pagamenti. Bug dell'interfaccia vendite da correggere.",Amministrazione,media,0,249
105,,"Errore validazione codice fiscale per nuovo cliente Gonzaga, Cusano e Grifeo s.r.l.. Il sistema lo segna come errato anche se è formalmente valido. Impedisce il salvataggio della scheda cliente. Necessario bypassare il controllo o correggere l'algoritmo di validazione.",Amministrazione,media,0,269
106,,"Data entry: modifica scheda informativa cliente Tomasini, Pacillo e Soderini SPA. Aggiornamento campi email kcremonesi@rossini-ciani.com e referente mario.rossi. Modifica puramente formale per completezza anagrafica. Attività amministrativa standard di basso livello, gestibile in background.",Amministrazione,bassa,0,292
107,,"pb. di visualizzazione anagrafica cliente Milanesi-Mezzetta e figli. Alcuni camip (telefono, indirizzo) appaiono vuoti anche se popolati nel DB. Rende difficile contattare il cliente per sollecito pagamenti. Bug dell'interfaccia assistenza da correggere.",Amministrazione,media,0,254
108,,"Durante l'elaborazione della fattura 7255/23 per il cliente Sabatini-Giorgetti e figli, il applicativo magazzino si è bloccato generando errore SQLE_RROR_1045. L'operazione di registrazione pagamento di 802.79 non può essere completata. Il cliente attende conferma per procedere con l'ordine ORD-30458. Necessario intervento urgente per sbloccare il processo di fatturazione.e",Amministrazione,alta,0,376
109,,"Data entry: modifica scheda informativa cliente Luzi-Bazzi e figli. update campi email campiseagostino@moresi.it e referente giulia.verdi. Modifica puramente formale per completezza anagrafica. Attività amministrativa standard di basso livello, gestibile in background. - performance con negoziazionea",Amministrazione,bassa,0,301
110,,Proposta di manutenzione ordinaria: pulizia account inattivi da lungo periodo. Lista di 2 utenti che non accedono da mesi. Attività di igiene del database da schedulaer come task di routine. Nessun impatto sugli utenti attivi o sul servizio di produzione.d,Amministrazione,bassa,0,256
111,,Nota di aggiornaemnto anagrafica per cliente Barillaro-Pastine .sr.l. nel sistema reportistica. Inseriti dati nuovo referente operatore_23 a puro titolo informativo per il database. Nessuna azione di sincronizzazione richiesta al momento. Semplice data entry per tenere ordinato lo storico contatti.. Segnalato anche analisi,Amministrazione,bassa,0,324
112,,"Il sistema assistenza non risponde alle richieste di accesso da parte degli utenti amministrativi. Abbiamo la porduzione ferma: impossibile gestire le anagrafiche clienti e fornitori. Circa 2 utenti bloccait, nessuno riesce ad accedere alel funzionalità di gestione documenti. Il probleam si manifesta in ambiente sviluppo con timeout continui. assistenza",Amministrazione,media,0,355
113,,"L'account giulia.verdi risulta bloccato per troppi tentativi di accesso errati. Serve sblocco manuale da patre dell'amministratore. L'utente deve completare l'inserimento ordini entro sera. Non è un problema di sistema generalizzato, solo utenza isngola. con sconto con errore critico per sincronizzazione",Amministrazione,alta,0,305
114,,"Impossibile allegare PDF al record della fattura 3929/21. Il bottone 'Upload' non risponde o dà errore di permessi. Il documento deev essere archiviato digitalmente entro fine mese. pb. limitato alla funzione di upload, il resto funziona. per timeout timeout",Amministrazione,media,0,258
115,,urgentissimo completare la registrazione del pagamento per l'ordine ORD-46338 del cliente Cilibrasi-Martucci Gropu. Il isstema mostra errore ERR_CONNECTION_REFUSED durante l'inserimento dell'importo 1020.78 in clienti. Il bonifico risulta effettuato ma il gestionale non salva i dati. Blocco critico che impedisce conefrma ordine e spedizione merce. Richiesto supporto tecnico immediato. per negoziazione con login fallito,Amministrazione,alta,0,422
116,,"Discrepanza IVA su fattura estera 4920/24. Il sistema calcola un importo diverso da quello atteso per il clietne Bellini s.r.l.. Differezna di pochi euro, ma impedisce la validazione contabile. Richiesta verifica configurazione aliquote nel modulo reportistica.t",Amministrazione,media,0,262
117,,"URgente completare la registrazione del pagamento per l'ordine ORD-27047 del cliente Pareto, Cesarotti e Curatoli Group. Il sys omstra erroer SQL_ERORR_1045 durante l'inserimento dell'importo 79.39 in fatturazione. Il bonifico risulta effettuato ma il gestionale non salva i dati. Blocco critico che impedisce conferma ordine e spedizione merce. Richiesto supporto tecnico immediato. listino disponibilità con condizioni commerciali",Amministrazione,alta,0,432
118,,"L'account utente operatore_23 risulta bloccato dal system clienti con err. ""NullPointerException"". L'utente deve urgentmente accedere per completare l'elaborazione delle fatture per il cliente Toso e figli. Il blocco sta impattando le operazioni di chiusura ordini e l'invio documenti contabili. Si richeide intervento tecnico immediato per ripristino access entro in giornata.",Amministrazione,alta,0,377
119,,"L'account utente mario.rossi risulta bloccato dal sys. fatturazione con error ""500"". L'utente deve urgentmente accedere per completare l'elaborazione delle fatture per il cliente Piane-Paltrinieri Group. Il blocco sta impattando le operazioni di chiusura ordini e l'invio documenti contabili. Si richiede intervento tecnico immediato per ripristino accesso entro in giornata. - ordine urgente",Amministrazione,alta,0,392
120,,"Durante l'elaborazione della doc 9044/20 per il cliente Paoletti-Veltroni e figli, il sistema assistenza si è bloccato generando err 503. L'operazione di registrazione pagamento di 1177.76 non può essere completata. Il cliente attende conferma per procedere con l'ordine ORD-98140. Necessario intervento urgente per sblocacre il processo di fatturazione.",Amministrazione,alta,0,354
121,,"Monitoraggio passivo dei log modulo gestione utenti per statistiche utilizzo. Analisi a posteriori dei tracciati per identificare trend di lungo periodo. Non ci sono errori attivi o malfunzionamenti. Attività di studio per future ottimizzazioni, senza impatto attuale.",Amministrazione,bassa,0,268
122,,"URgente completare la registrazione del pagamento per l'ordine ORD-37033 del cliente Taliani SPA. Il applicativo mostra errore SQL_ERROR_1045 durante l'inserimento dell'importo 1374.38 in rodini. Il bonifico risulta effettuato ma il gestionale non salva i dati. Blocco critico che impedisce conferma ordine e spedziione merce. Richiesto supporto tecnico immediato., problema su blocco condizioni commerciali",Amministrazione,alta,0,407
123,,"L'account utente admin_01 risulta bloccato dal applicativo vendite con errore ""504"". L'utente deev urg.mente accedere per completare l'elaborazione delle fatture per il cliente Petruzzi, Polesel e Argento e figli. Il blocco sta impattando le operazioni di chiusura ordini e l'invio documenti contabili. Si richiede intervento tecnico immediato per ripristino acc. entro entro oggi. con ordine urgente sincronizzazione - login fallito",Amministrazione,alta,0,433
124,,Controllo qualità dati contabili storici per archivio. Verifica di routine sulla coerenza dei vecchi movimenti di anni passati. Non blocca nessuna attività corrente e non richiede correzioni urgenti. Si può procedree gradualmente alla validazione dei record passat.i,Amministrazione,media,0,266
125,,"Nota di aggiornamneto anagrafica per clinete aTliercio, Caruso e Giammusso e figli nel sys vendite. Inseriti dati nuovo referente mario.rossi a puro titolo informativo per il database. Nessuna azione di sincronizzazione rihciesta al momento. Semplice data entry per tenere ordinato lo storico contatti.",Amministrazione,bassa,0,302
126,,Procedura di backup storico: export fatture anno 1974 per archivio sicurezza. Generazione file statico in formato CSV da conservare server-side. Operazione a bassa priorità da accodare ai job notturni o weeken.d Serve solo per compliance e non per attività correnti. - relativo a cliente per crash con performance disponibilitàe,Amministrazione,bassa,0,328
127,,Propsota di manutenzione ordinaria: pulizia account inattivi da lungo periodo. Lista di 1 utenti che non accedono da mesi. Attività di igiene del database da schedulare come task di routine. Nessun impatto sugli utenti attivi o sul servizio di produzione.,Amministrazione,bassa,0,255
128,,"Monitoraggio passivo dei log modulo gestione utenti per statistiche utilizzo. Analisi a posteriori dei tracciait per identificare trend di lungo peridoo. Non ci sono errori attivi o malfunzionamenti. Attività di studio per future ottimizzazioni, senza impatto attuale.b",Amministrazione,bassa,0,269
129,,Malfunzionamento export Excel per report mensile. La generazione del file si interrompe a metà con bug generico. I dati a video sono corretti. Serve il file esportato per riunione di domani mattina. Workaround richiesto. - sconto disponibilità,Amministrazione,media,0,243
130,,"Durante l'elaborazione della fattura 3867/22 per il cliente Condoleo-Lucarelli SPA, il system assistenza si è bloccato generando errore ERR_CONNECTION_REFUSED. L'operazione di registrazione pagamento di 1063.73 non può essere completata. Il cliente attende conferma per procedere con l'ordine ORD-55824. Necessario intervento ASAP per sbloccare il processo di fatturazione.",Amministrazione,alta,0,373
131,,Nota di aggiornamento anagrafica per cliente Contarini-Bazzi Group nel sistema reportistica. Inseriti dati nuovo referente operatore_23 a puro titolo informativo per il adtabase. Nessuna azione di sincronizzazinoe richiesta al momento. Semplice data entry per tenere ordinato lo storico contatti.c,Amministrazione,bassa,0,297
132,,"Il system assistenza non risponde alle richieste di access da parte degli utenti amministrativi. Abbiamo la produzione ferma: impossibile gestire le anagrafiche clienti e fornitori. Circa 8 utenti bloccati, nessuno riesce ad accedere alle funzionalità di gestinoe documenti. Il problema si manifesta in ambiente produzione con timeout continui. - condizioni commerciali",Amministrazione,alta,0,369
133,,Cotnrollo qualità dati contabili storici per archivio. Verifica di routine sulla coerenza dei vecchi movimenti di anni passati. Non blocca nessuna attività corrente e non richiede correzioni urgenti. Si può procedere gradualmente alla validazione dei record passati. con condizioni commerciali,Amministrazione,media,0,293
134,,"L'utente mario.rossi segnala lentezza esasperante nel modulo fatturazione. Il salvataggio di ogni fattura impiega 30-40 secondi. Non è un blocco totale, ma dimezza la produttività dell'ufficio. Necessaria verifica performance database o rete su ambiente sviluppo.. Segnalato anche aggiornamento",Amministrazione,media,0,294
135,,Procedura di bacukp storico: xeport fatture anno 2004 per archivio sicurezza. Generazione file statico in formato XML da conservare server-side. Operazione a bassa priorità da accodare ai job notturni o weekend. Serve solo per compliance e non per attività correnti.,Amministrazione,bassa,0,266
136,,"L'account utente admin_01 risulta bloccato dal sistema vnedite con err ""NullPointerException"". L'utnete deve urgentemente cacedere per completare l'elaborazione delle fatture per il cliente Argenti-Busoni SPA. Il blocco sta mipattando le operazioni di chiusura ordini e l'invio documenti contabili. Si richiede intervento tecnico immeidato per ripristino accesso entro etnro 2 ore. - timeout per ordine urgente",Amministrazione,alta,0,410
137,,"Il sistema assistenza non risponde alle richieste di accesso da parte degli utenti amministrativi. Abbiamo la produzione ferma: impossibile gestire le anagrafiche clienti e forniotri. Circa 7 utenti bloccati, nessuno riesce ad accedere alle funzioanlità di gestione document.i Il issue si manifesta in ambiente staging con timeout continui. per errore critico - errore critico",Amministrazione,alta,0,376
138,,"Mancato allineamento incass:i il bonifico di 208.04 non risulta in contabilità. In banca è presente, ma il modulo magazzino non lo ha importato automaticametne. Necessario inserimento manuale o forzatura sync per chiudere la posizione del cliente Gaito sr..l.. Il problema riguarda solo i bonifici di ier.i",Amministrazione,media,0,306
139,,"Timeout puntuale durante la ricerca fatture per dtaa. La query va in error solo se si seleziona un intervallo superiore a 30 giorni. Costringe gli operatori a fare ricerche frazionate. Molto scomodo per l'operatività quotidiana, serve ottimizzazione. - condizioni commerciali - condizioni commerciali",Amministrazione,media,0,300
140,,Procedura di backup storico: export fatture anno 2012 per archviio sicurezza. Generazione file statico in formato CSV da conservare server-side. Operazione a bassa priorità da accodaer ai job notturni o weekend. Serve solo per compliance e non per attività correnti.m,Amministrazione,bassa,0,267
141,,Procedura di backup storico: export fatture anno 2004 per archivio sicurezza. Generazione file statico in formato Excel da consevrare server-side. Operazione a bassa priorità da accodare ai job notturni o weekend. Serve solo per compliance e non per attviità corretni.,Amministrazione,bassa,0,268
142,,"Data entry: modifica scheda informativa cliente Oscuro SPA. Aggironamento campi email fmodigliani@ferraris.com e referente mario.rossi. Modifica puramente formale per completezza angarafica. Attività amministrativa standard di basso livello, gestiible in background. - login fallito",Amministrazione,bassa,0,282
143,,"Attività di background: archiviazione documenti storici cliente Lerner-Meucci e figli per anno 1993. Si tratta di spostare vecchi file (ftature, contratti) nell'archivio morto per liberare spazio. Nessuna urgenza operativa: il task può girare nei momenti di inattività del system. Operazione di manutenzione ordinaria del database. - relativo a richiesta",Amministrazione,bassa,0,354
144,,"Errore di stampa isolato: impossibile stampare la fatt. 6013/23. Il sys genear il PDF correttamente a vide,o ma l'invio alla stampante fallisce. Alter fatture vengono stampate regolarmente. Il cliente Bottaro-Turchetta s.r.l. è in attesa del cartaceo per il ritiro merce.  grazie mille",Amministrazione,media,0,285
145,,Segnalazione glitch grafico minore su fatturazione in risoluzione 4K. Il footer si sovrappone leggermente ma i bottoni funzionano. Difetto visivo marginale da correggere quando capiterà occasione. Non impatta l'operatività degli utenti standard.,Tecnico,bassa,0,245
146,,"Log del server application pieno di warning 'Connection Reset'. Il servizio non è mai andato down, ma i log crescono di 1GB al giorno. Rischio saturazione disco se non si indaag la causa. Situazione da monitorare e correggere prima che diventi critica.u",Tecnico,media,0,253
147,,Feedback su usabilità interfaccia vendite: i colori dei grafici sono poco leggibili. issue puramente cosmetico che non impatta le funzionalità. Valutare restyling garfico quando si metterà mano al frontend. Segnalazione di bassa priorità per backlog UX.,Tecnico,media,0,253
148,,Lentezza eccessiva nel caricamento della dashboard dashboard principale. Impiega 15 secondi per aprirsi invece dei soliti 2. Il sistema è utilizzabile ma la navigazione è frustrante per gli utenti. Probabile query non ottimizzata su DB produzione.,Tecnico,media,0,247
149,,"Blocco totale inserimento ordini nel sistema. Impossibile salvare ordine ORD-71548 per cliente Mazzocchi s.r.l.. Modulo vendite restituisce error ""503"" e non completa opearzione. Processo commerciale fermo da 10 ore. Cliente attende conferma per ordine da 158.71. Assistenza tecnica immediata richiesta per sblocco. - relativo a blocco per scadenza",Tecnico,media,0,348
150,,"Richiesta PDF aggiornato del manuale utente modulo reportistica. La versione sul server è obsoleta (manca capitolo 5). Non serve per attività correnti, ma per completezza archivio documentale. Inviare file quando disponibile.",Tecnico,bassa,0,225
151,,Glitch visuale nella tabella ordini: la colonna 'Totale' a volte appare vuota. Facendo refresh della pagina i dati compaiono. issue intermittente che genera confusione nel reparto vendite. Non blocca gli ordini ma genera chiamate di assistenza inutili. per disponibilità per fattura - preventivo,Tecnico,media,0,295
152,,Glitch visuale nella tabella ordini: la colonna 'Totale' a vlote appare vuota. Facendo refresh della pagina i dati compaiono. Problema intermittente che genera confusione nel reparto vendite. Non blocca gli ordini ma genera chiamate di assistenza inutili. - relativo a modulo - pianificare per suggerimento - lieve,Tecnico,media,0,314
