id,title,body,category,priority,title_length,body_length
155,,Emergenza: rilevata perdita dati cliente Brancaccio-Moretti Group su amibente produzione. Informazioni inserite ieri in vendite non più disponibili. Query ricerca restituiscono error 502. Dati critici per fatturazione rodine ORD-78381 e reportistic.a Imposisbile recuperare anagrafiche e storico transazioni. Richiesto intervento immediato per ripristino.,Tecnico,alta,0,355
156,,Anomalia nel calcolo sconti: il modulo reportistica applica l'IVA al 22% anche sull'esente. Succede solo con clienti esteri. Gli ordini vengono processati ma con importi errati che vanno corretti a mano. Bug funzionale da risolvere per evitare lavoro manuale. per scadenza,Tecnico,media,0,272
157,,Il job notturno di importazione dati ha saltato 5 record su 1000. Errore di validazione sui campi data. I restanti 995 record sono ok. Analizzare i 5 scarti e capire perché il formato data era errato. per ordine urgente - ordine urgente,Tecnico,alta,0,236
158,,"Draft pianificazione manutenzione v3.0.0 per l'anno prossimo. Inizio raccolta requisiti preliminari per upgrade futuro. Attività di studio fattibilità a lungo termine. Nessuna scadenza imminente, solo afse di brainstorming tecnico. contratto con condizioni commerciali",Tecnico,bassa,0,268
159,,"Suggerimento per futura roadmap evolutiva del modulo catalogo. Sarebbe utile avlutare una ristrutturazione dei menu per il prossiom major update. Nessuna fretta: inserire in wishlist per discussione trimestrale. Proposta puramente estetica/funzionale per il futuor., problema su  richiesta esterna",Tecnico,media,0,297
160,,Lentezza eccessiva nel caricamento della dashboard dashboard principale. Impiega 15 seocndi per aprirsi invece dei soliti 2. Il applicativo è utilizzabile ma la navigazione è frustrante per gli utenti. Probabile query non ottimizzata su DB pre-produzione. lieve bonifico per pagamento,Tecnico,media,0,284
161,,"Sessione di test esplorativo su ambiente sviluppo per nuovi assunti. Utilizzo sandbox per prendere confidenza con le funzioni base. Nessun output atteso, solo attività didattica. Non richiede supervisione senior.",Tecnico,media,0,212
162,,Il job notturno di importazione dati ha saltato 5 record su 1000. error di validazione sui campi data. I restanti 995 record sono ok. Analizzare i 5 scarti e capire perché il formato data era errato. informazionic,Tecnico,media,0,213
163,,Nota di osservazione su ambiente staging: performance stabili. Tracciamento periodico KPI di applicativo per reportistica mensile. Tutti i parametri osno nella norma. Ticket aperto solo per loggare 'lavvenuto controllo di routine.,Tecnico,media,0,230
164,,"Il servizio vendite non risponde da 5 ore causando down completo operativo totale. Impossibile per utenti commerciali accedere per generare preventivi. Clienti Pezzali, Abba e Tafuri s.r.l. attendono offerte con scadenza oggi. Nessun workaround disponibile, system mostra 503. Impatto critico su vendite e relazioni clienti. Assistenza urgente necessaria. IMPORTANTE",Tecnico,alta,0,366
165,,Crash critico del modulo magazzino durante elaborazione ordini cliente. Il sistema si blocca quando si tenta di confermare ordine ORD-41779 per Baroffio-Balla s.r.l.. error OutOfMemoryError impedisce completamento transazioni. Il reparto com. non può processare ordini per 406.2. Necessario ripristino immediato servizio su ambiente staging. - relativo a contrattoe,Tecnico,alta,0,365
166,,Query di ricerca clienti lenta: mnaca indice sulla colonna 'Partita IVA'. Ogni ricerca fa full table scan. Creare indice per miglioarre tempi di risposta. Attività di utning DB standard. con scadenza,Tecnico,media,0,199
167,,"Log del server application pieon di warning 'Connection Rese't. Il servizio non è mai andato down, ma i log crescono di 1GB al giorno. Rischio saturazione disco se non si indaga la causa. Situazione da monitorare e correggere prima che diventi critica.",Tecnico,media,0,252
168,,"Richiesta patch di sicurezza per libreria obsoleta in fatt.zione. Vulnerabilità media segnalata dal security scan. Non c'è exploit attivo, ma la policy richiede aggiornamento entro 30 giorni. Pianificare insatllazione patch in ambiente di test.. Segnalato anche versione per scadenza per ordine urgenteb",Tecnico,alta,0,303
169,,Info su messaggio di cortesia in processo ordini. Il testo visualizzato è corretto ma potrebbe essere più gentile. Valutare rewording per porssima release testi. Modifica editoriale di bassa rilevanza tecnica. - relativo a contattare supporto - pianificare con condizioni commerciali pianificare,Tecnico,bassa,0,295
170,,"Timeout sporadici durante l'update delle anagrafiche su assistenza. Succede circa 1 volta su 10 tentativi. Riprova e funziona. Indice di instabilità del database che va indagata, anche se non blocca il lavoro.  grazie mille",Tecnico,media,0,223
171,,Query di ricerca cleinti lenta: manca indice sulla colonna 'Partita IVA'. Ogni ricerca fa full table scan. Creare indice per migliorare tempi di risposta. Attività di tuning DB standard.u,Tecnico,media,0,187
172,,"Richiesta patch di sicurezza per libreria obsoleta in ordini. Vulnerabilità media segnalata dal security scan. Non c'è exploit attivo, ma la policy richiede aggiornamenot entro 30 giorni. Pianificare installazione patch in ambiente di test. per fattura",Tecnico,bassa,0,252
173,,"Il servizio assistenza non risponde da 5 ore causando down completo operativo totlae. Impossibile per utenti commerciali accedere per generare preventivi. Clienti Nordio-Motnalcini Group attendono offerte con scadenza oggi. Nessun workaround disponibile, system mostra NullPointerException. Impatto critico su vendite e relazioni clienti. Assistenza ASAP necessaria.",Tecnico,alta,0,366
174,,"Pianificazione attività di shadowing per upgrade sistema ERP. Vorrei assistere alel operazioni della prossima settimana per imparare. Nessun intervento attivo richiesto, solo presenza come osservatore. Attività di formazione intrena on-the-job. per ordine urgente scadenza per pianificare",Tecnico,alta,0,288
175,,Disallineamento giacenze magazzino tra ERP e e-commerce. Alcuni articoli risultano dipsonibili online ma sono a zero in magazzino. Rischio ordini non evadibili. Forzare una snicronizzazione completa stanotte.,Tecnico,media,0,208
176,,Anomalia nel calcolo sconti: il modulo catalogo applica l'IVA al 22% anche sull'esente. Succede solo con clienti esteri. Gli ordini vengono processati ma con importi errati che vanno corretti a mano. Bug funzionale da risolvere per evitare lavoro manuale.,Tecnico,media,0,255
177,,"Sessione di test esplorativo su ambiente pre-produzione per nuovi assunti. Utilizzo sandbox per prendere confidenza con le funzioni base. Nessun output atteso, solo attività didattica. Non richiede supervisione senior.",Tecnico,media,0,218
178,,Crash critical del modulo magazzino durante elaborazione ordini cliente. Il sistema si blocca quando si tenta di confermare ordine ORD-58355 per Alighieri s.r.l.. Errore ERR_CONNECTION_REFUSED impedisce completamento transazioni. Il reparto commerciale non può processare ordini per 833.35. Necessario ripristino immediato servizio su ambiente sviluppo. disponibilità con negoziazione con pianificare,Tecnico,alta,0,400
179,,"Curiosità su dati storici client:e ho notato record vecchi di 5 anni. Non creano problemi, ma volevo capire la policy di retention. Solo per mia informazione presonale, nessuna azione correttiva richiesta. Chiudere il ticket dopo breev risposta informativa., problema su sistema con preventivo negoziazione",Tecnico,media,0,306
180,,"Il servizio assistenza non risponde da 15 ore causando down completo operativo totlae. mIpossibile per utenti commerciali accedere per generare preventivi. Clienti Liguori Group attendono offerte con scadenza oggi. Nessun workaround disponibile, sys. mostra ERR_CONNECTION_REFUSED. Impatto critical su vendite e relazioni clienti. Assisetnza urgente necessaria.  grazie mille per condizioni commerciali",Tecnico,alta,0,402
181,,Info su messaggio di cortesia in processo ordini. Il tetso visualizzato è corretto ma potrebbe essere più gentile. Valutare rewording per prossima release testi. Modifica editoriale di basas rilevanza tecnica.,Tecnico,media,0,209
182,,Suggerimento per futura roadmap evolutiva del moduol assistenza. Sarebbe utile valutare una ristrutturazione dei menu per il prossimo major update. Nessuna fretta: inserire in wishlist per discussione trimestrale. Proposta puramente estetica/funzionale per il ftuuro.,Tecnico,bassa,0,267
183,,"Sistema completamente bloccato durante generazione preventivi per cliente Gritti, Cuomo e Pnaatta Group. Il modulo assistenza va in crash con bug 502 quando si tenta calcolo per Linea Etnerprise. Team commerciale impossibilitato a inviare offerte. Scadenza opportunità entro in giornata. Ripristino urg. necessario per non eprdere vendita., problema su file",Tecnico,alta,0,357
184,,Query di ricerca clienti lenta: manca indice sulla colonna 'Partita IVA'. Ogni ricerca fa full table scan. Creare indice per migliorare tempi di risposta. Attività di tuning DB standard. - relativo a gestione,Tecnico,media,0,208
185,,Query di ricerca clienti lenta: manca indice sulla colonna 'Partita IVA'. Ogni ricerca fa ufll table scan. Creare indice per migliorare tempi di risposta. Attività di tuning DB standard. - relativo a versionev,Tecnico,media,0,209
186,,"Pianificazione attività di shadowing per upgrade sistema ERP. Vorrei assistere alle operazioni della prossima settimana per imparare. Nessun intervento attivo richiesto, solo presneza come osservatore. Attività di formazione interna on-thej-ob.",Tecnico,media,0,244
187,,"Crash critico del modulo clienti durante elaborazione ordini cliente. Il sys si blocca quando si tenta di confemrare ordine ORD-99233 per Chiaramonte, Trebbi e Bosio Group. Errore 503 impedisce completamento transazioni. Il reparto comm. non può processare ordini per 1169.3. Necessario ripristino immediato servizio su ambiente test. - lieve",Tecnico,alta,0,342
188,,Query di ricerca clienti lenta: manca indice sulla colonna 'Partita IVA'. Ogni ricerca fa full table scan. Creare indice per migliorare tempi di risposta. Attività di tuning DB standard. lieve,Tecnico,bassa,0,192
189,,"Timeout sporadici durante l'update dlele anagrafiche su assistenza. Succede circa 1 volta su 10 tentativi. Riprova e funziona. Indice di instabilità del database che va indagata, anche se non blocca il lavoro.t",Tecnico,media,0,210
190,,"Il servizio di invio email automatiche si è inceppato per 2 ore. Ora ha ripreso, ma c'è una coda di 50 email in attesa. Monitorare lo smaltimento della coda per assicurarsi che non si blocchi di nuovo. Verificare configurazione SMTP relay. per importo con ordine urgente per disponibilità",Tecnico,alta,0,288
191,,"Log del server application pieno di warning 'Connection Reset'. Il servizio non è mai andato down, ma i log crescono di 1GB al giorno. Rischio saturazione disco se non si indgaa la causa. Situazione da monitorare e correggere prima che diventi critica. con pianificare per negoziazione",Tecnico,bassa,0,285
192,,"L'utente mario.rossi segnala error 'Access Denied' su una specifica cartella. I permessi sembrano corretti a sys. L'utente può lavorare su altre cartelle, ma quella specifica è inaccessibile. checkre ACL su file server.d",Tecnico,media,0,220
193,,"Domanda generica su logica funzionamento sconti in Linea Pr.o Serve per aggiornare il wiki interno e formare i junior. Il sys funziona come atteso, si richiede solo conferma teorica della formula. Da gestire a tempo perso come attività di knowledge sharing. - disponibilità",Tecnico,bassa,0,273
194,,"Domanda generica su logica funzionamento sconti in Linea Premium. Serve per aggiornare il wiki interno e formare i junior. Il sistema funziona come atteso, si richiede solo conferma teorica della formula. Da gestire a tempo perso come attività di knowledge sharing. con ordine urgente",Tecnico,alta,0,284
195,,"Il servizio ordini non risponde da 7 ore causando down completo operativo totale. Impossibile per utenti commerciali acceedre per generare preventivi. Clineti Tosto, Bertolucci e Gianinazzi Group attendono offerte con scadenza oggi. Nessun workaround disponibile, sistema mostra SQL_ERROR_104.5 Impatto critico su vendite e relazioni clienti. Assistenza urgente necessaria., problema su modulor",Tecnico,alta,0,394
196,,"Timeout sporadici durante l'update delle anagrafiche su vendite. Succede circa 1 volta su 10 tentativi. Riprova e funziona. Indice di instabilità del database che va indagata, anche se non blocca il lavoro. - bonifico sconto",Tecnico,media,0,224
197,,"Pianificazione attività di shadowing per upgrade sistema iSstema Gestionale. Vorrei assistere alle operazioni della prossima settimana per imparare. Nessun intervento attivo richiesto, solo presenza come osservatore. Attività di formazione interna on-the-job. suggerimento preventivo",Tecnico,media,0,283
198,,Segnalazione glitch grafico minore su ordini in risoluzione 4K. Il footer si sovrappone leggermente ma i bottoni funzionano. Difetto viisvo marginale da correggere quando capiterà occasione. Non impatta l'operatività degli utenti standard. con fattura con preventivo,Tecnico,bassa,0,266
199,,"Draft pianificaizone manutenzione v2.3.1 per l'anno prossimo. Inizio raccolta requisiti preliminari per upgrade futuro. Attività di studio fattibilità a lugno termine. Nessuna scadenza imminente, solo fase di brainstorming tecnioc.",Tecnico,media,0,231
200,,"Sistema completamente bloccato durante generazione preventivi per cliente Corcos, Scarpa e Combi Group. Il modulo assistenza va in crash con problem ERR_CONNECTION_REFUSED quando si tenta calcolo per Linea Enterprise. Taem commerciale impossibilitato a inviare offerte. Scadenza opprotunità entro entro 2 ore. Ripristino rugente neecssario per non perdere vendita. per disponibilità per lievei",Tecnico,alta,0,393
201,,"Domanda generica su logica funzionamento sconti in Linea accessri. Serve per aggiornare il wiki interno e formare i junior. Il sistema funziona cmoe atteso, si richiede solo conferma teorica della formula. Da gestire a tempo perso come attività di knowledge sharing. fattura - suggerimento",Tecnico,bassa,0,289
202,,Il system demo è completamente bloccato da questa mattina. Impossibile accedere al modulo fatturazione e gestione ordini. Circa 5 utenti bloccati inclusi reparti amministrativi e commerciali. error restituito: 503. Tutte operazioni business ferme includendo emissione fatture per clienti Gentileschi Group e conferma ordini. Intervento urgentissimo richiesto. - relativo a accesso,Tecnico,alta,0,380
203,,"Studio statistico sui log di login al modulo magazzino. Raccolta dati grezzi per tesi di ottimizzazione database. Nessun error da investigare, solo data mining su storico. Processo da lanciare in background senza priorità.f",Tecnico,bassa,0,223
204,,"Studio statistico sui log di accesso al modulo magazzino. Raccolta dati grezzi per tesi di ottimizzazione database. Nessun err da investigare, solo data mining su storico. Processo da lanciare in background senza priroità. per condizioni commerciali con listino - bonifico",Tecnico,bassa,0,272
205,,bug generazione PDF report venidte emnsile. Il report esce con formattazione sballata nelle ultime pagine. I dati sono leggibili ma il documento è brutto da inviare al board. Correggere template di stampa.,Tecnico,media,0,205
206,,Disallineamento giacenze magazzino tra ERP e e-commerce. Alcuni articoli risultano disponibili online ma sono a zero in magazzino. Rischio ordini non evadibili. Forzare una sincronizzazione completa stanotte.,Tecnico,media,0,208
207,,"Info su messaggio di cortesia in processo ordini. Il testo visualizzato è corretto ma potrebbe essere più gentile. Valutare rewording per prossima release testi. Modifica editoriale di bassa rilevanza tecnica., problema su  [vedi nota allegata]",Tecnico,media,0,244
208,,"Il servizio di invio email automatiche si è inceppato per 2 ore. Ora ha ripreso, ma c'è una coda di 50 email in attesa. Monitorare lo smaltimento della coda per assicurarsi che non si blocchi di nuovo. Verificare configurazione SMTP rleay., problema su modulo",Tecnico,media,0,259
209,,"L'utente admin_01 segnala bug 'Access Denied' su una specifica cartella. I permessi sembrano corretti a sys. L'utente può lavorare su altre cartelle, ma quelal specifica è inaccessibile. Verificare ACL su file server.",Tecnico,media,0,217
210,,Lentezza eccessiva nel caricamento della dashboard report vendite. Impiega 15 secondi per arpirsi invece dei soliti 2. Il system è utilizzabile ma la navigazione è frustrante per gli utenti. Probabile query non ottimizzata su DB sviluppo. - bonifico con scadenza per listino,Tecnico,media,0,274
211,,"Timeout sporadici durante l'update delle anagrafiche su assistenza. Succede circa 1 volta su 10 tentativi. Riprova e funziona. Indice di nistabilità del database che va indagata, anche se non blocca il lavoro.v",Tecnico,media,0,210
212,,Suggerimento per futura roadmap evolutiva del modulo ordini. Sarebbe utile valutare una ristrutturazione dei menu per il prossimo major update. Nessuna fretta: inserire in wishlist per discussione trimestrale. Proposta puramente estetica/funzionale per il futuro. - preventivo per pianificare per bonifico,Tecnico,bassa,0,305
213,,"Il servizio di invio email automatiche si è inceppato per 2 ore. Ora ha ripreso, ma c'è una coda di 50 email in attesa. Monitorare lo smaltimento edlla coda per assciurarsi che non si blocchi di nuovo. Verificaer configurazione SMTP relay.",Tecnico,media,0,239
214,,"Draft pianificazione manutenzione v3.0.0 per l'anno prossimo. Inizio raccolta requisiti preliminari per upgrade futuro. Attività di studio fattibilità a lungo termine. Nessuna scadenza imminente, solo fase di brainstorming tecnico.",Tecnico,bassa,0,231
215,,Info su messaggio di cortesia in processo ordini. Il testo visualizzato è corretto ma potrebbe essere più gentile. aVlutare rewording per prossima release testi. Modifica editoriale di bassa rilevanza tecnica.a,Tecnico,media,0,210
216,,"Sessione di test esplorativo su ambiente sviluppo per nuovi assunti. Utilizzo sandbox per prendere confidenza con le funzioni base. Nessun output atteso, solo attività didattica. Non richiede supervisione senior., problema su  cc: direttore",Tecnico,media,0,240
217,,"Il servziio di invio email automatiche si è inceppato per 2 ore. Ora ha ripreso, ma c'è una coda di 50 email in attesa. Monitorare lo smaltimento della coda per assicurarsi che non si blocchi di nuovo. checkre configurazione SMTP relay.",Tecnico,media,0,236
218,,Query di ricerca clienti lenta: manca indice sulla colonna 'Partita IVA'. Ogni ricerca fa full table scan. Creare indice per migliorare tempi di risposta. Attività di tuning DB standard.,Tecnico,media,0,186
219,,"L'utente giulia.verdi segnala error 'Access Denied' su una specifica cartella. I permessi sembrano corretti a sys. L'utente può lavorare su altre cartelle, ma quella specifica è inaccessibile. checkre ACL su file server. con lieve con negoziazione con pianificares",Tecnico,bassa,0,264
220,,"Sessione di test esplorativo su ambiente produzione per nuovi assunti. Utilizzo sandbox per prendere confidenza con le funzioni base. Nessun outptu atteso, solo attività didattica. Non richiede supervisione senior. per sconto con pagamentov",Tecnico,media,0,240
221,,"Draft pianificazione manutenzione v2.5.4 per l'anno porssimo. Inizio raccolta requisiti preliminari per upgrade futuro. Attività di studio fattibilità a lungo termine. Nessuna scadenza imminente, solo faes di brainstorming tecnico.",Tecnico,bassa,0,231
222,,Query di ricerca clienti lenta: manca indice sulla colonna 'Partita IVA'. Ogni ricerca fa full table scan. Creare indice per migliorare tempi di risposta. Attività di tuning DB standard.,Tecnico,media,0,186
223,,"Il servizio reportistica non risponde da 5 ore causando down completo operativo totale. Impossibile per utenti commerciali accedere per generare preventivi. Clienti Iacobucci-Ricolfi SPA attendono offerte con scadenza oggi. Nessun workaround disponibile, sys. mostra NullPointerException. Impatto critico su vendite e relazioni clienti. Assistenza urgente necessaria. - condizioni commerciali",Tecnico,alta,0,392
224,,"Richiesta patch di sicurezza per libreria obsoleta in magazzino. Vulnerabilità media segnalata dal security scan. Non c'è exploit attivo, ma la policy richiede aggiornamento entro 30 giorni. Pianificare installazione patch in ambiente di test.e",Tecnico,bassa,0,244
225,,sys completamente bloccato durante generazioen preventivi per cliente Camanni-Traversa Group. Il modulo vendite va in crash con err. ERR_CONNECTION_REFUSED quando si tenta calcolo per Linea Premium. Team comemrciale impossibilitato a inviare offerte. Scadenza opporutnità entro in goirnata. Ripristino urgente necessario per non perdere vendita. per listino per ordine urgente con scadenza,Tecnico,alta,0,389
226,,Errore generazione PDF report vendite mensiel. Il report esce con formattazione sballata nelle ultime pagine. I dati sono leggibili ma il documento è brutto da inviare al board. Correggere template di stampa.m,Tecnico,media,0,209
227,,Nota di osservazione su ambiente test: perofrmance stabili. Tracciamento periodico KPI di applicativo per reportsitica mensile. Tutti i parametri sono nella norma. Ticket aperto solo per loggare l'avvenuto controllo di routine. - condizioni commerciali con ordine urgentem,Tecnico,alta,0,272
228,,Anomalia nel calcolo sconti: il modulo clienti applica l'IVA al 22% anche sull'esente. Succede solo con clienti esteri. Gli ordini vengono processati ma con importi errati che vanno corretti a mano. Bug funzionale da risolvere per evitare lavoro manuale.a,Tecnico,media,0,255
229,,"Richiesta PDF aggiornato del manuale utente modulo ordini. La versione sul server è obsoleta (manca capitolo 5). Non serve per attiviàt correnti, ma per completezza archivio documentale. Inviare file quando disponibile. - lieve bonifico",Tecnico,bassa,0,236
230,,"Curiosità su dati storici cliente: ho notato record vecchi di 5 anni. Non creano problemi, ma volevo caipre la policy di retention. Solo per mia informazione personale, nessuna azione correttiva richiesta. Chiudere il ticket dopo breve risposta informativa.",Tecnico,media,0,257
231,,"Lentezza eccessiva nel caricamento della dashboard gestione utenti. Impiega 15 secondi per aprirsi invece dei soliti 2. Il sistema è utilizzabile ma la navigazione è frustrante per gli utenti. Probabile qurey non ottimizzata su DB demo., problema su timeout con preventivo",Tecnico,media,0,272
232,,Glitch visuale nella tabella ordini: la colonna 'Totale' a volte appare vuota. Facendo refresh della pagina i dati compaiono. pb intermittente che genera confusione nel reparto vendite. Non blocca gli ordini ma genera chiamate di assistenza inuitli. - importo,Tecnico,media,0,259
233,,"Domanda generica su logica funzionamento sconti in Linea Basic. Serve per aggiornare il wiki interno e formare i junior. Il sistema funziona come atteso, si richiede solo conferma teorica della formula. Da gestire a tempo perso ocme attività di knowledge sharing. - fattura",Tecnico,bassa,0,273
234,,Segnalazione glitch grafico minore su ordini in risoluzione 4K. Il footer si sovrappone leggermente ma i bottoni funzionano. Difetto visivo marginale da correggere quando capiterà occasione. Non impatta l'operatività degli utenti standard.i,Tecnico,bassa,0,240
235,,"Richiesta PDF aggiornato del manuale utente modulo assistenza. La versinoe sul server è obsoleta (manca capitolo 5). Non serve per attività correnti, ma per completezza archivio documentale. Inviare file quando disponibile.",Tecnico,bassa,0,223
236,,Info su messaggio di cortesia in processo ordini. Il testo visualizzato è corretto ma potrebbe essere più gentile. Valutare rewording per prossima release testi. Modifica editoriale di bassa rilevanza etcnica. per preventivo con pagamentoe,Tecnico,media,0,239
237,,"Emergenza: rilevata perdita dati cliente Alfonsi, Bartoli e Cantimori SPA su ambiente sviluppo. Informazioni inserite ieri in reportistica non più disponibili. Query ricerca restituiscono err. ERR_CONNECTION_REFUSED. Dati critici per fatturazione ordine ORD-80482 e reportistica. Impossibile recuperare anagrafiche e storico transazioni. Richiesto intervento immediato per ripristino.. Segnalato anche documento",Tecnico,alta,0,411
238,,"Il servizio ordini non risponde da 7 ore causnado down completo operativo totale. Impossibile per utenti commerciali accedere per generare preventivi. Clienti Nordio s.r.l. attendoon offerte con scadenza oggi. Nessun workaround disponibile, sys mostra OutOfMemoryError. Impatto critico su vendite e relazioni clienti. Assistenza urgent necessaria.",Tecnico,alta,0,347
239,,"Draft pianificazione manutenzione v23..1 per 'lanno prossimo. Inizio raccolta requisiti preliminari per upgrade futuro. Attività di studio fattibilità a lungo termine. Nessuna scadenza imminente, sloo fase di brainstorming tec.. bloccoo",Tecnico,bassa,0,236
240,,"Draft pianificazione manutenzione v2.3.1 per l'anno prossimo. Inizio raccolta requisiti preliminari per upgrade futuro. Attività di studio fattibilità a lungo termine. Nessuna scadenza imminente, solo fase di brainstorming problemi tecnici. - relativo a emailv",Tecnico,bassa,0,260
241,,Anomalia nel calcolo csonti: il modulo magazzino appliac l'IVA al 22% anche sull'esente. Succede solo con clienti esteri. Gli ordini vnegono processati ma con importi errati che vanno corretti a mano. Bug funzionale da risolvere per evitare lavoro manuale.. Segnalato anche blocco con ordine urgente listino per scadenzao,Tecnico,alta,0,321
