id,title,body,category,priority,title_length,body_length
78,,Richiesta estrazione dati statistici su utilizzo licenze Linea Enterprise. Il report serve esclusivamente per proiezioni di budget anno prossimo (suo interno). Nessuna scadenza operativa immediata. Elaborazione da fare offline quando le risorse lo permettono. - preventivo,Amministrazione,bassa,0,272
79,,Malfunzionamento export Excel per report mensil.e La generazione del file si interrompe a metà con errore generico. I dati a video sono corretti. eSrve il file esportato per irunione di domani mattina. Workaround richiesto. per listino bug,Amministrazione,media,0,239
80,,Nota di aggiornamento anagrafica per cliente Monte e figli nel sistema clienti. Inseriti dati nuovo referente mario.rossi a puro titolo informativo per il database. Nessuna azione di sincronizzazione richiesta al momento. Semplice data entry per tenere ordinato lo storico contatti.,Amministrazione,bassa,0,282
81,,"Durante l'elaborazione della afttura 7113/23 per il cliente Borzomì, Zola e Santoro e figli, il sistema reportistica si è bloccato generando error 503. L'operazione di registrazione pagamento di 464.72 non può essere completata. Il cliente attende conferma per procedere con l'ordine ORD-19436. Necessario intervento urgente per sbloccare il processo di fatturazione. con errore critico crash per performance",Amministrazione,alta,0,408
82,,Nota di aggiornamento anagrafica per cliente Viola-Fornaciari e figli nel sys catalogo. Inseriti dati nuovo referente opeartore_23 a puro titolo informativo per il dataabse. Nessuna azione di sincronizzazione richiesta al momento. Semplice data entry per tenere ordinato lo storico contatti.o,Amministrazione,bassa,0,292
83,,Proposta di manutenzione ordinaria: pulizia account inattivi da lungo periodo. Lista di 2 utenti che non acceodno da mesi. Attività di igiene del database da schedulare come task di routine. Nessun impatto sugli utenti attivi o sul serivzio di produzione.,Amministrazione,bassa,0,255
84,,"Monitoraggio passivo dei log moduol gestione utenti per statistiche utilizzo. Analisi a posteriori dei tracciati per identificare trend di lungo periodo. Non ci sono errori attivi o malfunzionamenti. Attività di studio per future ottimizzazioni, senza impatto attuale.",Amministrazione,bassa,0,268
85,,"L'account utente admin_01 risulta bloccato dal sys fatturazione con error ""ERR_TIMEOUT"". L'utente deve urgenetmente accedere per completare l'elaborazione delle fatture per il cliente Federico-Cammarata SPA. Il blocco sta impattando le operzaioni di chiusura ordini e l'invio documenti contabili. Si richiede intervento tecnico immediato per ripristino accesso entro entro 2 ore.",Amministrazione,alta,0,379
86,,Nota di aggiornamento anagrafica per cliente Guinizzelli-Monaco Group nel applicativo ordini. Inseriti dati nuovo referente operatore_23 a puro titolo informativo per il database. Nessuna azione di sincronizzazione richiesta al momento. Semplice data entry per tenere ordinato lo storico contatti.,Amministrazione,bassa,0,297
87,,"Impossibile allegare PDF al record della fattura 9298/21. Il bottone 'Upload' non risponde o dà errore di permessi. Il documento deve essere archiviato digitalmente entro fine mese. Problema limitato alla funzione di upload, il retso funziona.",Amministrazione,media,0,243
88,,"Il sys magazzino non risponde alle richieste di accesso da parte degli utenti amministrativi. Abbiamo la produzione ferma: impossibile gestire le anagrafiche clienti e fornitori. Circa 5 utenti bloccati, nessuno riesce ad accedere alle funzionalità di gestione documenti. Il problema si manifesta in ambiente staging con timeout continui. - performance per negoziazione con listino",Amministrazione,alta,0,381
89,,Richiesta estrazione dati statistici su utilizzo licenze Linea Enterprise. Il report serve esclusivamente per proiezioni di budget anno prossimo (uso interno). Nessuna scadenza operativa immediata. Elaborazione da fare offline quando le risorse lo permettono.,Amministrazione,bassa,0,259
90,,"L'account utente operatore_23 risulta bloccato dal sistema fatturazione con error ""504"". L'utente deve urgentmente accedere per completare l'elaborazione delle fatture per il cliente Farinelli, Bajardi e Trebbi e figli. Il blocco sta impattando le operazioni di chiusura ordini e l'invio documenti contabili. Si richiede intervento tecnico immediato per ripristino accesso entro entro oggi. - preventivo per performance",Amministrazione,alta,0,419
91,,"Il sistema fatturazione non risponde alle richieste di accesso da parte degli utenti amministrativi. Abbiamo la produzione ferma: impossibile gestire le anagrafiche clienti e fornitori. Circa 2 utenti bloccati, nessuno riesce ad accedere alle funzionalità di gestione documenti. Il pb. si manifesta in ambiente produzione con timeout continui.c",Amministrazione,alta,0,344
92,,"Data entry: modifica scheda informativa cliente Lercari, Finzi e Casarin SPA. Aggiornamento campi email giulia54@nonis.it e referente admin_01. Modifica puramente formale per completezza anagrfaica. Attività amministrativa standard di basso livello, gestibile in background.",Amministrazione,bassa,0,274
93,,"Durante l'leaborazione della fattura 1849/21 per il cilente Zaguri, Barcella e Pausini Group, il sistema ordini si è bloccato generando err. 500. L'operazione di registrazione pagaemnto di 877.03 non può essere completata. Il cliente attende conferma per procedere con l'ordine ORD-51616. Necessario intervento urgentissimo per sbloccare il processo di fatturazione.",Amministrazione,alta,0,366
94,,"L'utente giulia.verdi segnala lentezza esasperante nel modulo fatt.zione. Il salvataggio di ogni fattura impiega 30-40 secondi. Non è un blocco totale, ma dimezza la produttività dell'ufficio. Necessaria verifica performance database o rete su ambiente staging. per preventivo sconto",Amministrazione,media,0,283
95,,"Mancato allineamento incassi: il bonifico di 751.16 non risulta in contabilità. In banca è presente, ma il modulo fatt.zione non lo ha importato automaticamente. Necessario inserimento manuale o forzatura snyc per chiudere la posizione del cliente Vergassola SPA. Il issue riguarda solo i bonifici di ieri.. Segnalato anche fattura crash login fallito sincronizzazionea",Amministrazione,media,0,369
96,,"Il sistema catalogo non risponde alle richieste di accesso da parte degli utenti amministrativi. Abbiamo la produzione feram: impossibile gestire le anagrafiche clienti e fornitori. Circa 10 utenti bloccati, nessuno riesce ad accedere alle funzionalità di gestione documenti. Il issue si manifesta in ambiente sviluppo con timeout continui. preventivo con listino per memory leak - preventivo",Amministrazione,media,0,392
97,,"Duplicazione righe in visualizzazione estratto conto Piccio, Mascagni e Fracci e figli. Le fatture appaiono due volte nella lista a viedo. Il saldo finale è corretto, è solo un rerore visivo che confonde gli operatori. Richiesta pulizia della view nel modulo catalogo.",Amministrazione,media,0,268
98,,"Imopssibile allegare PDF al record della fattura 8401/24. Il bottone 'Upload' non risponde o dà errore di permessi. Il documento deve essere archiviato digitalmente entro fine mese. Problema limitato alla funzione di upload, il resto funziona. per timeout",Amministrazione,media,0,255
99,,"Data entry: modifica scheda informativa cliente Zabarella s.r.l.. Aggiornamento campi email jacopomodiano@marcacci-battaglia.it e referente giulia.verdi. Modifica puramente formale per completezza anagrafica. Attività amministrativa standard di basso livello, gestibile in background.",Amministrazione,bassa,0,284
100,,Malfunzionamento export Excel per report mensile. La generazione del file si interrompe a metà con errore generico. I dati a video sono corretti. Serve il file esportato per riunione di domani mattina. Workaround richiesto.,Amministrazione,media,0,223
101,,"Discrepanza IVA su fat estera 1275/20. Il applicativo calcola un importo dievrso da quello atteso per il cliente Bossi, Romano e Goldoni SPA. Differenza di pochi euro, ma impedisce la validaizone contabile. Richiesta check configurazione aliquote nel modulo assistenza.",Amministrazione,media,0,269
102,,Controllo qualità dati contabili storici per archivio. check di routine sulla coerenza dei vecchi movimneti di anni passati. Non blocca nessuna attività corrente e non richiede correzioni urgenti. Si può procedere gradualmente alla validazione dei recodr passati.,Amministrazione,media,0,263
103,,"Monitoraggio passivo dei log modulo gestione utenti per statistiche utilizzo. Analisi a posteriori dei tracciati per identificare trend di lungo periodo. Non ci sono errori attivi o malfunzionamenti. Attività di studio per future ottimizzazioni, senza impatto attuale., problema su contratto - condizioni commerciali per negoziazione",Amministrazione,media,0,333
104,,"L'account utente mario.rossi risulta bloccato dal sistema reportistica con error ""ER_RTIMEOUT"". L'utente deve urgentissimomente accedere per completare l'elaborazione delle fatture per il cliente Capecchi, Giorgetti e Beccaria s.r.l.. Il blocco sta impattando le operazioni di chiusura ordini e l'invio documenti contabili. Si richiede intervento tecnico immediato per ripristino accesso entro entor 2 ore., problema su analisi con memory leak - bug login fallito",Amministrazione,alta,0,463
105,,"Errore di stampa isolato: impossibile stampare la fatt. 3220/21. Il sistema genera il PDF correttamente a video, ma l'invio alla stmapante fallisce. Altre fatture vengnoo stampate regolarmente. Il clienet Bellini, Bocca e Maspero s.r.l. è in attesa del cartaceo per il ritiro merce. - relativo a contratto",Amministrazione,media,0,305
106,,Richiesta estrazione dati statistici su utilizzo licenze Linea Premium. Il report serve esclusivamente per proiezioni di budget anno prossimo (uso interno). Nessuna scadenza opreativa immediata. Elaborazione da fare offline quando le risorse lo permettono.,Amministrazione,bassa,0,256
107,,Erorre validazione codice fiscale per nuovo cliente Emanuelli e figli. Il system lo segna come errato anche se è formalmente valido. Impedisce il salvataggio della scheda client.e Necessario bypassare il controllo o correggere l'algorimto di validazione.,Amministrazione,media,0,254
108,,"Data entry: modifica scheda informativa cliente Galvani-Riccardi e figli. Aggiornamento campi email scarponialessia@busoni-crisafulli.it e referente operatore_23. Modifica puramente formale per completezza anagrafica. Attività amministrativa standard di basso livello, gestibile in backgroudn. memory leak con login fallito",Amministrazione,bassa,0,323
109,,"Il sistema fatturazione non risponde alle richieste di accesso da parte degli utenti amministrativi. Abbiamo la produzione ferma: impossibile gestire le anagrafiche clienti e fornitori. Cicra 2 utenti bloccati, nessuno riesce ad accedere alle funzionalità di gestione documenti. Il pb. si manifesta in ambiente sviluppo con timeout continui.",Amministrazione,alta,0,341
110,,"Data entry: modifica scheda informativa cliente Boito-Dellucci Group. Aggiornamento campi email filippo95@bottaro.it e referente giulia.verdi. Modifica puramente formale per completezza anagrafica. Attività amministrativa standard di basso livello, gestibile in background.",Amministrazione,bassa,0,273
111,,"Impossibile allegare PDF al record della fat 9774/21. Il bottone 'Upload' non risponde o dà error di permessi. Il documento deve essere archiviato digitalmente entro fine mese. pb limitato alla funzione di upload, il resto funzion.a, problema su ordine per bug",Amministrazione,media,0,260
112,,"L'account utente mario.rossi risulta bloccato dal sistema magazzino con errore ""500"". L'utente deve urgentmente accedere per completare l'elaborazione delle fatture per il cliente eSrraglio, Salieri e Trebbi SPA. Il blocco sta impattando le operazioni di chiusura ordini e l'invio documenti contabili. Si richiede intervento tecnico immediato per ripristino accesso entor entro oggi. con sconto - performance bug",Amministrazione,alta,0,412
113,,"bug di stampa isolato: impossibile stampare la fattura 1287/22. Il applicativo genera il PDF correttamente a video, ma l'invio alla stampante fallisce. Altre fatutre vengono stampate regolarmente. Il cliente Dellucci, Ferretti e Crispi s.r.l. è in attesa del cartaceo per il ritiro merce. ordine urgente con disponibilitàl",Amministrazione,alta,0,322
114,,urgent completare la registrazione del pagamento per l'ordine ORD-55027 del cliente Caracciolo-Malatesta Group. Il system mostra bug ERR_TIMEOUT durante l'inserimento dell'importo 1366.59 in assistenza. Il bonifico risulta effettuato ma il gestionale non salva i dati. Blocco critical che impedisce conferma ordine e spedizione merce. Richiesto supporto issue tec immediato.. Segnalato anche errore,Amministrazione,alta,0,398
115,,"Monitoraggio passivo dei log modulo gestione utenti per statistiche utliizzo. Analisi a posteriori dei tracciati per identificare trend di lungo periodo. Non ci sono errori attivi o malfunzionamenti. Attività di studio per future ottimizzazioni, senza impatto attuale.",Amministrazione,bassa,0,268
116,,"Impossibile allegare PDF al record della afttura 5162/21. Il bottone 'Upload' non risponde o dà errore di permessi. Il documento deve essere archiviato digitalmente entro fine mese. issue limitato alla funzione di upload, il resto funziona.",Amministrazione,media,0,240
117,,Proposta di manutenzione ordinaria: pulizia account inattivi da lungo periodo. Lista di 6 utenti che non accedono da mesi. Attività di igiene del database da schedulare come task di routine. Nessun impatto sugli utenti attivi o sul servizio di produzione. gestionet,Amministrazione,bassa,0,265
118,,"Durante l'elaborazione della fattura 4262/20 per il cliente Scarpetta s.r.l., il sys. reporitstica si è bloccato generando errore 504. L'operazione di registrazione pagamento di 357.31 non può essere completata. Il cliente attende conferma per procedere con l'ordine ORD-47399. Necessario intervento urgente per sbloccare il processo di fatturazione. - relativo a verifica - ordine urgente con performanceg",Amministrazione,alta,0,406
119,,"Duplicazione righe in visualizzazione estratto conto Grasso, Desio e Borsellino Group. Le fatture appaiono due volet nlela lista a video. Il saldo finale è corretto, è solo un problem visivo che confonde gli operatori. Richiesta pulizia della view nel modulo fatturazione., problema su configurazione",Amministrazione,media,0,300
120,,"Attività di background: archiviazione documenti storici cliente Antelami e figli per anno 2020. Si tratta di spostare vecchi file (fatture, contratti) nell'archivio morto per liberare spazio. Nessuna urgenza operativa: il task può girare nei momenti di inattività del system. Operazione di manutenzione ordinaria del database.",Amministrazione,bassa,0,326
121,,Proposat di manutenzione ordinaria: pulizia account inattivi da lungo periodo. Lista di 2 utenti che non accedono da mesi. Attività di igiene del database da schedulare come task di routine. Nessun impatto sugli utenti attivi o sul servizio di produzione. per timeout,Amministrazione,media,0,267
122,,"Monitoraggio passivo dei log modulo gestione utenti per statistiche utilizzo. Analisi a posteriori dei tracciati per identificare trend di lungo periodo. Non ci sono errori attivi o malfunzionamenti. Attività di studio per future ottimizzazioni, senza impatto attuale.. Segnalato anche aggiornamentog",Amministrazione,bassa,0,300
123,,bug validazione codice fiscale per nuoov cliente Pincherle Group. Il sistema lo segna come errato anche se è formalmente valido. Impedisce il salvataggio della scheda cliente. Necessario bypassare il controllo o correggere l'algoritmo di validazione. per disponibilità,Amministrazione,media,0,268
124,,Procedura di backup storico: export fatture anon 2022 per archivio sicurezza. Generazione flie staitco in formato Excel da conservare server-side. Operazione a bassa priorità da accodare ai job notturni o weekend. Serve solo per compliance e non per attività correnti. - negoziazione,Amministrazione,bassa,0,283
125,,"Duplicazione righe in visaulizzazione estratto conto Modiano, Respighi e Camanni e figli. Le fatture appaiono due volte nella lista a video. Il saldo finale è corretto, è solo un errore visivo che confonde gli operatori. Richiesta pulizia della view nel modulo vendite., problema su email per sincronizzazione",Amministrazione,media,0,309
126,,"L'account giulia.verdi risulta bloccato per troppi tentativi di login errati. Serve sblocco manuale da patre dell'amministratore. L'utente deve completare l'inserimento ordini entro sera. Non è un problema di sys generalizzato, solo utenza sinogla. accesso",Amministrazione,alta,0,256
127,,Proposta di manutenzione ordinaria: pulizia account inattivi da lungo periodo. Lista di 9 utenti che non accedono da mesi. Attività di igiene del database da schedulaer come task di routine. Nessun impatto sugli utenti attivi o sul servizio di produzione. per condizioni commerciali ordine urgente preventivop,Amministrazione,alta,0,309
128,,Richiesta estrazione dati statistici su utilizzo licenze Linea Basic. Il report serve esclusivamente per rpoiezioni di budget anno prossimo (uso interno). Nessuna scadenza operativa immediata. Elaborazione da fare offline quando le risorse lo permettono. con sincronizzazione con listino,Amministrazione,bassa,0,287
129,,"Attività di background: archiviazione documenti storici cliente Vasari-Gangemi e figli per anno 1988. Si tratta di spostare vecchi file (fatture, contratti) nell'archivio morto per liberare spazio. Nessuna urgenza operativa: il task può girare nei momenti di inattività del sistema. Operazione di manutenzione ordinaria del database. con login fallitoe",Amministrazione,bassa,0,352
130,,"L'account utente admin_01 risulta bloccato dal sistema clienti con errore ""NullPointerException"". L'utente deve urgentemente accedere per completare l'elaborazione delle fatture per il cliente Giradello SPA. Il blcoco sta impattando le operazioni di chiusura ordini e l'invio documenti contabili. Si richiede intervento tech immedaito per ripristino acc. entro enrto 2 ore. con crash - disponibilità",Amministrazione,alta,0,399
131,,"err di stampa isolato: impossibile stampare la fattura 9624/22. Il ssitema genera il PDF correttamente a video, ma l'invio alla stampante fallisce. Altre aftture vengono stampate regolarmente. Il cliente Tomei, Borromeo e Aloisio s.r.l. è in attesa del cartaceo per il ritiro merce. assistenza - memory leak per timeout per memory leakn",Amministrazione,media,0,336
132,,Proposta di mnautenzione ordinaria: pulizia account inattivi da lungo periodo. Lista di 1 utenti che non accedono da mesi. Attività di igiene del database da schedulare come task di routine. Nessun impatto sugli utetni attivi o sul servizio di produzione.. Segnalato anche reporto,Amministrazione,bassa,0,280
133,,"Duplicazione righe in visualizzazione estratto conto Segrè, Cabrini e Mantegna e figli. Le fatture appaiono due volte nella lista a video. Il saldo finale è corretto, è solo un erroer visivo che confonde gli operatori. Richiesta pulizia della view nel modulo assistenza.",Amministrazione,media,0,270
134,,"Timeout puntuale durante la ricerca fatture per data. La query va in errore solo se si seleziona un intervallo superiore a 30 giorni. Costringe gli opertaori a fare ricerche frazionate. Molto scomodo per l'operatività quotidiana, serve ottimizzazione. con login fallito condizioni commerciali",Amministrazione,media,0,292
135,,"Timeout puntuale durante la ricerca fatture per data. La query va in errore solo se si seleziona un intervallo superiore a 30 giorni. oCstringe gli operatori a fare ricerche frazionate. Molto scomodo per l'operatività quotidiana, serve ottimizzazione. errore critico per ordine urgenteo",Amministrazione,alta,0,286
136,,"Mancata ricezione notifica approvazione ordine ORD-85094. Il responsabile ha approvato, ma l'email non è arrivata all'amministrazione. Senza notifica la fatturazione non parte. checkre code di posta in uscita su ambiente staging. per memory leak",Amministrazione,media,0,245
137,,"Impossibile allegare PDF al record della fattura 2126/21. Il bottone 'Upload' non risponde o dà err di permessi. Il documento deve essere archiviato digitalmente etnro fine mese. pb. limitato alla funzione di upload, il resto funziona. - relativo a richiestal",Amministrazione,media,0,259
138,,"Problema di visualizzazione anagrafica cliente Napolitano, Monet e Pedroni SPA. Alcuni campi (telefono, indirizzo) appaiono vuoti anche se popolati nel DB. Rende difficile contattare il cliente per sollecito pagamenti. Bug dell'interfaccia reportistica da correggere. - preventivo per errore critico",Amministrazione,alta,0,299
139,,urg. completare la registrazione del pagamento per l'ordine ORD-43061 del cliente Dibiasi-Farinelli s.r.l.. Il sistema mostra errore NullPointerException durante l'inserimento dell'importo 176.99 in assistenza. Il bonifico risulta effettuato ma il gestionale non salva i dati. Blocco critico che impedisce conferma ordine e spedizione merce. Richiesto supporto problemi tecnici immediato.,Amministrazione,alta,0,388
140,,"Timeout puntuale durante la ricerca fatture per data. La query va in errore solo se si seleziona un intervallo superiore a 30 giorni. Costringe gli operatori a fare ricerche frazionate. Molto scomodo per l'operatività quotidiana, serve ottimizzazione. - bug",Amministrazione,media,0,257
141,,"L'account admin_01 risulta bolccato per rtoppi tentativi di acc. errati. Serve sblocco manuale da parte dell'amministratore. L'utente deve completare l'inserimento ordini entro sera. Non è un problema di system generalizzato, solo utenza singola.",Amministrazione,media,0,246
142,,"Monitoraggio pasisvo dei log modulo gestione utenti per statistiche utilizzo. Analisi a posteriori dei tracciati per identificare trend di lungo periodo. Non ci sono errori attivi o malfunzionamenti. Attività di studio per future ottimizzazioni, senza impatto attuale. - relativo a pagamento",Amministrazione,bassa,0,291
143,,"Attività di background: archiviazione documenti storici cliente Disdero, Fantoin e Gottardi s.r.l. per anno 1991. Si tratta di spostare vecchi file (fatture, contratti) nell'archivio morto per liberare spazio. Nessuna urgenza operativa: il task può girare nei moemnti di inatitvità del sistema. pOerazione di manutenzione ordinaria del database.",Amministrazione,bassa,0,345
144,,"Mancata ricezione notifica approvazione ordine ORD-27317. Il responsabile ha approvato, ma l'email non è arrivata all'amministrazione. Senza notifica la doczione non parte. checkre code di posta in uscita su ambiente test. negoziazione per sconto - disponibilità",Amministrazione,media,0,262
145,,err. generazione PDF report vendite mensile. Il report esce con formattazione sballata nelle ultime pagine. I dati sono leggibili ma il documento è brutto da inviare al board. Correggere templaet di stampa. aggiornamento - sconto con listino,Tecnico,bassa,0,241
146,,"Pianificazione attività di shadowing per upgrade sys. CRM. Vorrei assistere alle operazioni della prossima settimana per imparare. Nessun intervento attivo richiesto, solo presenza come osservatore. Attività di formazione interna on-the-job.. Segnalato anche assistenza",Tecnico,media,0,269
147,,"Richiesta PDF aggiornato del manuale utente modulo reportistica. La versione sul server è obsoleta (manca capitolo 5). Non serve per attività correnti, ma per completezza archivio documentale. Invaire file quando disponibile.",Tecnico,bassa,0,225
148,,"Sessione di test esplorativo su ambiente staging per nuovi assunti. Utilizzo sandbox per prendere confidenza con le funzioni base. Nessun output atteso, solo attività didattica. Non richiede supervisione senior. - scadenzat",Tecnico,media,0,223
149,,Feedback su usabilità interfaccia assistenza: i colori dei grafici sono poco leggibili. Problema puramente cosmetico che non impatta le funzionalità. Valutare restyling grafico quando si metterà mano al frontend. Segnalazione di bassa priorità per backlog UX. - preventivo,Tecnico,media,0,272
150,,"Richiesta patch di sicurezza per libreria obsoleat in catalogo. Vulnerabilità media segnalata dal security scan. Non c'è exploit attivo, ma la policy richiede aggiornamento entro 30 giorni. Pianificare installazione patch in ambiente di test.",Tecnico,bassa,0,242
151,,Il sys. demo è completamente bloccato da questa mattina. Impossibile acceedre al modulo fatturazione e gestione ordini. Circa 8 utenti bloccati inclusi reparti amministrativi e commerciali. Errore restituito: ERR_TIMEOUT. Tutte operazioni business femre includendo emissione fatture per clienti Mnoicelli s.r.l. e conferma ordini. Intervento urgentissimo richiesto.,Tecnico,alta,0,365
152,,Segnalazione glitch grafico minore su reportistica in risoluzione 4K. Il fooetr si sovrappone legegrmente ma i bottoni funzionano. Difetto visivo marginale da correggere qaundo capiterà ocacsione. Non impatta l'poeratività degli utetni standard. - bonifico con pianificare,Tecnico,bassa,0,272
153,,sys. cmopletamente bloccato durante generazione preventivi per cliente Giacometti Group. Il modulo ordini va in crash con error SQL_ERROR_1045 quando si tenta calcolo per Lniea accessri. Team commerciale impossibilitato a inviare offerte. Scadenza opportunità entro entro 2 ore. Ripristino urgent necessario per non perdere vendita. per preventivo listino preventivo,Tecnico,alta,0,366
154,,Segnalazione glitch grafico minore su fatzione in risoluzione 4K. Il footer si sovrappone leggermente ma i bottoni funzionano. Difetto visivo marginale da correggere quando capiterà occasione. Non impatta l'operatività degli utenti standard. importo - pagamento,Tecnico,bassa,0,261
