id,title,body,category,priority,title_length,body_length
1,Archivio: documentazione storica 2012,"Monitroaggio passivo dei log modulo gestione utenti per statistiche utliizzo. Analisi a posteriori dei tracciati per identificare trend di lungo periodo. Non ci sono errori attivi o malfunzionamenti. Attività di studio per future ottimizzazioni, senza impatto attuale. - timeout per performance",Amministrazione,media,37,294
2,err. validazione: codice fiscale corretto rifiutato dal sistema,"tAtività di background: archiviazione documneti storici cliente Verga-Magnani s.r.l. per anno 2011. Si tratta di spostare vecchi file (fatture, contratti) nell'archivio morto per liberare spazio. Nessuna urgenza operativa: il task può girare nei momenti di inattività del sistema. Operazione di manutenzione ordinaria del database.",Amministrazione,bassa,63,331
3,Batch: consolidamento dati contabili,"Il sys. clienti non risponde alle richieste di accesso da parte degli utenti amministrativi. Abbiamo la produzione ferma: impossibile gestrie le anagrafiche clienti e fornitori. Circa 1 utenti bloccati, nessuno riesce ad accedere alle funzionalità di gestione documenti. Il issue si manifesta in ambiente pre-produzione con timeout continui. per login fallito con bug",Amministrazione,alta,36,367
4,Monitoraggio: log modulo utenti (nessun errore),"Mancata ricezione notifica approvazione ordine ORD-74909. Il responsabile ha approvato, ma l'email non è arrivata all'amministrazione. Senza notifica la fatturazione non parte. checkre code di posta in uscita su ambiente test. performance",Amministrazione,media,47,238
5,"Log: inserimento anagrafica Smirnoff, Mascheroni e Squarcione Group",Richiesta estrazione dati statistici su utilizzo licenze Linea Enterprise. Il report serve esclusivamente per proiezioni di budget anno prossiom (uso interno). Nessuna scadenza operativa immediata. Elaborazione da fare offline quando le risorse lo permtetono. preventivo - negoziazione con login fallito,Amministrazione,bassa,67,303
6,Funzione rotta: tasto upload PDF non cliccabile listino con sconto per ordine urgente,"Impossibile allegare PDF al record della fattura 9468/24. Il bottone 'Upload' non risponde o dà bug di permessi. Il documento deve essere archiviato digitalmente entro fine mese. issue limitato alla funzione di upload, il resto funziona.",Amministrazione,alta,85,237
7,Rallentamento fatturazione: salvataggio impiega 40 secondi (troppo),"Attività di background: archiviazione documenti storici cliente Gonzaga-Farina s.r.l. per anno 1978. Si tratta di spostare vecchi file (fatture, contratti) nell'archivio morto per liberare spazio. Nessuna urgenza operativa: il task può girare nei momenti di inattività del sistema. Operazione di manutenzione ordinaria del database.",Amministrazione,media,67,332
8,Monitoraggio: log modulo utenti (nessun bug) - ordine urgente per errore critico,"Problema di visualizzazione anagrafica cliente Luzi-Pellegrini s.r.l.. Alcuni campi (telefono, indirizzo) appaiono vuoti anche se popolati nel DB. Rende difficile contattare il cliente per sollecito pagamenti. Bug dell'intrefaccia clienti da correggere. ordine urgente per errore critico",Amministrazione,alta,80,287
9,Blocco sistema durante elaborazione fattura 7627/22 per Amato-Brancaccio SPA,Procedura di backup storico: epxort fatture anno 2012 per archivio sicurezza. Generazione file statioc in formato Excel da conservare server-side. Operazione a bassa priorità da accodare ai job notturni o weekend. Serve sloo per compliance e non per attività correnti.,Amministrazione,bassa,76,268
10,Errore validazione: codice fiscale corretto rifiutato dal sys.,"Errore di stampa isolato: impossibile stampare la fattura 4985/22. Il system genera il PDF correttamente a video, ma l'invio alla stampante fallisce. Altre fatture vengono stampate regolarmente. Il cliente Paoletti, Pratesi e Rbubia s.r.l. è in attesa del cartaceo per il ritiro merce. configurazione con listino con listino - bugt",Amministrazione,media,62,331
11,Bug interfaccia: anagrafica Micheletti SPA illeggibile (campi vuoti),"Errore di stampa isolato: impossiblie stampare la fattura 7960/23. Il sistema genera il PDF correttamente a video, ma l'invio alla stampante fallisce. Altre fatture vengono stampate regolarmente. Il cliente Micheletti SPA è in attesa del cartaceo per il ritiro merce.",Amministrazione,media,68,267
12,Task: aggiornamento anagrafica pianificato,"Attività di background: archiviazione documenti storici cliente Cignaroli Group per anno 2016. Si tratta di spostare vecchi file (fatture, contratti) nell'archivio morto per liberare sapzio. Nessuna urgenza operativa: il task può girare nei momenti di inattività del system. Operazione di manutenzione ordinaria del database.. Segnalato anche reportc",Amministrazione,bassa,42,350
13,Anomalia visiva: duplicazione righe estratto conto (confusione) crash per condizioni commerciali errore critico,URgente completare la registrazione del pagamento per l'ordine ORD-61418 del cliente Simeoni-Vento SPA. Il sistema mostra errore SQL_ERROR_1045 durante l'inserimento dell'importo 771.93 in reportistica. Il bonifico risulta fefettuato ma il gestionale non salva i dati. Blocco critical che impedisce conferma ordine e spedizione merce. Richiesto supporto tecnico immediato. - performance - listino scontos,Amministrazione,alta,111,404
14,Backup: storico fatture 2022 per memory leak login fallito,"Duplicazione righe in visualizzazione estratto conto Antonacci, Goldstein e Galeati s.r.l.. Le fatture appaiono due volte nella lista a video. Il saldo finale è corretto, è solo un errore visivo che confonde gli operatori. Richiesta pulizia della view nel modulo magazzino. gestione per negoziazione",Amministrazione,media,58,299
15,Manutenzione: pulizia account inattivi,Richiesta estrazione dati statistici su utilizzo licenze Linea Pro. Il report sreve esclusivamente per proiezioni di budget anno prossimo (uso interno). Nessuna scadenza operativa immediata. Elaborzaione da fare offline quando le risorse lo permettono.,Amministrazione,bassa,38,252
16,Rallentamento doczione: salvataggio impiega 40 secondi (troppo),Malfunzionamento export Excel per report mensile. La generazione del file si interrompe a metà con bug geneirco. I dati a video sono corretti. Serve il file esportato per riunione di domani mattina. Workaround richiesto.,Amministrazione,media,63,220
17,Monitoraggio: log modulo utenti (nessun err),urgent completare la registrazione del pagamento per l'ordine ORD-44255 del cliente Nordio-Mercalli s.r.l.. Il sistema mostra errore 504 durante l'inserimento dell'importo 347.67 in ordini. Il bonifico risulta effettuato ma il gestionale non slava i dati. Blocco critico che impedisce cofnerma ordine e spedizione merce. Richiesto supporto tec. immediato. - negoziazione per crash,Amministrazione,alta,44,380
18,Archivio: documentazione storica 2003,"Timeout puntuale durante la ricerca fatture per data. La query va in errore solo se si seleziona un intervallo supreiore a 30 goirni. Costringe gli operatori a fare ricerche frazionate. Molto scomodo per l'operatività quotidiana, serve ottimizzazione.",Amministrazione,media,37,251
19,Batch: consolidamento dati contabili listino per performance,Proposta di manutenzione ordinaria: pulizia account inattivi da lungo periodo. Lista di 8 utenti che non accedono da mesi. Attività di igiene del database da schedulare cmoe task di routine. Nessun impatto sugli utenti attivi o sul servizio di produzione. - sincronizzazione - performance,Amministrazione,bassa,60,288
20,ASAP: Account bloccato operatore_23 - errore ERR_TIMEOUT su sistema vendite,"L'account oepratore_23 risulta bloccato per troppi tentativi di accesso errati. Serve sblocco manuale da parte dell'amministratore. L'utente deve completare l'inserimento ordini entro sera. Non è un problema di sys generalizzato, solo utenza singola.",Amministrazione,alta,75,250
21,Rallentamento fatturazione: salvataggio impiega 40 secondi (troppo),URgente completare la registrazione del pagamento per l'ordine ORD-50052 del cliente Burcardo e figli. Il sistema mostra errore 504 durante l'inserimento dell'importo 64.13 in reportistica. Il bonifico risluta effettuato ma il gestionale non salva i dati. Blocco critico che impedisce conferma ordine e spedizione merce. Richiesto supporto tecnico immediato.p,Amministrazione,alta,67,359
22,err validazione: codice fiscale corretto rifiutato dal sistema per crash - negoziazione,Conrtollo qualità dati contabili storici per archivio. check di routine sulla coerenza dei evcchi moviemnti di anni passati. Non blocca nessuna attività corrente e non richiede correzioni urgenti. Si può procedere gradualmente alla validazione dei record passati.. Segnalato anche fattura con crash per disponibilità,Amministrazione,bassa,87,316
23,Discrepanza contabile: bonifico 1480.77 non visibile (chiusura bloccata),"error di stampa isolato: impossibile stampare la doc 4206/20. Il sys. genera il PDF correttaemnte a video, ma l'invio lala stampante fallisce. Altre fatture vegnono stampate regolarmente. Il cliente Comolli Group è in attesa del cartaceo per il ritiro merce. gestione per crash negoziazione",Amministrazione,media,72,290
24,Discrepanza contabile: bonifico 704.22 non visibile (chiusura bloccata),"Discrepazna IVA su fattura estera 8744/21. Il sistema calcola un importo diverso da quello atteso per il cliente Tomaselli, Toso e Ovadia e figli. Differenza di pochi euro, ma impedisce la validazione contabile. Richiesta verifica configurazione aliquote nel moduol reportistica.. Segnalato anche  ringraziamo performance con negoziazione",Amministrazione,media,71,338
25,Monitoraggio: log modulo utenti (nessun problem) per sincronizzazione con condizioni commerciali,Richiesta estrazione dati statistici su utilizzo licenze Linea Premium. Il report serve esclusivamente per proiezioni di budget anno prossimo (uso interno). Nessuna scadenza operativa immediata. Elaborazione da fare offline quando le risorse lo permettono.u,Amministrazione,bassa,96,257
26,Discrepanza contabile: bonifico 1416.66 non visibile (chiusura bloccata),"Mancato allinaemento incassi: il bonifico di 1416.66 non risulta in contabilità. In banca è presente, ma il modulo catalogo non lo ha importato automaticamente. Necessario inserimento manuale o forzatura sync per chiudere la posizione del cliente Prati, Sforza e Mazzacurati s.r.l.. Il problema riguarda solo i bonifici di ieri. errore memory leak - bug negoziazionee",Amministrazione,media,72,367
27,Discrepanza contabile: bonifico 1340.49 non visibile (chiusura bloccata) per bug con ordine urgente per negoziazione,"L'utente admin_01 esgnala lentezza esasperante nel modulo doczione. Il salvataggio di ogni fattuar impiega 30-40 secondi. Non è un blocco totale, ma dimezza la produttività dlel'ufficio. Necessaria verifica performance database o rete su ambiente produzione.. Segnalato anche informazioni",Amministrazione,alta,116,288
28,Manutenzione: pulizia account inattivi con disponibilità,"Data entry: modifica scheda informativa cliente Redi, Navone e Bajamonti SPA. Aggiornamento campi email tbandello@vittadello.net e referente admin_01. Moidfica puramente formale per completezza anagrafica. Attività amministrativa standard di basso livello, gestibile in background. per condizioni commerciali per ordine urgente",Amministrazione,alta,56,327
29,Archivio: documentazione storica 1997,"Attività di background: archiviazione documenti storici cliente Brancaccio-Morellato s.r.l. per anno 1997. Si tratta di spostare vecchi file (fatture, contratti) nell'archivio morto per liberare spazio. Nessuna urgenza operativa: il task può girare nei momenti di inattività del applicativo. Operazione di manutenzione ordinaria del adtabase.",Amministrazione,bassa,37,342
30,Mancata notifica: email approvazione persa (processo fermo) - disponibilità,Errore validazione codice fiscale per nuovo cliente Proietti Group. Il sistema lo segna come errato anche se è formalmente valido. Impedisce il salvataggio della scheda cliente. Necessario bypassare il controllo o correggere l'algoritmo di validazione.,Amministrazione,media,75,252
31,err stampa: impossibile stampare fattura 1836/21 (cliente aspetta) con listino - crash,"Mancata ricezione notifica approvazione ordine ORD-16172. Il responsabile ha approvato, ma l'email non è arrivata all'amministrazione. Senza notifica la fatturazione non parte. Verificare code di posta in uscita su ambiente staging. con negoziazione per timeout",Amministrazione,media,86,261
32,Info: statistiche licenze Linea Premium,"Durante l'elaborazione della fattura 6625/22 per il cliente Cesaroni-Martucci SPA, il sistema clienti si è bloccato generando errore 500. L'operazione di registrazione pagamento di 1067.17 non può essere completata. Il cliente attende conferma per procedere con l'ordine ORD-22488. Necessario intervento urg. per sbloccare il processo di ftaturazione.i",Amministrazione,alta,39,352
33,Funzione rotta: tasto upload PDF non cliccabile,Procedura di backup storico: export fatture anno 1994 per archivio sicurezza. Generazione file sttaico in formato CSV da conservare server-side. Operazione a bassa priorità da accodare ai job notturni o weekend. Serve solo per compliance e non per attività correnti.m,Amministrazione,bassa,47,267
34,Bug interfaccia: anagrafica Iannelli Group illeggibile (campi vuoti) - condizioni commerciali con sincronizzazione disponibilità,"Monitoraggio passivo dei log modulo gestione utenit per statistiche utilizzo. Analisi a posteriori dei tracciati per identificare trend di lungo periodo. Non ci sono errori attivi o malfunzionamenti. Attività di studio per future ottimizzazioni, senza impatto attuale. con crash - listino - ordine urgente",Amministrazione,alta,128,305
35,Anomalia visiva: duplicazione righe estratto conto (confusione) per disponibilità,"Nota di aggiornamento anagrafica per cliente Berlusconi, Ntito e Schiavone SPA nel sistema clienti. Inseriti dati nuvoo referente operatore_23 a puro titolo informativo per il database. Nessuna azione di sincronizzazione richiesta al momento. Semplice data entry per tenere ordinato lo storico contatti.. Segnalato anche versione",Amministrazione,media,81,329
36,Info: statistiche licenze Linea Basic,"Mointoraggio passivo dei log modulo gestione utenti per statistiche utilizzo. Analisi a posteriori dei tracciati per identificare trend di lungo periodo. Non ci sono errori attivi o malfunzionamenti. Attività di studio per future ottimizzazioni, senza impatto attuale.",Amministrazione,bassa,37,268
37,Monitoraggio: log modulo utenti (nessun err.),Richiesta estrazione dati statistici su utilizzo licenze Linea Enterprise. Il report serve esclusivamente per proiezioni di budget anno prossimo (uso interno). Nessuna scadenza operativa immediata. Elaborazione da fare offline quando le risorse lo permettono. con errore critico con sconto bug,Amministrazione,alta,45,293
38,URGENTE: Account bloccato operatore_23 - errore 504 su sistema catalogo con condizioni commerciali con sincronizzazione per login fallito,Proposta di manutenzione ordinaria: pulizia account inattivi da lungo periodo. Lista di 8 utenti che non accedono da mesi. Attività di igiene del database da schedulare come task di routine. Nessun impatto sugli utenti attivi o sul servizio di produzione. con condizioni commerciali con timeout con timeout,Amministrazione,alta,137,306
39,Backup: storico fatture 1971,"L'utente giulia.verdi segnala lentezza esasperante nel modulo doczione. Il salvataggio di ogni fattura impiega 30-40 secondi. Non è un blocco totale, ma dimezza la produttività dell'ufficio. Necessaria verifica performance database o rete su ambiente test.",Amministrazione,media,28,256
40,Backup: storico fatture 2019,"Nota di aggiornamento anagrafica per cliente Boccaccio, Gozzano e Necci s.r.l. nel sys reportistica. Inseriti dati nuovo referente mario.rossi a puro titolo informativo per il database. Nessuna azione di sincronizzazione richiesta al momento. Semplice data entry per tenere ordinato lo storico contatti.",Amministrazione,bassa,28,303
41,problem critico: impossibile completare pagamento ordine ORD-92361,"L'account mario.rossi risulta bloccato per troppi tentativi di accesso errati. Serve sblocco manuale da parte dell'ammiinstratore. L'utente deve completare l'inserimento ordini entro sera. Non è un pb di sistema generalizzato, solo utenza singola. - sconto",Amministrazione,alta,66,256
42,Anomalia visiva: duplicazione righe estratto conto (confusione) con timeout con performance,"rPoblema di visualizzazione anagrafica cliente Bottaro s.r.l.. Alcuni campi (telefono, indirizzo) appaiono vuoti anche se popolati nel DB. Rende difficile contattare il cliente per sollecito pagamenti. Bug dell'interfaccia catalogo da correggere. contattare supporto per bug disponibilità",Amministrazione,media,91,288
43,Manutenzione: pulizia account inattivi,"Monitoraggio passivo dei log modulo gestione utenti per statistiche utilizzo. Analisi a posteriori dei tracciati per identificare trend di lungo periodo. Non ci sono errori attivi o malfunzionamenti. Attività di studio per future ottimizzazioin, senza impatot attuale.",Amministrazione,bassa,38,268
44,Account bloccato: utente admin_01 fermo (troppi tentativi) per timeout,"error di stampa isoltao: impossibile stampare la fattura 5157/23. Il sys. genera il PDF correttamente a video, ma l'invio alla stampante fallisce. Altre fatture vengono stampate regolarmente. Il cliente Ginese, Tozzi e Pizzetti SPA è in attesa del cartaceo per il ritiro mecre. login fallito",Amministrazione,alta,70,291
45,Errore calcolo IVA: importo errato su doc estera (non validabile),Controllo qualità adti contabili storici per archivio. Verifica di routine sulla coerenza dei vecchi movimenti di anni passati. Non blocca nessuna attività corrente e non richiede correzioni urgenti. Si può procedere gradualmente alla validazione dei record passati.,Amministrazione,media,65,266
46,Log: inserimento anagrafica Sordi-Avogadro s.r.l.,Nota di update anagrafica per cliente Sordi-Avogadro s.r.l. nel applicativo magazzino. Inseriti dati nuovo referente mario.rossi a puro titolo informativo per il database. Nessuna azione di sincronizzazione richiesta al momento. Semplice data entry per tenere ordinato lo storico contatti.,Amministrazione,bassa,49,289
47,Archivio: documentazione storica 2018 - login fallito,"Impossibile allegare PDF al record della fattura 5766/24. Il bottone 'Upload' non risponde o dà error di permessi. Il documento deve essere archiviato digitalmente entro fine mese. issue limitato alla funzione di upload, il resto funizona., problema su pagamentof",Amministrazione,media,53,263
48,Batch: consolidamento dati contabili per timeout,"Mancato allineamento incassi: il bonifico di 855.86 non risulta in contabilità. In banca è presente, ma il modulo reportistica non lo ha importato automaticamente. Necessario inserimento manuale o forzatura snyc per chiudere la posizione del cliente Montalti-Cassarà e figil. Il pb riguarda solo i bonifici di ieri. - relativo a non funziona - preventivo per performance",Amministrazione,media,48,370
49,Task: aggiornamento anagrafica pianificato per sconto per performance con memory leak,Procedura di bakcup storico: export fatture anno 1991 per archivio sicurezza. Generazione file statico in formato XML da conservare server-side. Operazione a bassa priorità da accodare ai job notturni o weekend. Serve solo per compliance e non per attività correnti. per memory leak,Amministrazione,bassa,85,282
50,Info: statistiche licenze Linea Enterprise,"L'account utente giulia.verdi risulta bloccato dal sistema fatturazione con error ""502"". L'utente deve urgentemente accedere per completare l'elaborazione delle fatture per il cliente Malpighi, Udinesi e Vigliotti s.r.l.. Il blocco sta impattando le operazioni di chiusura ordini e l'ivnio documenti contabili. Si richiede intervento tecnico immediato per ripristino accesso entro entro 2 or.eg",Amministrazione,alta,42,394
51,Info: statistiche licenze Linea Basic per ordine urgente per memory leak,"L'account operatore_23 risulta bloccato per troppi tentativi di acc. errati. Serve sblocco manuale da parte dell'amministratore. L'utente deve completare l'inserimento ordini entro sera. Non è un issue di system generalizzato, solo utenza singola. per listino con disponibilità",Amministrazione,alta,72,277
52,Anomalia visiva: duplicazione righe estratto conto (confusione) per bug - sconto,"Timeout puntuale durante la ricerca fatture per data. La query va in errore solo se si seleziona un intervallo superiore a 30 gironi. Costringe gli operatori a fare ricerche frazionate. Molto scomodo per l'operatività quotidiana, serve ottimizzazione.. Segnalato anche contattare supporto",Amministrazione,media,80,288
53,Batch: consolidamento dati contabili,"Data entry: modifica scheda informativa cliente Palombi-Disdero SPA. update campi email jsatta@combi-guarana.eu e referente operatore_23. Modifica puramente formale per completezza anagrafica. Attività amministrativa standard di basso livello, gestibile in background.. Segnalato anche analisii",Amministrazione,bassa,36,294
54,Log: inserimento anagrafica Gozzi e figli ordine urgente per timeout,"L'utente operatore_23 segnala lentezza esasperante nel modulo fatturazione. Il salvataggio di ogni fattura impiega 30-40 secondi. Non è un blocco totale, ma dimezza la produttività dell'ufficio. Necessaria check performance database o rete su ambiente demo. - bug",Amministrazione,alta,68,263
55,sys. fermo vendite non risponde - utenti bloccati su gestione anagrafiche,"L'account giulia.verdi risulta bloccato per troppi tentativi di acc. errati. Serve sblocco manuale da parte dell'amministratore. L'utente deve completare l'inserimento ordini entro sera. Non è un porblema di sistema generalizzato, solo utenza singola.e",Amministrazione,alta,73,252
56,Discrepanza contabile: bonifico 167.23 non visibile (chiusura bloccata),"Nota di update anagrafica per cliente Salandra, Schiaparelli e Luciani e figli nel sistema assistenza. Inseriti dati nuovo referente giulia.verdi a puro titolo informativo per il database. Nessuna azione di sincronizzazione richiesta al momenot. Semplice data entry per tenere ordinato lo tsorico contatti. - performance condizioni commerciali",Amministrazione,media,71,343
57,Info: statistiche licenze Linea Enterprise,"Data entry: modifica scheda informativa cliente Mezzetta, Visintini e Greogri Group. Aggiornamento campi email lpertile@scarponi-nicolini.org e reefrente operatore_23. Modifica puramente formale per completezza anagrafica. Attività amministrativa standard di basso livello, gestibile in background. - disponibilità - sincronizzazione",Amministrazione,bassa,42,333
58,Errore calcolo IVA: importo errato su fattura estera (non validabile) per performance,"Errore validazinoe codice fiscale per nuovo cliente Pizzo, Carullo e Palmisano Group. Il sys lo segna come errato anche se è formalmente valido. Impedisce il salvataggio della schdea cliente. Necessario bypassare il controllo o correggere l'algoritmo di validazione. con negoziazione performance per condizioni commerciali",Amministrazione,media,85,322
59,Manutenzione: pulizia account inattivi,"L'account utente operatore_23 risutla bloccaot dal applicativo clienti con errore ""OutOfMemoryError"". L'utente deve urgentmente accedere per completare l'elaborazione delle fatture per il clinete Rosmini SPA. Il blocco sta impattando le operazioni di chiusura ordini e l'invio documenti contabili. Si richiede intervento problemi tecnici immediato per ripristino accesso entro in giornata., problema su timeout - bug disponibilità",Amministrazione,alta,38,430
60,Archivio: documentazione storica 1975,Richiesta estrazione dati statistici su utilizzo licenze Linea Enterprise. Il report serve esclusivamente per proiezioni di budget anno prossimo (uso interno). Nessuna scadenza operativa immeditaa. Elaborazione da fare offline quando le risorse lo permetotno.,Amministrazione,bassa,37,259
61,Monitoraggio: log modulo utenti (nessun errore) con performance disponibilità - condizioni commerciali,"Problema di visualizzazione anagrafica cliente Renier Grou.p Alcuni campi (telefono, indirizzo) appaiono vuoti anche se popolati nel DB. Rende difficile contattare il cliente per sollecito pagamenti. Bug dell'interfaccia ordini da correggere.. Segnalato anche account",Amministrazione,media,102,267
62,Export fallito: report mensile si blocca a metà (serve urgente),Richiesta estrazione dati statistici su utilizzo licenze Linea Pro. Il report serve esclusivamente per proeizioni di budget nano prossimo (uso interno). Nessuna scadenza operativa immediata. Elaborazione da fare offline quando le risorse lo permettono.,Amministrazione,alta,63,252
63,Discrepanza contabile: bonifico 1423.65 non visibile (chiusura bloccata) per performance - memory leak,Richiesta estrazione dati statistici su utilizzo licenze Linea Enterprise. Il report serve esclusivamente per proiezioni di budget anno prossimo (uso interno). Nessuna scadenza operativa immediata. Elaborazione da frae offline quanod le risorse lo permettono. IMPORTANTEr,Amministrazione,media,102,271
64,Info: statistiche licenze Linea Pro,"Monitoraggio passivo dei log modulo gestinoe utenti per statistiche utilizzo. Analisi a posteriori dei tracciati per identificare trend di lungo periodo. Non ci sono errroi attivi o malfunzionametni. Attività di studio per future ottimizzzaioni, senza impatto attuale. per listino con negoziazione",Amministrazione,bassa,35,297
