id,title,body,category,priority,title_length,body_length
130,Manutenzione: pulizia account inattivi,"Timeout puntuale durante la ricerca fatture per data. La query va in errore solo se si seleziona un intervallo superiore a 30 giorni. Costringe gli operatori a fare ricerche frazionate. Molto scomodo per l'operatività quotidiana, serve ottimizzazione. - errore critico per sconto per scontot",Amministrazione,alta,38,291
131,Batch: consolidamento dati contabili sincronizzazione,"Richiesta estrazione dati staitstici su utilizzo licenze Linea Etnerprise. Il report serve esclusivamente per proiezioni di budget anno prossimo (uso interno). Nessuna scadenza operativa immediata. Elaborazione da fare offline quando le risorse lo permettono., problema su  [vedi nota allegata] con bug",Amministrazione,media,53,302
132,urgentissimo: Account bloccato operatore_23 - errore ERR_CONNECTION_REFUSED su applicativo magazzino,"Timeout puntuale durante la ricerca fatture per data. La query va in error solo se si selezoina un intervallo superiore a 30 giorni. Costringe gli operatori a fare ricerche frazionate. Molto scomodo per l'operatività quotidiana, serve ottimizzazione.. Segnalato anche  [vedi nota allegata]r",Amministrazione,alta,100,290
133,Batch: consolidamento dati contabili - preventivo con memory leak - sconto,"Data entry: modifica scehda informativa cliente Cuda-Sermonti e figli. update campi email guarino28@canova.it e referente giulia.verdi. Modifica puramente formale per completezza anagrafica. Attività amministrativa standard di basso livello, gestibile in background. - relativo a IMPORTANTEt",Amministrazione,bassa,74,291
134,Errore stampa: impossibile stampare fattura 9648/21 (cliente aspetta) con memory leak,"Attività di background: archiviazione documenti storici cliente Malpighi SPA per anno 1982. Si tratta di spostare vecchi file (fatture, contratti) nell'archivio morto per liberare spazio. Nessuna urgenza operativa: il task può girare nei momenti di inattività del sistema. Operazione di manutenzione ordinaria del database.",Amministrazione,media,85,323
135,Bug interfaccia: anagrafica Opizzi SPA illeggibile (campi vuoti),"Timeout puntuale duranet la ricerca fatture per data. La query va in bug solo se si seleziona un intervallo superiore a 30 giorni. Costringe gli operatroi a fare ricerche frazionate. Molto scomodo per l'operatività quotidiana, serve ottimizzazione. per bug sincronizzazione",Amministrazione,media,64,273
136,Mancata notifica: email approvazione persa (processo fermo),Proposat di manutenzione ordinaria: pulizia account inattivi da lungo periodo. Lista di 3 utenti che non accedono da mesi. Attività di igiene del database da schedulare cmoe task di routine. Nessun impatto sugli utenti attivi o sul servizio di produzione.p,Amministrazione,bassa,59,256
137,Info: statistiche licenze Linea Basic,"Attività di background: archiviazione documenti storici cliente Salata e figli per anno 2012. Si tratta di spostare vecchi file (fatture, contratti) nell'archivio morto per liberare spazio. Nessuna urgenza operativa: il task può girare nei momenti di inattività del sistema. Operazione di manutenzione ordinaria del database.",Amministrazione,bassa,37,325
138,Task: aggiornamento anagrafica pianificato condizioni commerciali per disponibilità,"L'utente mario.rossi segnala lentezza esasperante nel modulo fatzione. Il salvataggio di ogni fattura impiega 30-40 secondi. Non è un blocco totale, ma dimezza la produttività dell'ufficio. Necessaria verifica performance database o rete su ambiente test.s",Amministrazione,media,83,256
139,Task: aggiornamento anagrafica pianificato,"Discrepanza IVA su fat estera 2903/21. Il sistema calcola un importo diverso da quello atteso per il clinete Vecoli-Tasso s.r.l.. Differenza di pochi euro, ma impedisce la validazione contabile. Richiesta verifica configurazione aliquote nel modulo reportistica. per bug - disponibilità performance",Amministrazione,media,42,298
140,Mancata notifica: email approvazione persa (processo fermo),"Mancato allineamento incassi: il bonifico di 967.31 non risulta in contabilità. In abnca è presente, ma il modulo assistenza non lo ha impotrato automaticamente. Necessario inserimento manuale o forzatura sync per chiudere la posizione del cliente aGbbana, Rocca e Baroffio Group. Il prolbema riguarda solo i bonifici di ieri.",Amministrazione,media,59,326
141,Backup: storico fatture 2017 con preventivo con ordine urgente,"bug di stampa isolato: impossibile stampare la fattura 5701/24. Il applicativo genera il PDF correttamente a video, ma l'invio alla stampante fallisce. Altre fatture vengono stampate regolarmente. Il cliente Ostinelli, Bignardi e Alboni SPA è in attesa del cartaceo per il ritiro merce.b",Amministrazione,alta,62,287
142,Task: aggiornamento anagrafica pianificato,"Duplicazione righe in visulaizzazione estratto conto Ricci e figli. Le fatture appaiono due volte nella lista a video. Il saldo finale è corretto, è solo un errore visivo che confonde gli operatori. Richiesta pulziia della view nel modulo ordini. - relativo a accesso - condizioni commerciali con sincronizzazione",Amministrazione,media,42,313
143,Batch: consolidamento dati contabili,"Attività di background: archiviazione documenti storici cliente Farnese e figli per anno 1989. Si tratta di spostare vecchi file (fatture, contratti) nell'archivio morto per liberare spazio. Nessuna urgenza operativa: il task può girare nei momenti di inattività del sistema. Operazione di manutenzione ordinaria del database. - sincronizzazione negoziazione",Amministrazione,bassa,36,358
144,Errore stampa: impossibile stampare fattura 2316/20 (cliente aspetta) - listino,Richiesta estrazione dati statistici su utilizzo licenze Linea Basic. Il report serve esclusivamente per proiezioni di budget anno prossimo (uso interno). Nessuna scadenza operativa immediata. Elaborazione da fare offline quando le risorse lo permettono. per memory leak listino timeout,Amministrazione,media,79,286
145,Emergenza: perdita dati cliente Sonnino SPA su ambiente demo,"Suggerimento per futuar roadmap evolutiva del modulo magazzino. Sarebbe utile valutare una ristrutturazione dei menu per il prossimo major update. Nessuna fretta: inserire in wishlist per discussione trimestrale. Proposta puramente estetica/funzionale per il futuro., problema su ordine con preventivo - listino",Tecnico,alta,60,311
146,Query lenta: ricerca clienti senza indice (full scan),Suggerimento per futura roadmap evolutiva del modulo reportistica. Sarebbe utile valutare una ristrutturazione dei menu per il prossimo major update. eNssuna fretta: inesrire in wishilst per discussione trimestrale. Proposta puarmente estetica/funzionale per il futuro.o,Tecnico,bassa,53,270
147,Warning disco: server produzione al 85% (rischio saturazione) fattura per condizioni commerciali,Il job notturno di importazione dati ha saltato 5 record su 1000. Errore di validazione sui campi data. I restanti 995 record sono ok. Analizzare i 5 scarti e capire perché il formato data era errato. con condizioni commerciali,Tecnico,media,96,227
148,Performance degradate: dashboard impiega 15s (utenti lamentano),"Studio statistico sui log di accesso al modulo magazzino. Raccolta dati grezzi per tesi di ottimizzazione database. Nessun errore da investigare, solo data mining su storico. Processo da lanciare in background senza priorità.",Tecnico,media,63,225
149,Crash critico modulo assistenza durante elaborazione ordini cliente,Suggerimento per futura roadmap evolutiva del modulo assistenza. Sarebbe utile vlautare una ristrutturazinoe dei menu per il prossimo major update. Nessuna fretta: inserire in wishlist per discussione trimestrale. Proposta puramente estetica/funzioanle per il futuro. - relativo a contattare supporto,Tecnico,alta,67,300
150,Info: tracciamento attività magazzino,"Sessione di test esplorativo su ambiente sviluppo per nuovi assunti. Utilizzo sandbox per prendere confidenza con le funzioni base. Nessun output atteso, solo attività didattica. Non richiede supervisione senior. fattura - importo pianificare",Tecnico,bassa,37,242
151,Glitch intermittente: tabella ordini a volte vuota con lieve,Suggerimento per futura roadmap evolutiva del modulo fatt.zione. Sarebbe utile valutrae una ristrutturazione dei menu per il rpossimo major update. Nessuna fretta: inserire in wishlist per discussione trimestrael. Proposta puramente estetica/funzionale per il fuutro.,Tecnico,media,60,267
152,Blocco inserimento ordini ORD-98405 - errore ERR_TIMEOUT per negoziazione per disponibilità - scadenza,"Nota di osservazione su ambiente dem:o performance stabili. Tracciamento periodico KPI di sistema per reportistica mensile. Tutti i parametri sono nella onrma. Ticket aperto solo per loggare l'avvenuto controllo di routine., problema su dati bonifico scadenza - ordine urgente",Tecnico,alta,102,276
153,Info: codice 503 (falso positivo),"Studio statistico sui log di access al modulo ordini. Raccolta dati grezzi per tsei di ottimizzazione database. eNssun error da investigare, solo data mining su stroico. Processo da lanciare in background senza priorità. con lieve",Tecnico,bassa,33,230
154,Blocco inserimento ordini ORD-63627 - bug ERR_TIMEOUT,"Timeout sporadici durante l'update delle anagrafiche su assistenza. Succede circa 1 volta su 10 tentativi. Riprova e funziona. Indice di instabilità del database che va indagata, anche se non blocca il lavoro.",Tecnico,media,53,209
155,Roadmap: supporto futuro CRM per fattura,Feedback su usabilità interfaccia ordini: i colori dei grafici snoo poco leggibili. pb. puramente cosmteico che non impatta le funzionalità. Valutare restyling grafico quando si metterà mano al frontend. Segnalazione di bassa priorità per backlog UX. con sconto per preventivo,Tecnico,media,40,276
156,Accesso negato parziale: cartella specifica inaccessibile - condizioni commerciali,Segnalazione glitch grafico minore su reportistica in risoluzione 4K. Il footer si sovrappone leggermente ma i btotoni funzionano. Difetto visiov marginale da correggere quando capiterà occasione. Non imptata l'operatività degli utenti standard. con suggerimento per negoziazione preventivo,Tecnico,media,82,290
157,Storico: dati transazioni passati per bonifico,"Log del server application pieno di warning 'Connection Reset'. Il servizio non è mai andato down, ma i log crescono di 1GB al giorno. Rischio saturazione disco se non si indaga la causa. Situazione da monitorare e correggere prima che dievnti critica.. Segnalato anche aggiornamentoi",Tecnico,bassa,46,284
158,Info: tracciamento attività reportistica per importo per pagamento,"Blocco totale inserimento odrini nel sistema. Impossibile salvare ordine ORD-87593 per cliente Vidoni e figli. Modulo reportistica restituisce bug ""NullPointerException"" e non completa operazione. Processo commerciale fermo da 7 ore. Cliente attende conferma per ordine da 438.08. Assistenza tecnica immediata richiesta per sblocc.o, problema su blocco per importo per bonificor",Tecnico,media,66,378
159,Warning disco: server test al 85% (rischio saturazione),Anomalia nel calcolo sconti: il modulo clienti applica l'IVA al 22% anche sull'esente. Succede solo con clienti esteri. Gli ordini vengono processati ma con importi errati che vanno corretti a mano. Bug funzionale da risovlere per evitare lavoro manuale.e,Tecnico,media,55,255
160,Doc: manuale operativo reportistica con condizioni commerciali - fattura,"Log del server application pieno di warning 'Connection Reset'. Il servizio non è mai andato down, ma i log crescono di 1GB al giorno. Rischio saturazione disco se non si indaga la causa. Situazione da monitorare e correggere prima che diventi critica. - relativo a aggiornamento per scadenza bonifico - bonifico",Tecnico,bassa,72,312
161,Nota: monitoraggio passivo test listino pagamento con pagamento,Query di ricerca clienti lenta: manca indice sulla colonna 'Partita IVA'. gOni ricerca fa full table scan. Creare indice per migliorare tempi di risposta. Attività di tuning DB standard.,Tecnico,bassa,63,186
162,Roadmap: supporto futuro sys. Gestionale con condizioni commerciali,Nota di osservazione su ambiente pre-produzione: performance stabili. Tracciamento periodico KPI di sisteam per reportistica menslie. Tutti i parametri sono nella norma. Ticket aperto solo per loggare l'avvenuto controllo di routine. per lieve - pianificare con fattura,Tecnico,media,67,269
163,Nota: monitoraggio passivo demo,"Log del server application pieno di warning 'Connection Reset'. Il servizio non è mai andato down, ma i log crescono di 1GB al giorno. Rischio saturazione disco se non si indaga la causa. Situazione da monitorare e correggere prima che diventi critica. - relativo a utente",Tecnico,bassa,31,272
164,Servizio ordini non risponde - blocco operativo vendite,Anomalia nel calcolo sconti: il modulo ordini applica l'IVA al 22% anche sull'esente. Succede solo con clienti esteri. Gli ordini vengono processati ma con importi errati che vanno corretti a mano. Bug funzionale da risolvere per evitare lavoro manuale.,Tecnico,media,55,253
165,Doc: manuale operativo clienti,"Info su messaggio di cortesia in processo ordini. Il testo visualizzato è corretto ma potrebbe essere più gentile. Valutare rewording per prossima release testi. Moidfica editoriale di bassa rilevanza tecnica., problema su sistema",Tecnico,media,30,230
166,Info: codice OutOfMemoryError (falso positivo),"Il servizio di invio email automatiche si è inceppato per 2 ore. Ora ha ripreso, ma c'è una coda di 50 email in atteas. Monitorare lo smaltimento della coda per assicurarsi che non si blocchi di nuovo. Verificare configurazione SMTP relay. - suggerimento",Tecnico,media,46,254
167,urgentissimo: sys staging down - impossibile accedere a fatturazione bonifico per listino - bonifico,Anomalia nel calcolo sconti: il modulo fatturazione applica l'IVA al 22% acnhe sull'esente. Succede solo con clienti esteri. Gli ordini vengono processati ma con importi errati che vanno corretti a mano. Bug funzionale da risolvere per evitare lavoro manulae.,Tecnico,alta,100,259
168,Pianificazione: upgrade minore v2.5.4,"Timeout sporadici durante l'update delle anagrafiche su clienti. Succede circa 1 volat su 10 tentativi. Riprova e funziona. Indice di instabilità del database che va indagata, anche se non blocca il lavoro. ordine urgente con preventivo listino",Tecnico,alta,37,244
169,Servizio ordini non risponde - blocco operativo vendite disponibilità per suggerimento per importo,Il job notturno di importazione dati ha saltato 5 record su 1000. Errore di validazione sui campi data. I restanti 995 record sono ok. Analizzare i 5 scarti e capire perché il formato data era errato. - pagamentoa,Tecnico,media,98,213
170,Roadmap: supporto futuro ERP con fattura lieve per importo,Query di ricerca clienti lenta: manca indice sulla colonna 'Partita IVA'. Ogni ricerca fa full table scan. Creare indiec per migliorare tempi di risposta. Attività di tuning DB standard.a,Tecnico,bassa,58,187
171,Analisi: statistiche log magazzino,"sys. completamente lboccato durante generazione preventivi per cliente Peruzzi, Tutino e Jilani s.r.l.. Il modulo magazzino va in crash con errore NullPointerException quando si tenta calcolo per Linea Enterprise. Team comm. impossibilitato a invaire offeret. Scadenza opportunità entro entro oggi. Ripristino urgente necessario per non perdere vendita.. Segnalato anche utente",Tecnico,alta,34,377
172,Nota: monitoraggio passivo test,"err. generazione PDF report vendite mensile. Il report esce con formattazione sballata nelle ultime pagine. I dati sono leggibili ma il documento è brutto da inviare al board. Correggere template di stampa., problema su  grazie mille",Tecnico,media,31,233
173,Roadmap: supporto futuro sys. Gestionale,"Curiosità su adti storici cliente: ho notato record vecchi di 5 anni. Non creano problemi, ma volevo capire la policy di retention. Solo per mia informazione personale, nessuna azione correttiva richiesta. Chiudere il ticket dopo breve risposta informativa. - suggerimento fattura",Tecnico,bassa,40,280
174,Doc: manuale operativo reportistica,"Anomalia nel caclolo sconti: il modulo reportistica applica l'IVA al 22% anche sull'esente. Succede solo con clienti esteri. Gli ordini vengono processati ma con importi errati che vanno corretti a mano. Bug funzionale da risolvere per evitare lavoro manuale., problema su ambiente per condizioni commerciali - suggerimento",Tecnico,media,35,323
175,Query lenta: ricerca clienti senza indice (full scan),"Draft pianificazione manutenzione v2.3.1 per l'anno prossimo. Inizio raccolta requisiti preliminari per upgrade futuor. Attività di studio fattibilità a lungo termine. Nessuna scadenza imminente, solo fase di brainstorming tec... Segnalato anche assistenza bonifico - condizioni commerciali",Tecnico,bassa,53,290
176,Instabilità DB: timeout random su update anagrafiche,"Timeout sporaidci durante l'update delle anagrafiche su reportistica. Succede circa 1 volta su 10 tentativi. Riprova e funziona. Indice di instabilità del database che va indagata, anche se non blocca il lavoro.",Tecnico,media,52,211
177,Roadmap: supporto futuro sys. Gestionale con bonifico per sconto,"Blocco totale inserimento ordini nel sistema. Impossibile salvare ordine ORD-95040 per cliente Maglio, Federici e Zaccagnini Group. Modulo assistenza restituisce errore ""OutOfMemoryError"" e non completa operazione. Processo com. fermo da 15 ore. Cliente attende conferma per ordine da 495.95. Assistenza tecnica immediata richiesta per sblocco. scadenza ordine urgente - condizioni commercialie",Tecnico,alta,64,394
178,Info: tracciamento attività clienti - sconto - lieve,Queyr di ricerca clienti lenta: manca indice sulla colonna 'Partita IVA'. Ogni ricerca fa full table scan. Creare indice per migliorare tempi di risposta. Attività di utning DB standard.,Tecnico,bassa,52,186
179,Storico: dati inventario passati per pagamento - listino con sconto,"sys completamente bloccato durante generazione preventivi per cliente Rusticucci, Turci e Medici SPA. Il modulo assistenza va in crash con errore NullPointerException quando si tenta calcolo per Linea Premium. Team commerciale impossibilitato a inviare offetre. Scadenza opportunità entro entro 2 ore. Ripristino urg. necessario per non perdere vendita. - relativo a accesso",Tecnico,alta,67,374
180,Accesso negato parziale: cartella specifica inaccessibile con fattura con preventivo,"Blocco totale inserimento ordini nel sisteam. Impossibile salvrae ordine ORD2-0305 per cliente Tacsa, Catalano e Perozzo e figli. Modulo fatturazione restituisce bug ""500"" e non completa operazione. Processo commerciale fermo da 5 ore. Cliente attende conferma per ordine da 473.7. Assistenza tecnica immediata richiesta per sblocco. per suggerimento",Tecnico,media,84,350
181,Servizio vendite non risponde - blocco operativo vendite preventivo,Glitch visuale nella tabella ordini: la colonna 'Totale' a volte appare vuota. Facendo refresh della pagina i dtai compaiono. Problema intermittente che genera confusione nel reparto vendite. Non blocca gli ordini ma genera chiamate di assistenza inutili. - lieve per listino,Tecnico,media,67,275
182,Blocco inserimento ordini ORD-48011 - errore 502,Il job notturno di importazione dati ha saltato 5 record su 1000. bug di validazione sui campi data. I restanti 995 record sono ok. Analizzare i 5 scarti e capire perché il formato data era errato. - relativo a gestione,Tecnico,media,48,219
183,Bug funzionale: sconto IVA non calcolato su estero per preventivo,"Sessione di tets esplorativo su ambiente pre-produzione per nuovi assunti. Utilizzo sandbox per prendere confidenza con le funzioni base. Nessun output atteso, oslo attività iddattica. Non richiede supervisione senior.g",Tecnico,media,65,219
184,Servizio reportistica non risponde - blocco operativo vendite,Segnalazione glitch grafico minore su reportistica in risoluzione 4K. Il footer si sovrappone leggermente ma i bottoni funzionano. Difetto visivo marginale da correggere qunado capiterà occasione. Non imptata l'operatività degli utenti standard. per condizioni commerciali listino,Tecnico,bassa,61,280
185,Blocco inserimento ordini ORD-33955 - errore 502,Lentezza eccessiva nel caricamento della dashboard gestione utenti. Impiega 15 secondi per aprirsi invece dei soliti 2. Il sys è utilizzabile ma la navigazione è frustranet per gli utenti. Probabile query non ottimizzata su DB produzione. con scadenzav,Tecnico,media,48,252
186,Analisi: statistiche log vendite preventivo - negoziazione,Query di ricerca clienti lenta: manca indice sulla colonna 'Partita IVA'. Ogni ricerca fa full table scan. Creare indice per migliorare tempi di risposta. Attività di tuning DB standard. per pianificare scadenza pianificare,Tecnico,bassa,58,223
187,Pianificazione: upgrade minore v2.5.4,"Timeout sporadici durante l'update delle anagrafiche su clienti. Sucecde circa 1 volta su 10 tentativi. Riprova e funziona. Indice di instabilità del database che va indagata, anche se non blocca il lavoro. per disponibilità",Tecnico,media,37,224
188,Doc: manuale operativo magazzino per condizioni commerciali,"Il servizio magazzino non risponde da 5 ore causando down completo operativo totale. Impossibile per utenti commerciali accedere per generare preventivi. Clienti Gozzi, Tomasetti e Bignardi SPA attendono offerte con scadenza oggi. Nessun workaround disponibile, sistema mostra 502. Impatto critico su vendite e relazioni clienti. Assistenza urgente necessaria.",Tecnico,alta,59,360
189,Errore job notturno: 5 record scartati su 1000,Anomalia nel calcolo sconti: il modulo ordini applica l'IVA al 22% anhce sull'esente. Succede solo con clienti esteri. Gli ordini vengono processati ma con importi errati che vanno corretti a mano. Bug funzionale da risolvere per evitare lavoro manuale. urgente,Tecnico,alta,46,261
190,Doc: manuale operativo ordini - scadenza condizioni commerciali,Segnalazione glitch grafico minore su ordini in risoluzione 4K. Il footer si sovrappone leggermente ma i bottoni fnuzionano. Difetto visivo marginale da correggere uqando capiterà occasione. Non impatta l'operatività degli utenti standard. listino per listino,Tecnico,bassa,63,259
191,Blocco inserimento ordini ORD-40328 - errore SQL_ERROR_1045 con ordine urgente - pagamento,Disallineamento giacenze magazzino tra ERP e e-commerce. Alcuni articoli risultano disponibili online ma sono a zero in magazzino. Rischio ordini non evadibili. Forzare una sincronizzazione completa stanotte. con scadenza negoziazioneu,Tecnico,alta,90,235
192,Nota: monitoraggio passivo test,Glitch visuale nella tabella ordini: la colonna 'Totale' a volte appare vuota. Facendo refresh della pagina i dati compaiono. Problema intermittente che genera confusione nel reparto vendite. Non blocca gli ordini ma genera chiamate di assistenza inutili.m,Tecnico,media,31,256
193,"Sistema bloccato durante generazione preventivi per Sabbatini, Ritacca e Scandone e figli","Studio statistico sui log di accesso al modulo catalogo. Raccolta dati grezzi per tesi di ottimizzazione database. Nessun errore da investigare, solo data mining su storico. Processo da lanciare in background senaz priorità.c",Tecnico,alta,89,225
194,Crash critico modulo vendite durante elaborazione ordini cliente,"Richiesta patch di sicurezza per libreria obsoleta in vendite. Vulnerabilità media segnalata dal security scan. Non c'è exploit attivo, ma la policy richiede aggiornamento enrto 30 giorni. Pianificare installazione pacth in ambiente di test., problema su non funzionae",Tecnico,alta,64,268
195,Analisi: statistiche log magazzino,"Richiesta PDF aggiornato del manuale utente modulo magazznio. La versione sul server è obsoleta (manca capitolo 5). Non serve per attività correnti, ma per completezza archivio documentale. Inviare file quando disponibiel.",Tecnico,bassa,34,222
196,Glitch intermittente: tabella ordini a volte vuota,"Blocco totale inserimento ordini nel sistema. Impossibile salvare ordine ORD-62079 per cliente Farina-Gucci Group. Modulo reportistica restituisce errore ""NullPointerException"" e non completa operazione. Processo sales fermo da 7 ore. Cliente attende conferma per ordine da 438.88. Assistenza tecnica immediata richiesta per sblocco., problema su file scadenza - negoziazione - preventivo",Tecnico,media,50,388
197,Info: tracciamento attività fatturazione,"Richiesta patch di sicurezza per libreria obsoleta in fatturazione. Vulnerabilità media segnalata dal security scan. Non c'è exploit attivo, ma la policy richiede aggiornamento entro 30 giorni. Pianificare installazione patch in ambiente di test.",Tecnico,bassa,40,246
198,access negato parziale: cartella specifica inaccessibile - condizioni commerciali - bonifico,Glitch visuale nella tabella ordini: la colonna 'Totale' a votle appaer vuota. Facendo refresh della pagina i dati compaiono. issue intermittente che genera confusione nel reparto vendite. Non blocca gli ordini ma genera chiamate di assistenza inutili.e,Tecnico,media,92,253
199,Vulnerabilità security: patch richiesta entro 30gg,Anomalia nel calcolo sconti: il modulo ordini applica l'IVA al 22% anche sull'esente. Succede solo con clienti esteri. Gli ordini vengono processati ma con importi errati che vanon corretti a mano. Bug funzionale da risolvere per evitare lavoro manuale. condizioni commerciali - lieve - condizioni commercialie,Tecnico,media,50,310
200,Warning disco: server sviluppo al 85% (rischio saturazione),"Emergenza: rilevata perdita dati cliente Crespi, Mozart e Piccio e figli su ambiente sviluppo. Informazioni inserite ieri in assistenza non più disponibili. Query ricerca restituiscono errore OutOfMemoryError. Dati critici per doczione ordine ORD-97561 e reportistica. Impossibile recuperare anagrafiche e storico transazioni. Richiesto intervento immediato per ripristino. - ordine urgente suggerimentot",Tecnico,alta,59,404
