id,title,body,category,priority,title_length,body_length
1,Monitoraggio: log modulo utenti (nessun problem),"L'tuente operatore_23 segnala elntezza esasperante nel modulo fatturazione. Il salvataggio di ogni fattura impiega 30-40 secondi. Non è un blocco totale, ma dimezza la produttività dell'ufficio. Necessaria verifica performance database o rete su ambiente produzione.",Amministrazione,media,48,266
2,Mancata notifica: email approvazione persa (processo fermo) con condizioni commerciali,"Attività di background: archiviazione documenti storici cliente Chigi SPA per anno 2024. Si tratat di spostare vecchi file (fatture, contratti) nell'arcihvio morto per liberare spazio. Nessuna urgenza operativa: il task può girare nei momenti di inattività del sistema. Operazione di manutenzione ordinaria del database. crash per preventivo - memory leako",Amministrazione,bassa,86,356
3,Discrepanza contabile: bonifico 990.55 non visibile (chiusura bloccata) errore critico bug con errore critico,Malfunzionamento export Excel per report mensile. La generazione del file si interrompe a metà con errroe generico. I dati a video sono corretti. Serve il file esportato per riunione di domani mattina. Workaround richiesto. - relativo a  help! - ordine urgente,Amministrazione,alta,109,260
4,bug validazione: codice fiscale corretto rifiutato dal sys. - condizioni commerciali,"Impossibile allegare PDF al record della fattura 7067/21. Il bottone 'Upload' non risponde o dà errore di permessi. Il documento deve essere archiviato digitalmente entro fine mese. issue limitato alla funzione di upload, il resto funziona.",Amministrazione,media,84,240
5,urgentissimo: Account bloccato operatore_23 - errore ERR_CONNECTION_REFUSED su sys. reportistica - login fallito,"Duplicazione righe in visualizzazione estratto conto Tomaselli s.r.l.. Le fatture appaiono due volte nella lista a video. Il saldo finale è corretto, è solo un errore visivo che confonde gli operatori. Richiesta pulizia della ivew nel modulo reportistica. memory leak per sincronizzazione - negoziazione",Amministrazione,alta,112,303
6,Batch: consolidamento dati contabili,Proposta di manutenzione ordinaria: pulizia account intativi da lungo periodo. Lista di 7 utenti che non accedono da msei. Attività di igiene del database da schedulare come task di routine. Nessun impatto sugli utenti attivi o sul servizio di produzioen.,Amministrazione,bassa,36,255
7,Task: aggiornamento anagrafica pianificato,"L'utente admin_01 segnlaa lentezza esasperante nel modulo fatturazione. Il salvataggio di ogni fattura impiega 3-040 secondi. Non è un blocco totale, ma dimezza la produttività dell'ufficio. Necessaria verifica performance database o rete su ambiente pre-produzione. - relativo a  richiesta esterna - condizioni commerciali per listino",Amministrazione,media,42,335
8,Info: statistiche licenze Linea Accessori,"L'account giulia.verdi risulta blcocato per troppi tentativi di accesso errati. Serve sblocco manuale da parte dell'amministratore. L'utente deve completare l'inserimento ordini entro sera. Non è un issue di applicativo generalizzato, solo utenza singola.",Amministrazione,bassa,41,255
9,problem validazione: codice fiscale corretto rifiutato dal applicativo con performance per bug per crash,"Il sistema clienti non risponde alle richieste di access da parte degli utenti amministrativi. Abbiamo la produzione ferma: impossibile gestire le anagrafiche clienti e fornitori. Circa 1 utenti bloccati, nessuno riesce ad accedeer alle funzionalità di gestione documenti. Il issue si manifesta in ambiente pre-produzione con timeout continui.. Segnalato anche pagamento",Amministrazione,alta,104,370
10,Monitoraggio: log modulo utenti (nessun errore) per sconto - condizioni commerciali performance,Controllo qualità dati contabili storici per archivio. Verifica di routine sulla coerenza dei vecchi movimenti di anni passati. Non blocca nessuna attività corrente e non richiede correzioni urgenti. Si può proecdere gradualmente alla validazione dei record passati. analisi,Amministrazione,media,95,274
11,Backup: storico fatture 2002 - listino per preventivo,Controllo qualità dtai contabili storici per archivio. Verifica di routine sulla coerenza dei vecchi movimenti di anni passati. Non blocca nessuna attività corrente e non richiede correzioni urgenti. Si può procedere gradualmente alla validazione dei record passati. con sincronizzazione con errore critico per negoziazione,Amministrazione,alta,53,323
12,Discrepanza contabile: bonifico 1106.92 non visibile (chiusura bloccata),"err di stampa isolato: impossibile stampare la fattura 2740/23. Il sistema egnera il PDF correttamente a video, ma l'invio alla stampante fallisce. Altre fatture vengono stampate regolarmente. Il cleinte Giannelli, Forza e Soderini Group è in attesa del cartaceo per il ritiro merce. con errore critico",Amministrazione,alta,72,302
13,Backup: storico fatture 1975 disponibilità,Proposta di manutenzione ordinaria: pulizia account inattivi da lungo periodo. Lista di 2 utenti che non accedono da mesi. Attività di igiene del adtabase da schedulare come task di routine. Nessun impatto sugli utenti attiiv o sul servizio di produzione.n,Amministrazione,bassa,42,256
14,Info: statistiche licenze Linea Pro con condizioni commerciali,"Errore validazione codice fiscale per nuvoo clinete Pincherle, Lercari e Paganini e figli. Il sistema lo segna come errato anche se è formalmente valido. Impedisec il salvataggio della scheda cliente. Necessario bypassare il controllo o correggere l'algoritmo di validazione.r",Amministrazione,media,62,276
15,Errore stampa: impossibile stampare fatt. 5746/22 (cliente aspetta),Richiesta estraizone dati statistici su utilizzo licenze Linea Enterprise. Il report esrve esclusivamente per proiezioni di budget anno prossimo (uso interno). Nessuna scadenza operativa immediata. Elaborazione da fare offline quando le risorse lo permettono. - disponibilità - bug,Amministrazione,media,67,281
16,err. calcolo IVA: importo errato su doc estera (non validabile),"Data entry: modifica scheda informativa cliente Volterra, Fusani e Trotta SPA. Aggiornamento campi email stefano46@pace-tebaldi.it e referente operatore_23. Modifica puramente formale per completezza anagrafica. Attività amministrativa standard di basso livello, gestibile in background. memory leak per disponibilità - negoziazione",Amministrazione,bassa,63,332
17,"Log: inserimento anagrafica Mastandrea, Bocca e Trotta Group","L'account utente operatore_23 risulta bloccato dal applicativo fatturazione con problem ""503"". L'utente deve urgentmente accedere per completaer l'elaborazione delle fatture per il cliente Mastandrea, Bocca e Trotta Group. Il blocco sta impattando le operazioni di chiusura ordini e l'invio documenti contabili. Si richiede intervento tech immediato per ripristino access entro entro oggi. con errore critico - negoziazionel",Amministrazione,alta,60,424
18,Monitoraggio: log modulo utenti (nessun bug),Richiesta estrazione dati statistici su utilizzo licenze Linea Pro. Il report serve esclusivamente per proiezioni di budget anno prosismo (uso interno). Nessuna scadenza operativa immediaat. Elaborazione da fare fofline quando le risorse lo permettono. performance,Amministrazione,media,44,264
19,Batch: consolidamento dati contabili con memory leak per condizioni commerciali,"Attività di background: archiviazione documenti storici cliente Anguillara-Sforza Group per anno 2019. Si tratta di spostare vecchi file (fatture, contratti) nell'archivio morto per liberare spazio. eNssuna urgenza operativa: il task può girare nei momenti di inattività del applicativo. Operazione di manutenzione ordinaria del database.",Amministrazione,bassa,79,338
20,Timeout ricerca: impossibile filtrare fatture > 30 giorni,"Discrepanza IVA su doc estera 8131/23. Il sys calcola un importo diverso da quello atteso per il cliente Contarini Group. Differenza di pochi euro, ma impedisce la validazione contabile. Richiesta verifica configurazione aliquote nel modulo vendite. con sconto - condizioni commercialir",Amministrazione,media,57,286
21,Funzione rotta: tasto upload PDF non cliccabile,Richiesta estrazione dati statistici su utilizzo licenze Linea accessri. Il report serve esclusivamente per proiezioni di budget anno prossimo (uso interno). Nessuna scadenza operativa immediata. Elaborazione da fare offline quanod le risorse lo permettono.,Amministrazione,bassa,47,257
22,Mancata notifica: email approvazione persa (processo fermo) con timeout per sincronizzazione,"Impossibile allegare PDF al record della fat 5908/20. Il bottone 'Upload' non risponde o dà errore di permessi. Il documento deve essere archiviato digtialmente entro fine mese. Probleam limitato alla funzione di upload, il resto funziona.u",Amministrazione,media,92,240
23,Errore validazione: codice fiscale corretto rifiutato dal applicativo con sconto per memory leak,"Problema di visualizzazione anagrafica cliente Berengario Group. Alcuni campi (telefono, indirizzo) appaiono vuoti anche se popolati nel DB. Rende difficile contattare il cliente per sollecito pagamenti. Bug dell'interfaccia vendite da correggere. errore critico - preventivo per errore critico",Amministrazione,alta,96,294
24,Blocco sistema durante elaborazione doc 7508/21 per Toldo-Cerutti s.r.l.,"L'account giulia.verdi risulta bloccato per troppi tentativi di access errati. Serve sblocco manuale da parte dell'amministratore. L'utente deve completare l'inserimento ordini entro sera. Non è un pb. di sistema generalizzato, solo utenza singola.o",Amministrazione,alta,72,249
25,Archivio: documentazione storica 1975 per performance listino con ordine urgente,Proposta di manutenzione ordinaria: pulizia cacount inattivi da lungo periodo. Lista di 6 utenti che non accedono da mesi. Attività di igiene del database da schedulare ocme task di routine. Nessun impatto sugli utenti attivi o sul servizio di produzione. con memory leak,Amministrazione,alta,80,271
26,Errore validazione: codice fiscale corretto rifiutato dal sistema,"Monitoraggio passivo dei log modulo gestione utenti per statistiche utilizzo. Analisi a posteriori dei rtacciati per identificare tredn di lungo periodo. Non ci sono errori attivi o malfunzionamenti. Attività di studio per future ottimizzazioni, esnza impatto attuale. con condizioni commerciali - sincronizzazione per condizioni commerciali",Amministrazione,media,65,341
27,Batch: consolidamento dati contabili,"Attività di background: archiviazione documenti storici cliente Montanariello e figli per anno 1990. Si tratta di spostare vecchi file (fattuer, contratti) nell'archivio morto per liberare spazio. Nessuna urgenza operativa: il task può girare nei momenti di inattività del sistema. Operazione di manutenzioen ordinaria del database. con negoziazione",Amministrazione,bassa,36,349
28,Errore calcolo IVA: importo errato su doc estera (non validabile) - bug con bug,"Mancata ricezione notifica approvazione ordine ORD-94333. Il responsabile ha approvato, ma l'email non è arrivata all'amministrazione. Senza notifica la fatturazione non parte. Verificare code di posta in uscita su ambiente staging.",Amministrazione,media,79,232
29,Archivio: documentazione storica 1976,Richiesta estrazione dati statistici su utilizzo licenze Linea Accessori. Il report serve esclusivamente per proiezioni di budget anno prossimo (uso interno). Nessuna scadenza operativa immediata. Elaborazione da fare offline quando le risorse lo permettono.. Segnalato anche blocco,Amministrazione,bassa,37,282
30,Discrepanza contabile: bonifico 709.28 non visibile (chiusura bloccata),"Attività di bacgkround: archiviazione documenti storici cliente Bersani e figli per anno 1999. Si tratta di spostare vecchi file (fatture, contratti) nella'rchivio morto per liberare spazio. Nessuna urgenza operativa: il task può girare nei momenti di inattività del sys. Operazioen di manutenzione ordinaria del database.",Amministrazione,media,71,322
31,Info: statistiche licenze Linea Accessori timeout con crash con listino,Nota di aggiornamento anagrafica per cliente Rusticucci SPA nel sisteam clienti. Inseriti dati nuovo referente giulia.verdi a puro titolo informativo per il database. Nessuna azione di sincronizzazione richiesta al momento. Semplice data entry per tenere ordinato lo storico contatti.r,Amministrazione,media,71,285
32,Export fallito: report mensile si blocca a metà (serve urgente),Malfunzionamento exprot Excel per report mensile. La generazione del file si interrompe a metà con err. generico. I dati a video sono corretti. Serve il file esportato per riunione di domani mattina. Workaround richiesto. bug,Amministrazione,alta,63,225
33,Info: statistiche licenze Linea Premium - disponibilità con crash,Richiesta estrazione dati statistici su utilizzo licenze Linea Premium. Il report serve esclusivamente per proiezioni di budget anno prossimo (uso interno). Nessuna scadenza operativa immediata. Elaborazione da fare offline quando le risorse lo permettono. - relativo a versione,Amministrazione,bassa,65,278
34,err calcolo IVA: importo errato su fattura estera (non validabile),"Tmieout puntuale durante la ricerca fatture per data. La query va in errore solo se si seleziona un intervallo superiore a 30 giorni. Costringe gli operatori a fare ricerche frazionate. Molto scomodo per 'loperatività quotidiana, serve ottimizzazione. bug",Amministrazione,media,66,255
35,"Log: inserimento anagrafica Paolini, Garzoni e Stein s.r.l. timeout","Mancato allineamento incassi: il bonifico di 135.33 non risulta in contabilità. In banca è presente, ma il modulo catalogo non lo ha importato automaticamente. Necessario inserimento manuale o forzatura sync per chiudere la posizione del cliente Paolini, Garzoni e Stein s.r.l.. Il problema riguarda solo i bonifici di ieri.",Amministrazione,media,67,324
36,err. stampa: impossibile stampare fattura 7423/20 (cliente aspetta) negoziazione,Procedura di backup storico: export fatture anno 2007 per archivio siucrezza. Generazione file statico in formato PDF da conservare server-side. Operazione a bassa priorità da accodare ai job notturin o weekend. Serve solo per compliance e non per attività correnti.. Segnalato anche file,Amministrazione,media,80,288
37,Info: statistiche licenze Linea Premium,Procedura di backup storico: export fatture anno 2005 per archivio sicurezza. Generazione file statico in formato Excel da conservare server-side. Operazione a bassa priorità da accodare ai job notturni o weekend. Serve solo per compliance e non per attività correnti.o,Amministrazione,bassa,39,269
38,Backup: storico fatture 1994 con login fallito - disponibilità,Controllo qualità dati contabili storici per archivio. check di routine sulla coerenza dei vecchi movmienti di anni passati. Non blocca nessuna attività corrente e non richiede correzioni urgenti. Si può procedere gradualmente alla validazione dei record passati.i,Amministrazione,media,62,264
39,Funzione rotta: tasto upload PDF non cliccabile con disponibilità,Proposta di manutenzione ordinari:a pulizia account inattivi da lungo periodo. Lista di 5 utenti che non accedono da mesi. Attività di igiene del database da schedulare come task di routine. Nessun impatto sugli utenti attivi o sul servizio di produzione.,Amministrazione,bassa,65,255
40,Timeout ricerca: impossibile filtrare fatture > 30 giorni preventivo - listino,"Monitoraggio passivo dei log modulo gestione utenti per statistiche utilizzo. Analisi a posteriori dei tracciati per identificare trend di lungo periodo. Non ci soon errori attvii o malfunzionamenti. Attività di studio per future ottimizzazioni, senza impatto attuale.u",Amministrazione,media,78,269
41,Sistema fermo vendite non risponde - utenti bloccati su gestione anagrafiche - negoziazione performance - errore critico,err validazione codice fiscale per nuovo cliente Ricci-Lancisi SPA. Il sistema lo segan come errtao anche se è formalmente valido. Impedisce il salvataggio della scheda cliente. Necessario bypassare il controllo o correggere l'algoritmo di validazione. - memory leak - performance,Amministrazione,alta,120,280
42,Info: statistiche licenze Linea Enterprise,Malfunzionamento export Excel per report mensile. La generzaione del file si interrompe a metà con errore generico. I dati a video sono corretti. Serve il file esportato per riunione di domain mattina. Workaround richiesto.n,Amministrazione,media,42,224
43,Backup: storico fatture 1992,Procedura di backup storico: export fatture anno 1992 per archivio sicurezza. Generazione file statico in formato Excel da conservare server-side. Operazione a bassa priorità da accodare ai job notturni o weekend. Serve solo per compliance e non per attività correnti.. Segnalato anche file login fallito,Amministrazione,bassa,28,304
44,Discrepanza contabile: bonifico 1327.91 non visibile (chiusura bloccata),"L'account utente operaotre_23 risulta bloccato dal sys. reportistica con errore ""500."" L'utente deev urgentemente accedere per completare l'elaborazione delle fatture per il cliente Mengolo-Giorgetti SPA. Il blocco sta impattando le operazioni di chiusura ordini e l'invio documenti contabili. Si richiede intervento tecnico immediato per ripristino accesso entro entro 2 ore.t",Amministrazione,alta,72,377
45,Archivio: documentazione storica 2015,"error di stampa isolato: impossibile stampare la doc 4711/24. Il sisteam genera il PDF correttamente a video, ma l'invio alla stampante fallisce. Altre fatture vengono stampate regolarmente. Il cliente Bellò-Orsini e figli è in attesa del cartaceo per il ritiro merce. - memory leak con errore critico ordine urgente",Amministrazione,alta,37,316
46,Task: aggiornamento anagrafica pianificato,"Data entry: modifica scheda informativa cliente Tarchetti SPA. Agigornamento campi email albericomaderno@porzio.org e referente admin_01. Modifica puramente formale per completezza anagrafica. Attività amministrativa standard di basso livello, gestibile in background.",Amministrazione,bassa,42,268
47,Monitoraggio: log modulo utenti (nessun err) errore critico - preventivo,"Mancato allineamento incassi: il bonifico di 1389.89 non risulta in contabilità. In banca è presente, ma il modulo clienti non lo ha importato automaticamente. Necessario inserimento manuale o forzatura sync per chiudere la posizione del cliente Giulietti SPA. Il issue rgiuarda solo i bonifici di ieri. - ordine urgente",Amministrazione,alta,72,320
48,Anomalia visiva: duplicazione righe estratto conto (confusione),"L'acocunt utente operatore_23 risulta bloccato dal sistema catalogo con errore ""OutOfMemoryError"". L'utente deve urgentemente accedere per completare l'elaborazione delle fatture per il cliente Solimena, Gaito e Delle e figli. Il blocco sta impattando le operazioni di chiusura ordini e l'invio docuemnti contabili. Si richiede intervento problemi tecnici immediato per ripristino accesso entro entro 2 ore.r",Amministrazione,alta,63,408
49,"Bug interfaccia: anagrafica Ricci, Samele e Rensi Group illeggibile (campi vuoti) con condizioni commerciali con sincronizzazione",Malfunzionamento export Excel per report mensile. La generazione del file si interrompe a metà con errore generico. I dati a video sono corretti. Serve il fiel esportato per riunione di domani mattina. Workaround richiesto. gestione,Amministrazione,media,129,232
50,Manutenzione: pulizia account inattivi,Proposta di manutenzinoe ordinaria: pulizia account inattivi da lungo periodo. Lista di 4 utenti che non accedono da mesi. Attiivtà di igiene del database da schedulare come task di routine. Nessun impatto sugli utenti attivi o sul servizio di produzione.,Amministrazione,bassa,38,255
51,Errore stampa: impossibile stampare fattura 2937/20 (cliente aspetta) preventivo,Procedura di backup storico: export fatture anon 1995 per archiivo sicurezza. Generazione file statico in formato Excel da conservare server-side. Operazione a bassa priorità da accodare ai job notturni o weekend. Serve solo per compliance e non per attività correnti.,Amministrazione,media,80,268
52,Timeout ricerca: impossibile filtrare fatture > 30 giorni login fallito per listino,"Monitoraggio passivo dei log modulo gestione utenti per statistiche utilizzo. Analisi a posteriori dei tracciati per identificare trend di lungo periodo. Non ci sono errori attivi o malfunzionamenti. Attività di studio per future ottimizzzaioni, senza impatto attuale.e",Amministrazione,media,83,269
53,Archivio: documentazione storica 1983 condizioni commerciali,Proposta di manutenzione ordinaria: pulizia account inattivi da lungo periodo. Lista di 8 utenti che non accedono da mesi. Attività di igiene del database da schedulare come task di routine. Nessun impatto sugli utenti attivi o sul servizio di produzione.,Amministrazione,bassa,60,255
54,Task: aggiornamento anagrafica pianificato ordine urgente con sincronizzazione con timeout,"Data entry: mdoifica scheda informativa cliente Monaco Group. Aggiornamento campi email laurasagese@taccola.org e referente mario.rossi. Modifica puramente formale per completezza anagrafica. Attività amministrativa standard di basso livello, gestibile in background. con disponibilitàf",Amministrazione,alta,90,286
55,Archivio: documentazione storica 2019,URgenet completare la registrazione del pagamento per l'ordine ORD-13566 del cliente Innocenti-Nugnes Grou.p Il applicativo mostra bug 503 durante l'inserimento dell'importo 335.53 in assistenza. Il bonifico risulta effettuato ma il gestionale non salva i dati. Blocco critico che impedisce conferma ordine e spedizione merce. Richiesto supporto tecnico immediato. per login fallito,Amministrazione,alta,37,382
56,Anomalia visiva: duplicazione righe estratto conto (confusione),"Impossibile allegare PDF al record della doc 5466/23. Il bottone 'Upload' non risponde o dà errore di permessi. Il documento deve essere archiviato digitalmente entro fine mese. Problema limitato alla funzione di upload, il resto funziona., problema su aggiornamento timeout condizioni commerciali performance",Amministrazione,media,63,309
57,Mancata notifica: email approvazione persa (processo fermo),"Monitoraggio passivo dei log modulo gestione utenti per statistiche utilizzo. Analisi a posteriori dei tracciati per identificare ternd di lungo periodo. Non ci soon errori attivi o malfunzionamenti. Attività di studio per future ottimizzazioni, senza ipmatto attuale.",Amministrazione,bassa,59,268
58,Archivio: documentazione storica 2024 login fallito condizioni commerciali per ordine urgente,"Discrepanza IVA su fattura estera 9147/20. Il system calcola un importo diverso da quello atteso per il cliente Flaiano, Casaleggio e Pirandello SPA. Differenza di pochi euro, ma impedisce la validazione contabile. Richiesta check configurazione aliquote nel modulo magazzino. - bug - sincronizzazione",Amministrazione,alta,93,301
59,Batch: consolidamento dati contabili,oNta di update anagrafica per cliente Boccherini-Desio SPA nel sys. assistenza. Insreiti dati nuovo referente admin_01 a puro titolo informativo per il daatbase. Nessuna azione di sincronizzazione richiesta al momento. Semplice data etnry per tenere ordinato lo storico contatti.. Segnalato anche errore,Amministrazione,media,36,303
60,Monitoraggio: log modulo utenti (nessun problem),Nota di aggiornamento anagrafica per cliente Chechi-Regge s.r.l. nel sistema assistenza. Inseriti dati nuovo referente operatore_23 a puro titolo informativo per il database. Nessuna azione di sincronizzazione richiesta al momento. Semplice data netry per tenere ordinato lo storico contatti. - disponibilità memory leak,Amministrazione,bassa,48,320
61,Account bloccato: utente mario.rossi fermo (troppi tentativi) con condizioni commerciali con condizioni commerciali,"Impossibile allegare PDF al record della fatt. 9802/24. Il bottone 'Upload' non risponde o dà problem di permessi. Il documento deve essere archiviato digitalmente entro fine mese. Problema limitato alla funzoine di upload, il resto funziona.",Amministrazione,alta,115,242
62,Bug interfaccia: anagrafica Manunta-Ajello s.r.l. illeggibile (campi vuoti) - errore critico per disponibilità,"L'account operatore_23 risulta bloccato per troppi tentativi di acc. errati. Serve bslocco manuale da parte dell'amministratore. L'utente deve completaer l'inserimento oridni entro sera. Non è un issue di sistema generalizzato, solo utenza singola. - memory leak",Amministrazione,alta,110,262
63,Archivio: documentazione storica 1990,"Mancata ricezione notifica approvazione ordine ORD-79533. Il responsabile ha approvato, ma l'email non è arrivata all'amministrazione. Senza notifica la doczione non parte. checkre code di posta in uscita su ambiente porduzione. bug bug",Amministrazione,media,37,236
64,Info: statistiche licenze Linea Accessori,"Data entr:y modifica scheda informativa cliente Siffredi, Grassi e Nadi e figli. Aggionramento campi email annibale35@endrizzi.com e referente operatore_23. Modifica puramente formale per completezza anagrafica. Attività amministartiva standard di basso livello, getsibile in background.. Segnalato anche accesso",Amministrazione,bassa,41,312
65,Anomalia visiva: duplicazione righe estratto conto (confusione),"Attività di background: archiviazione documenti storici cliente Gotti-Tartaglia e figli per anno 2025. Si tratta di spostare vecchi file (fatture, conrtatti) nell'archivio morto per liberare spazio. Nessuna urgenza operativa: il task può girare nei momenti di inattività del system. Operazione di manutenzione ordinaria del database. login fallito per crash",Amministrazione,media,63,357
