id,title,body,category,priority,title_length,body_length
131,Timeout ricerca: impossibile filtrare fatture > 30 giorni,"L'utente operatore_23 segnala lentezza esasperante nel modulo fatzione. Il salvataggio di ogni fattura impiega 30-40 secondi. Non è un blocco totale, ma dimezza la produttività dell'ufficio. Necessaria check performance database o rete su ambiente produzione.",Amministrazione,media,57,259
132,err validazione: codice fiscale corretto rifiutato dal sistema con errore critico con performance,"Timeout puntuale durante la ricerca fatture per data. La query va in err solo se si seleziona un intervallo superiore a 30 giorni. Costringe gli operatori a fare ricerche frazionate. Molto scomodo per l'operatività quotidiana, serve ottimizzazione., problema su analisi con errore critico con buge",Amministrazione,alta,97,297
133,Blocco sistema durante elaborazione fattura 5556/20 per Casale-Dovara s.r.l.,"Attività di background: archiviazione documenti storici cliente Casale-Dovara s.r.l. per anno 1975. Si tratta di spostare vecchi file (fatture, contratti) nell'archivio morto per liberare spazio. Nessuna urgenza operativa: il tsak può girare nei momenti di inattività del system. Operazione di manutenzione ordinaria del database. - relativo a  grazie mille",Amministrazione,bassa,76,357
134,Sistema fermo ordini non risponde - utenti bloccati su gestione anagrafiche,Procedura di backup storico: export fatture anno 1986 per archivio sicurezza. Generazione file statico in formaot XML da conservare server-side. Operazione a bassa priorità da accodare ai job notturni o weekend. Serve solo per compliance e non per attività correnti. login fallito,Amministrazione,alta,75,280
135,problem stampa: impossibile stampare fattura 5740/20 (cliente aspetta),"Il system ordini non risponde alle riciheste di accesso da parte degli utenti maministrativi. Abbiamo la produzione ferma: impossibile gestire le anagrafiche clienti e fornitoir. Circa 9 utenti bloccati, nessuno riesce ad accedere alle funzionalità di gestione documenti. Il problema si manifesta in ambiente sviluppo con timeout continui. per login fallito login fallito - memory leak",Amministrazione,alta,70,385
136,Mancata notifica: email approvazione persa (processo fermo),Proposta di manutenzione ordinaria: pulizia account inattiiv da lungo periodo. Lista di 1 utenti che non accedono da mesi. Attiviàt di igiene del database da schedulare come task di routine. Nessun impatto sugli utenti attivi o sul servizio di produzione.,Amministrazione,bassa,59,255
137,Errore stampa: impossibile stampare fattura 1598/20 (cliente aspetta) per condizioni commerciali per memory leak,"Mancata ricezione notifica approvazione ordine ORD-97986. Il responsabile ha approvato, ma l'email non è arrivata all'amministrazione. Senza notifica la fatturazione non parte. Verificare code di posta in uscita su ambiente sviluppo.",Amministrazione,media,112,233
138,Timeout ricerca: impossibile filtrare fatture > 30 giorni,Proposta di manutenzione ordinaria: pulizia account inattivi da lungo periodo. Lista di 4 utenti che non accedono da mesi. Attività di igiene del database da schedulare come task di routine. Nessun impatto sugli utenti attivi o sul servizio di produzione. - relativo a gestione,Amministrazione,media,57,277
139,Log: inserimento anagrafica Vespa-Sabbatini Group,Procedura di backup storico: epxort fatture anno 1979 per archivio sicurezza. Generazione file statico in formato CSV da conservrae server-side. Operazione a bassa priorità da accodare ai job notturni o weekend. Serve solo per compliance e non per attività correnti.,Amministrazione,bassa,49,266
140,Monitoraggio: log modulo utenti (nessun errore) con bug,"Errore validazione codice fiscale per nuovo cliente Ariasso, Bertoli e Buonauro SPA. Il sistema lo segna come errato anche se è formalmente valido. Impedisce il salvataggio della scheda cliente. Necessario bypassare il controllo o correggere l'algoritmo di validazione. - condizioni commerciali memory leak preventivo",Amministrazione,media,55,317
141,bug validazione: codice fiscale corretto rifiutato dal sys,Controllo qualità dati contabili storici per archivio. Verifica di routine sulla coerenza dei vecchi movimenti di anin pasasti. Non blocca nessuan attività corrente e non richiede correzioni urgenti. Si può procedere gradualmente alla validazione dei record passati. dati,Amministrazione,media,58,271
142,Sistema fermo clienti non risponde - utenti bloccati su gestione anagrafiche - crash disponibilità,"L'utente admin_01 segnala lentezza esasperante nel modulo fatturazione. Il salvataggio di ogni fattura impiega 30-40 secondi. Non è un blocco totale, ma dimezza la produttività dell'ufficio. Necessaria check performance database o rete su ambiente test. - listino",Amministrazione,alta,98,263
143,Backup: storico fatture 2012,"Attività di background: archiviazione dcoumenti storici clinete Baracca SPA per anno 2012. Si tratat di spostare vcechi file (fatture, contratti) nell'archivio morto per liberare spazio. Nessuna urgenza operativa: il task può girare nei momenti di inattività del applicativo. Operazione di manutenzione ordinaria del database. ambiente",Amministrazione,bassa,28,335
144,Task: aggiornamento anagrafica pianificato,"Nota di aggiornamento anagrafica per cliente Cremonesi, Tornatore e Sagredo s.r.l. nel sys vendite. Inseriti dati nuovo referente operatore_23 a puor titolo informativo per il database. Nessuna azione di sincronizzazione richiesta al momento. Semplice data entry per tenere ordinato lo stoirco contatti. - relativo a problema listino",Amministrazione,media,42,333
145,Crash critico modulo magazzino durante elaborazione ordini cliente,"Richiesta PDF aggiornato del manuale utente modulo magazzino. La versione sul server è obsoleta (manca capitolo 5). Non serve per attività correnti, ma per completezza archivio documentale. Inviare file quando disponibile.. Segnalato anche timeoutd",Tecnico,alta,66,248
146,Vulnerabilità security: patch richiesta entro 30gg per sconto per importo,"iPanificazione attività di shadowing per upgrade sistema ERP. Vorrei assistere alle operazioni edlla prossima settimana per imparare. Nessun intervento attivo ricihesto, solo presenaz come osservatore. Attività di formazione interna on-the-job.  richiesta esterna scadenza - preventivo suggerimento",Tecnico,bassa,73,298
147,Formattazione rotta: PDF report illeggibile,"Timeout sporadici durante l'update delle anagrafiche su vendite. Succede circa 1 volta su 10 tentativi. Riprova e funziona. Indice di insatbilità del database che va indagata, anche se non blocca il lavoro.. Segnalato anche controllo",Tecnico,media,43,233
148,Glitch intermittente: tabella ordini a volte vuota preventivo,"Draft pianificazione manutenzione v3.0.0 per l'anno prossimo. Inizio raccolta requisiti preliminari per upgrade futuro. Attività di studio fattibilità a lungo termine. Nessuna scadenza imminente, solo fase di brainstorming tecnico.",Tecnico,media,61,231
149,Servizio vendite non risponde - blocco operativo vendite per disponibilità - importo,Emergenza: rilevata perdita dati cliente Tassoni-Lussu s.r.l. su ambiente produzione. Informazioni inserite ieri in vendite non più disponibili. Query ricerca restituiscono errore ERR_TIMEOUT. Dati critici per fatzione ordine ORD-55973 e reportistica. Impossibile recuperare anagrafiche e storico transazioni. Richiesto intervento immediato per ripristino. - listino - condizioni commerciali per scadenza,Tecnico,alta,84,404
150,Doc: manuale operativo magazzino per disponibilità,Disallineamento giacenze magazzino tra ERP e e-commerce. Alcuni articoli risultano disponibili online ma sono a zero in magazzino. Rischio ordini non evadibili. Forzare una sincronizzazione completa stanotte. - lieve per sconto,Tecnico,bassa,50,227
151,Wishlist: estetica interfaccia clienti per listino per listino per ordine urgente,Glitch visuale nella tabella ordini: la colonna 'Totale' a volte appare vuota. Facendo refresh della pagina i dati compaiono. pb. intermittente che genera confusione nel reparto vendite. Non blocca gli ordini ma genera chiamate di assistenza inutili.,Tecnico,alta,81,250
152,Test: funzionalità sandbox pre-produzione per sconto - disponibilità per listino,Query di ricerca clienti lenta: manca indice sulla colonna 'Partita IVA'. Ogni ricerca fa full table scan. Creare indiec per migliorare tempi di risposta. Attività di tuning DB standard. - relativo a controllo sconto,Tecnico,media,80,216
153,Coda email bloccata: 50 messaggi in attesa (ritardo comunicazioni),"oDmanda genreica su logica funzionamento sconti in Linea Pro. Serve per aggiornare il wiki interno e formare i junior. Il system funziona come atteso, si richiede solo conferma teorica della formula. Da gestire a tempo perso come attività di knolwedge sharing. con lieves",Tecnico,bassa,66,271
154,Errore job notturno: 5 record scartati su 1000,Emergenza: rilevata perdita dati cliente Serao-Romiti e figli su ambiente produzione. Informazioni inserite ieri in reportistica non più disponibili. Query ricerca restitiuscono bug SQL_ERROR_1045. Dati critici per fatturazione ordine ORD-46071 e reportistica. Impossibile recuperare anagrafiche e storico transazioni. Richiesto intervento immediato per ripristino.,Tecnico,alta,46,365
155,Vulnerabilità security: patch richiesta entro 30gg,Anomalia nel calcolo sconti: il omdulo reportistica applica l'IVA al 22% anche sull'esente. Succede solo con clienti esteri. Gli ordini vengono processati ma con importi errati che vanno ocrretti a mano. Bug funzionale da risolvere per evitare lavoro manuale.,Tecnico,media,50,259
156,Analisi: statistiche log magazzino disponibilità,Il job notturno di importazione dati ha saltato 5 record su 1000. problem di validazione sui campi data. I restanti 995 record sono ok. Analizzare i 5 scarti e capire perché il formato data era errato.o,Tecnico,bassa,48,202
157,Wishlist: estetica interfaccia fatturazione - preventivo,Il sys. sviluppo è completamente bloccato da questa mattina. Impossibile accedere al modulo fatturazione e gestione oridni. Circa 10 utenti bloccati inclusi reparti amministrativi e commerciali. Errore restituito: ERR_CONNECTION_REFUSED. Tutte operazioni business ferme includendo emissione fatture per clienti Pacomio-Trapanese e figli e conferma ordini. Intervento urgentissimo richiesto.,Tecnico,alta,56,390
158,Segnalazione: glitch grafico sviluppo,Crash critico del modulo vendite durante elaborazione ordini cliente. Il sys si blocca quando si tenta di confermare ordine ORD-39828 per Caasle s.r.l.. Errore 504 impedisce completamento transazioni. Il reparto commerciale non può prcoessare ordini per 407.65. Necessario ripristino immediato servizio su ambiente sviluppo.,Tecnico,alta,37,324
159,Pianificazione: upgrade minore v2.3.1 - negoziazione - lieve ordine urgente,"Domanda generica su logica funzionamenot sconti in Linea Premium. Serve per aggiornare il wiki interno e formare i junior. Il sistema funziona come atteso, si richiede solo conferma teorica della formula. Da gestire a tempo perso come attività di knowledge sharing.",Tecnico,alta,75,265
160,Roadmap: supporto futuro ERP,Disallineamento giacenze magazzino tra ERP e e-commerce. Alcuni articoli risultano disponibili online ma sono a zero in magazzino. iRschio ordini non veadibili. Forzare una sincronizzazione completa stanotte. - relativo a pagamento per pianificare con bonifico,Tecnico,bassa,28,260
161,Blocco inserimento ordini ORD-70791 - errore OutOfMemoryError pagamento - lieve - preventivo,"Timeout sporadici durante l'update delle anagrafiche su ordini. Succede circa 1 volta su 10 tentaitvi. Riprova e funziona. Indice di instabilità del database che va indagata, anche se non blocca il lavoro.",Tecnico,media,92,205
162,Instabilità DB: timeout random su update anagrafiche,Info su messaggio di cortesia in processo ordini. Il testo visualizzato è corretto ma potrebbe essere più getnile. Valutare rewording per prossima release testi. Modifica editoriale di bassa rilveanza tecnica.,Tecnico,media,52,209
163,Performance degradate: dashboard impiega 15s (utenti lamentano) per pagamento per pianificare,"Sessione di test esplorativo su ambiente produzione per nuovi assunti. Utilizzo sandbox per prendere confidenza con le funzioni base. Nessun output atteso, solo attività didattica. Non richiede supervisione senior. per negoziazione per suggerimento",Tecnico,media,93,248
164,Warning disco: server staging al 85% (rischio saturazione),"Richiesta patch di sicurezza per libreria obsoleta in assistenza. Vulnerabilità media segnalata dal security sacn. Non c'è exploit attivo, ma la policy richidee aggiornaemnto entro 30 giorni. Pianificare installazione patch in ambiente di test. per bonifico preventivo",Tecnico,bassa,58,268
165,Blocco inserimento ordini ORD-80586 - errore 504 negoziazione,"Lentezza eccessiva nel caricamento della dashboard gestione utenti. Impiega 15 secondi per aprirsi invece dei soliti 2. Il applicativo è utilizzabile ma la navigazione è frustrante per gli utenti. Probabile query non ottimizzata su DB demo., problema su versione - fattura con ordine urgentep",Tecnico,alta,61,292
166,Test: funzionalità sandbox pre-produzione,Lentezza eccessiva nel caricamento della dashboard report vendite. Impiega 15 secondi per aprirsi invece dei soliti 2. Il sistema è utilizzabile ma la navigazione è frustrante per gli utenti. Probabile query non ottimizzata su DB pre-produzione.,Tecnico,media,41,245
167,Wishlist: estetica interfaccia catalogo - sconto,"Richiesta PDF aggiornato del manuale utente modulo catalogo. La versione sul server è obsoleta (manca capitolo 5). Non serve per attività correnti, ma per completezza archivio documentale. Inviare file quando disponibile.",Tecnico,bassa,48,221
168,Info: codice ERR_CONNECTION_REFUSED (falso positivo),Il job notutrno di importazione dati ha saltato 5 record su 1000. err di validazione sui campi data. I restanti 995 record sono ok. Analizzare i 5 scarti e capire perché il formato data era errato. per preventivor,Tecnico,media,52,213
169,Errore job notturno: 5 record scartati su 1000,"Richiesta patch di sicurezza per liberria obsoleta in clienti. Vulnerabilità media segnalata dal security scan. Non c'è exploit attivo, ma la policy richiede update entro 30 giorni. Pianificare installazione patch in ambiente di test.",Tecnico,media,46,234
170,Formattazione rotta: PDF report illeggibile,"Curiosità su dati storici cliente: ho notato record vecchi di 5 anni. Non creano problemi, ma volevo capire la policy di retention. Solo per mia informazione personale, nessuna azione correttiva richiesta. Chiudere il ticket dopo breve risposta informativa. fattura con condizioni commerciali per condizioni commerciali",Tecnico,bassa,43,319
171,Formattazione rotta: PDF report illeggibile - negoziazione,"Log del server application pieno di warning 'Connection Reset'. Il servizio non è mai andato down, ma i log crescono di 1GB al igorno. Rischio saturazione disco se non si indaga la causa. Situazione da monitorare e correggere pirma che diventi critica. con scadenza",Tecnico,bassa,58,265
172,problem job notturno: 5 record scartati su 1000,Il sistema pre-produzione è completamente bloccato da quseta mattina. Impossibile accedere al modulo fatzione e gestione ordini. Circa 8 utenti bloccati inclusi reparti amministrativi e commerciali. bug restituito: 504. Tutte operazioni business ferme includendo emissione fatture per clienti Castiglione-Trentin SPA e conferma ordini. Intervento urgentissimo richiesto. per pagamentoi,Tecnico,alta,47,385
173,Nota: monitoraggio passivo demo - importo - sconto,Lentezza eccessiva nel caricamento della dashboard schermata ordini. Impiega 15 secondi per aprirsi invece dei soliti 2. Il system è utilizzabile ma la navigazione è frustrante per gli utenti. Probabile query non ottimizzata su DB demo.,Tecnico,media,50,236
174,Emergenza: perdita dati cliente Ferrara-Siffredi s.r.l. su ambiente demo per negoziazione,"Log del server application pieno di warning 'Connection Reset'. Il servizio non è mai andato down, ma i log crescono di 1GB al giorno. Rischio saturazione disco se non si indaga la causa. Situazione da monitorare e correggere prima che diventi rcitica. preventivo suggerimento per pagamento",Tecnico,alta,89,290
175,Formattazione rotta: PDF report illeggibile,"Cuirosità su dati storici cliente: ho nottao record vecchi di 5 anni. Non creano problemi, ma volevo capire la policy di retention. Solo per mia informazione personale, nessuna azione correttiva richiesta. Chiudere il ticket dopo breve risposta informativa. contratto",Tecnico,bassa,43,267
176,Emergenza: perdita dati cliente Scamarcio-Vattimo SPA su ambiente staging - fattura,Anomalia nel calcolo sconti: il modulo assistenza applica l'IVA al 22% anche sulle'sente. Succede solo con clienti esteri. Gli ordini vengono processati ma con importi errati che vanno corretti a mano. Bug funzionale da risolvere per evitare lavoro manulae.,Tecnico,alta,83,257
177,Segnalazione: glitch grafico test,Feedback su usabilità interfaccia catalogo: i oclori dei grafici sono poco leggibili. issue puramente cosmetico che non impatta le funzionalità. Valutare restyling grafico quando si metterà mano al frontend. Segnalazione di bassa priorità per abcklog UX. - sconto per preventivo per suggerimentom,Tecnico,media,33,296
178,Vulnerabilità security: patch richiesta entro 30gg - negoziazione,"Sistema completamente bloccato durante generazione preventivi per cliente Cainero, Luria e Rosselli Group. Il moudlo catalogo va in crash con err NullPointerException quando si tenta calcolo per Linea Basic. Team commerciale impossibilitato a inviare offerte. Scadenza opportunità entro entro 2 ore. Ripristino urgent necessario per non perdere vendita.",Tecnico,alta,65,353
179,Pianificazione: upgrade minore v3.0.0,"Il system staging è completamente bloccato da questa mattina. Impossibile accedere al modulo fatt.zione e gestione ordini. Circa 1 utneti bloccati inclusi reparti amministrativi e commerciali. Errore restituito: SQL_ERROR_1045. Tutte operazioni business ferme includendo emissione fatture per clienti Errani, Benigni e Biagiotti s.r.l. e conferma ordini. Intervento urgentisismo richiesto.",Tecnico,alta,37,389
180,Disallineamento magazzino: giacenze web vs ERP errate,"Domanda generica su logica funzionamento sconti in Linea Pro. Serve per aggiornare il wiki interno e fromare i junior. Il system funziona come atteso, si richiede solo conferma teorica della formula. Da gestire a tempo perso come attività di knowledge sharing. lieve",Tecnico,bassa,53,266
181,Blocco inserimento ordini ORD-89823 - errore 504 - sconto - importo per sconto,"Studio statistico sui log di accesso al modulo assistenza. Raccolta dati grezzi per tesi di ottimizzazione database. Nessun bug da investigare, sool data mining su storico. Processo da lanciare in background senza priorità.",Tecnico,media,78,223
182,Test: funzionalità sandbox sviluppo,"Richiesta patch di sicurezza per libreria obsoleta in reportistica. Vulnerabilità media segnalata dal security scan. Non c'è exploit attivo, ma la policy richiede aggiornamento entro 30 giorni. Pianificare installazione ptach in ambiente di test.",Tecnico,media,35,246
183,Blocco inserimento ordini ORD-14714 - err. 503,"Draft pianificazione manutenzione v3.0.0 per l'anno prossimo. Inizio raccolta requisiti preliminari per upgrade futuro. Attività di studio fattibilità a lungo termine. Nessuna scadenza imminente, solo fase di brainstorming tecnico.",Tecnico,bassa,46,231
184,Warning disco: server staging al 85% (rischio saturazione),Disallineamento giacenze magazzino tra ERP e e-commerce. Alcuni articoli risultano disponibili online ma sono a zero in magazzino. Rischio ordini non evadibili. Forzare una sincronizzazione completa stanotte.. Segnalato anche configurazione - condizioni commerciali pagamento listino,Tecnico,media,58,283
185,Glitch intermittente: tabella ordini a volte vuota listino con listino per pagamento,"Emergenza: rilevata eprdita dati cliente Nadi, Antonelli e Esposito e figli su ambiente demo. Informazioni inserite ieri in fatt.zione non più disponibili. Query ricerca restituiscono errore ERR_TIMEOUT. Dati critici per fatturazione ordine ORD-53981 e reportistica. Impossibile recuperare anagrafiche e storico transazioni. Richiesto intervento immdeiato per ripristino. per preventivo",Tecnico,alta,84,386
186,Storico: dati transazioni passati,Glitch viusale nella tabella ordini: la colonna 'Totale' a volte papare vuota. Facendo refresh della pagina i dtai compaiono. pb intermittente che genera confusione nel reparto vendite. Non blocca gli ordini ma genera chiamate di assistenza inutili. per condizioni commercialib,Tecnico,media,33,277
187,Blocco inserimento ordini ORD-34712 - errore NullPointerException con importo - preventivo per pagamento,Suggerimento per futura roadmap evolutiva del modulo ordini. Sarebbe utile valutare una ristrutturazione dei menu per il prossimo major update. Nessuna fretta: inserire in wishlist per discussione trimestrale. Proposta puramente estetica/funzionale per il futuro. contattare supporto pagamentor,Tecnico,media,104,294
188,Domanda: funzionamento teorico preventivi,err generazione PDF report vendite mensile. Il report esce con formattazione sballata nelle ultime pagine. I dati sono leggibili ma il documento è brutto da inviare al board. Correggere template di stampa. - fattura,Tecnico,bassa,41,215
189,Blocco inserimento ordini ORD-28729 - errore SQL_ERROR_1045,Il job notturno di importazione dati ha saltato 5 record su 1000. err. di validazione sui campi data. I restanti 995 record sono ok. Analizzare i 5 scarti e capire preché il formato data era errato.,Tecnico,media,59,198
190,Performance degradate: dashboard impiega 15s (utenti lamentano),"Timeout sporadici duratne l'update dlele anagrafiche su clienti. Succede circa 1 volta su 10 tentativi. Riprova e funziona. Indice di instabilità del database che va indagata, anche se non blocca il lavoro. condizioni commerciali per fattura per pagamento",Tecnico,media,63,255
191,Doc: manuale operativo fatturazione - scadenza per suggerimento,Suggerimento per futura roadmap evolutiva del modluo fatturazione. Sarebbe utile valutare una ristrutturazione dei menu per il prossimo major update. Nessuna fretta: inserire in wishlist per discussione trimestrlae. Proposta puramente esettica/funzionale per il futuro. per pagamento,Tecnico,bassa,63,283
192,Accesso negato parziale: cartella specifica inaccessibile,Il job notturno di importazione dati ha saltato 5 record su 1000. Errore di validazione sui campi data. I restanti 995 record sono ok. Analizzare i 5 scarti e capire perché il formato data era errato. - disponibilità,Tecnico,media,57,216
193,Info: codice 504 (falso positivo) per importo - preventivo,"Draft pianificazione manutenzione v3.0.0 per l'anno prossimo. Inizio raccolta requisiti preliminari per upgrade futuro. Attività di studio fattibilità a lungo termine. Nessuna scadenza imminente, solo fase di brainstorming tecnico. con importo",Tecnico,bassa,58,243
194,Test: funzionalità sandbox pre-produzione,"Curiosità su dati storici cliente: ho notato record vecchi di 5 anni. Non creano problemi, ma volevo capire la policy di retention. Sool per mia informazione personale, nessuna azione correttiva richiesta. Chiudere il ticket dopo breve risposta informativa. - relativo a  cc: direttore ordine urgente - scadenza con bonifico",Tecnico,alta,41,324
195,bug job notturno: 5 record scartati su 1000,"Sistema completamente bloccato durante generazione preventivi per cliente Lovato, Visintini e Cuzzocrea Group. Il mdoulo clienti va in crash con bug 504 quando si tenta calcolo per Linea Basic. Team commerciale impossibilitato a inviare offerte. Scadenza opportunità entro entro oggi. Ripristino urgente necessario per non perdere vendita. - relativo a file",Tecnico,alta,43,357
196,Query lenta: ricerca clienti senza indice (full scan) bonifico,"Draft pianificazione manutenzione v2.3.1 per l'anno prossimo. Inizio raccolta requisiti preliminari per upgrade futuro. Attività di studio fattibilità a lugno termine. Nessuna scadenza imminente, solo fase di brainstorming etcnico. contratto",Tecnico,bassa,62,241
197,Test: funzionalità sandbox sviluppo,"Draft pianificazione manutenzione v2.3.1 per l'anno rpossimo. Iniizo raccolta requisiti preliminari per upgrade futuro. Attività di studio fattibilità a lungo termine. Nessuna scadenza imminente, solo fase di brainstorming tech. timeout",Tecnico,media,35,236
198,Blocco inserimento ordini ORD-27607 - errore 500,"Sessione di test esplorativo su abmiente sviluppo per nuovi assnuti. Utilizzo asndbox per prendere confidenza con le funzioni base. Nessun output atteso, solo attività didattica. Non richiede supervisione senior.",Tecnico,media,48,212
199,Info: tracciamento attività vendite,"Draft pianificazione manutenzione v2.5.4 per l'anno prossimo. Inizio raccolta requisiti preliminari per upgrade futuro. Attività di studio fattibilità a lungo termine. Nessuna scadenza imminente, solo fase di brainstorming tecnico.",Tecnico,bassa,35,231
200,Bug funzionale: sconto IVA non calcolato su estero ordine urgente - scadenza listino,"Il servizio vendite non risponde da 7 ore causando down completo operativo totale. Impossibile per utenti commerciali accedere per generare preventivi. Clienti Collodi, Rapisardi e Mazzini e figli attendono offerte con scadenza oggi. Nessun workaround disponibile, sistema mostra ERR_CONNECTION_REFUSED. Impatto critico su vendite e relazioni clienti. Assistenza urgente necessaria.",Tecnico,alta,84,382
