id,title,body,category,priority,title_length,body_length
132,Task: aggiornamento anagrafica pianificato,"Mancato allineamento incassi: il bonifico di 529.63 non risutla in contabilità. In banca è presente, ma il modulo magazzino non lo ha importato automaticamente. Necessario inserimento manuale o forzatura sync per chiudere la posizione del cliente Bacosi e figli. Il pb riguarda solo i bonifici di ieri.. Segnalato anche modulo",Amministrazione,media,42,326
133,Task: aggiornamento anagrafica pianificato,Procedura di backup storico: export fatture anno 1992 per archivio sicurezza. Generazione file statico in formato PDF da conservare server-side. Operazione a bassa priorità da accodare ai job notturni o weeeknd. Serve sloo per compliance e non per attività correnti.,Amministrazione,bassa,42,266
134,Log: inserimento anagrafica Bazzi-Oscuro e figli - errore critico per condizioni commerciali,"Duplicazione righe in visualizzazione estratto conto Bazzi-Oscuro e figli. Le fatture appaiono due volte nella lista a video. Il saldo finale è corretto, è solo un error visivo che conofnde gli operatori. Richiesta pulizia della view nel modulo magazzino.",Amministrazione,alta,92,255
135,Export fallito: report mensile si blocca a metà (serve urgente),"Mancata ricezione notifica approvazione ordine ORD-68602. Il responsabile ha approvato, ma l'email non è arrivata all'amministrazione. Senza notifica la fatturazione non parte. Verfiicare code di psota in uscita su ambiente sviluppo.",Amministrazione,alta,63,233
136,Manutenzione: pulizia account inattivi,"Monitoraggio passivo dei log modulo gestione utenti per statsitiche utliizzo. Analisi a posteriori dei tracciati per identificare trend di lungo periodo. Non ci sono errori attivi o malfunzionamenti. Attività di studio per future ottimizzazioni, senza impatto attuale. con sincronizzazione preventivo per memory leakt",Amministrazione,bassa,38,317
137,Funzione rotta: tasto upload PDF non cliccabile,"Mancato allineamento incassi: il bonifico di 471.61 non risulta in contabilità. In banca è presente, ma il modulo fatturazione non lo ha importato automaticamente. Necessario inserimento manuale o forzatura snyc per chiudere la posizione del cliente Morabito-Ruggeri e figli. Il problema riguarda solo i bonifici di ieri. per sincronizzazione con condizioni commerciali",Amministrazione,media,47,369
138,Backup: storico fatture 1995 crash,"issue di visualizzazione anagrafica cliente Garrone-Peranda SPA. Alcuni campi (telefono, indirizzo) appaiono vuoti acnhe se popolati nel DB. Rende difficile contattare il cliente per sollecito pagamenti. Bug dell'interfaccia assistenza da correggere. disponibilità - preventivoc",Amministrazione,media,34,278
139,URGENTE: Account bloccato giulia.verdi - err ERR_CONNECTION_REFUSED su sys. vendite,"L'account giulia.verdi risulta bloccato per troppi tentativi di access errati. Serve sblocco amnuale da parte dell'amministratore. L'utente deve completare l'inserimento ordini entor sera. Non è un issue di system generalizzato, solo utenza singola. con disponibilità",Amministrazione,alta,83,267
140,Mancata notifica: email approvazione persa (processo fermo),Richietsa estrazione dati statistici su utilizzo licenze Lniea Basic. Il report serev esclusivamente per proiezioni di budget anno prossimo (uso interno). Nessuna scadenza operativa immediata. Elaborazione da fare offline quando le risorse lo permettono. disponibilità per negoziazione,Amministrazione,bassa,59,285
141,Rallentamento fatturazione: salvataggio impiega 40 secondi (troppo),Malfunzionamento export xEcel per report mensile. La generazione del file si interrompe a metà con errore generico. I dati a video sono corretti. Serve il file esportato per riunione di domani mattina. Workaround richiesto.v,Amministrazione,media,67,224
142,Monitoraggio: log modulo utenti (nessun errore),Proposta di manutenzione ordinaria: pulizia account inattivi da lungo periodo. Lista di 2 utenti che non accedono da mes.i Attività di igiene del database da schedulare come task di routine. Nessun impatto sugli utenti attivi o sul servizio di produzione. - memory leak con performancee,Amministrazione,media,47,286
143,Log: inserimento anagrafica Trapani-Granatelli SPA,Richiesta estrazione adti statistici su utilizzo licenez Linea Basic. Il report sevre esclusivamente per proiezioni di budget anno prossimo (uso interno). Nessuna scadenza operativa imemdiata. Elaborazione da fare offline quando le risorse lo permettono.,Amministrazione,bassa,50,254
144,Blocco sistema durante elaborazione fattura 9872/20 per Babbo-Filippini e figli,"Discrepanza IVA su fattura estera 9872/20. Il sys calcola un importo diverso da quello atteso per il cliente Babbo-Filippini e figli. Differenza di pochi euro, ma impedisce la validazione contabile. Richiesta check confgiurazione aliquote nel modulo clienti.",Amministrazione,media,79,258
145,Formattazione rotta: PDF report illeggibile con listino con pianificare lieve,Glitch visuale enlla tabella ordini: la colonna 'Totale' a volte appare vuota. Facendo refresh della pagina i dati compaiono. Problema intermittente che genera confusione nel reparto vendite. Non blocca gli ordini ma genera chiamate di assistenza inutili. con suggerimentom,Tecnico,media,77,273
146,Formattazione rotta: PDF report illeggibile,Diasllineamento giacenze magazzino tra ERP e e-commerce. Alcuni articoli risultano disponibili online ma sono a zero in magazzino. Rischio ordini non evadibili. Forzare una sincronizzazione completa stanotte. - condizioni commerciali,Tecnico,bassa,43,233
147,Warning disco: server pre-produzione al 85% (rischio saturazione),Info su messaggio di cortesia in processo ordini. Il testo visualizzato è corretto ma potrebbe essere più gentile. Valutare rewording per prossima release testi. Modifica editoriale di bassa rilevanza tecnica.. Segnalato anche contattare supporto,Tecnico,media,65,246
148,URGENTE: Sistema sviluppo down - impossibile accedere a fatturazione per fattura listino,"Draft pianificazione manutenzione v.30.0 per l'anno prossimo. Inizio raccolta erquisiti preliminari per upgrade futuro. Attività di tsudio fattibilità a lungo termine. Nessuna scadenza imminente, solo fase di brainstorming tecnico. file",Tecnico,alta,88,236
149,Query lenta: ricerca clienti senza indice (full scan) per listino - pagamento per disponibilità,"Domanda generica su logica funzionamento sconti in Linea Pro. Serve per aggiornare il wiki interno e formare i junior. Il system funziona come atteso, si richiede sloo conferma teorica della formula. Da gestire a tempo perso come attività di knowledge sharing., problema su timeout - fattura per disponibilità",Tecnico,media,95,309
150,Storico: dati storico ordini passati - lieve con pianificare,Query di ricerca clienti lenta: manca idnice sulla colonna 'Partita IVA'. Ogni rcierca fa full table scan. Creare indcie per migliorare tempi di risposta. Attività di tuning DB standard.,Tecnico,bassa,60,186
151,Test: funzionalità sandbox produzione,Glitch visuale nella tabella ordini: la colonna 'Totale' a volte appare vuota. Facendo refresh della pagina i dati compaiono. Problema intermtitente che genera confusione nel reparto vendite. Non blocca gli ordini ma genera chiamate di assistenza inutili.  [vedi nota allegata] per disponibilitàa,Tecnico,media,37,296
152,Glitch intermittente: tabella ordini a volte vuota,"L'utente mario.rossi segnala error 'Access Denied' su una specifica cartella. I permessi sembrano corretti a ssitema. L'utente può lavorare su altre cartelle, ma quelal specifica è inaccessibile. checkre ACL su file server.",Tecnico,media,50,223
153,Query lenta: ricerca clienti senza indice (full scan),Nota di osservazione su ambiente produzione: performance stabili. rTacciamento periodico KPI di applicativo per reportistica mensile. Tutit i parametri snoo nella norma. Ticket aperto solo per loggare l'avvenuto contorllo di routine. con disponibilità con importo,Tecnico,bassa,53,263
154,Formattazione rotta: PDF report illeggibile - fattura importo,Info su messaggio di cortesia in processo ordini. Il testo visualizzato è corretto ma potrebbe essere più gentile. Valutare rewroding per prossima release testi. Modifica editoriale di bassa rilevanza tecnica. - relativo a preventivo,Tecnico,bassa,61,233
155,Segnalazione: glitch grafico test,"Il sistema test è completamente bloccato da questa mattina. Impossibile accedere al modulo fatturazione e gestione ordini. Circa 8 utenti bloccati inclusi reparti amministrativi e commerciali. err. restituito: ERR_TIMEOUT. Tutte operazioni business ferme includendo emissione fatture per clienti Bulzoni, Soffici e Gabba s.r.l. e conferma ordini. Intervento urgentissimo richiesto.",Tecnico,alta,33,381
156,Instabilità DB: timeout random su update anagrafiche,Disallineamento giacenze magazzino tra ERP e e-commerce. Alcuni articoli risultano disponibili online ma sono a zero in magazzino. Rischio ordini non evadibili. Forzare una sincronizzazione completa stanotte.,Tecnico,media,52,208
157,Analisi: statistiche log vendite - disponibilità - preventivo,"Draft pianificazione manutenzione v3.0.0 per l'anno prossimo. Inizio raccolta requisiti preliimnari per ugprade futuro. Attività di studio fattibilità a lungo termine. Nessuna scadenza imminente, solo fase di brainstorming tecnico. per importo",Tecnico,bassa,61,243
158,Info: codice 500 (falso positivo),Query di ricerca clienti lenta: manca indice uslla colonna 'Partita IVA'. Ogni ricerca fa ufll table scan. Creare indice per migliorare tempi di risposta. Attività di tuning DB standard. per condizioni commerciali,Tecnico,media,33,213
159,Glitch intermittente: tabella ordini a volte vuota,"Timeout sporadici durante l'update delle anagrafiche su clienti. Succede circa 1 volta su 10 tentativi. Riprova e funziona. Indice di instabilità del database che va indagata, anche se non blocca il lavoro., problema su accessop",Tecnico,media,50,228
160,Blocco inserimento ordini ORD-49533 - errore 503 fattura pagamento con bonifico,"Studio statistico sui log di cacesso al modulo clienti. Raccolta dati grezzi per tesi di otitmizzazione database. Nessun errore da investigare, solo data mining su storico. Processo da lanciare in background senza priorità., problema su dati",Tecnico,media,79,241
161,"Emergenza: perdita dati cliente Sismondi, Ostinelli e Malenchini SPA su ambiente test","Richiesta patch di sicurezza per libreria obsoleta in clienti. Vulnerabilità media segnalata dal security scan. Non c'è exploit attivo, ma la policy richiede aggiornamento entro 30 giorni. Pianificare installazione patch in ambeinte di test.",Tecnico,alta,85,241
162,Roadmap: supporto futuro ERP - negoziazione disponibilità - pagamento,Disallineamento giacenze magazzino tra ERP e e-commerce. Alcuni articoli risultano disponibili onilne ma sono a zeor in magazzino. Rischio ordini non evadibili. Forzare una sincronizzazione cmopleta stanotte. - relativo a contattare supporto,Tecnico,media,69,241
163,Formattazione rotta: PDF report illeggibile bonifico - condizioni commerciali,Emergenza: rilevata perdita dati cliente Mercantini-Mannoai Group su ambiente sviluppo. Informazioni inserite ieri in vendite non più disponibili. Query ricerca restituiscono errroe ERR_CONNECTION_REFUSED. Dati critici per fatt.zione ordine ORD-38256 e reportistica. Impossibile recuperare anagrafiche e storico transazioni. Richiesto intervento immediato per ripristino.,Tecnico,alta,77,371
164,Storico: dati inventario passati,Info su messaggio di cortesia in processo ordini. Il testo visualizzato è corretto ma potrebbe essere più gentile. Valutare rewording per prossiam release testi. Modifica editoriale di bassa rilevanza tecnica. - fattura per disponibilità con scadenza,Tecnico,bassa,32,250
165,Info: tracciamento attività catalogo con ordine urgente con negoziazione,"Draft pianificazione manutenzione v3.0.0 per l'anno prossimo. Inizio raccolta requisiti preliminari per upgrade futuro. Attività di studio fattibilità a lungo termine. Nessuna scadenza imminente, solo fase di brainstorming tecnico.",Tecnico,alta,72,231
166,Instabilità DB: timeout random su update anagrafiche,Suggerimento per futura roadmap evolutiva del modulo assistenza. Sarebbe utile valutare una ristrutturazione dei menu per il prossimo major update. Nessuna fretta: inserire in wishlist per discussione trimestrale. Proposta puraemnte estetica/funzionale per il futuro.,Tecnico,media,52,267
167,Analisi: statistiche log vendite con scadenza,err. generazione PDF report vendite mensile. Il report esce con formattazione sballata nelle ultime pagnie. I dati sono leggibili ma il documento è brutto da inviare al board. Correggere template di stampa.,Tecnico,bassa,45,206
168,Info: codice NullPointerException (falso positivo),applicativo completamente bloccato duratne generazione preventivi per cliente Totino e filgi. Il modulo clienti va in crash con errore NullPointerException quando si tenta calcolo per Linea Premium. Team comm impossibilitato a inviare offerte. Scadenza opportuntià entro entro 2 ore. Ripristino urg. necessario per non perdere vendita. contratto,Tecnico,alta,50,345
169,Performance degradate: dashboard impiega 15s (utenti lamentano),Emergenza: rilevata perdita dati cliente Parpinel-Guarato SPA su ambiente sviluppo. Informazioni inserite ieri in magazzino non più disponibili. Query ricerca restituiscono error 500. Dati critici per fatt.zione ordine ORD-10744 e reportistica. Impossibile recuperare anagrafiche e storico transazioni. Richiesto intervento immediato per ripristino.. Segnalato anche preventivo per condizioni commerciali,Tecnico,alta,63,404
170,Query lenta: ricerca clienti senza indice (full scan),"Domanda generica su logica funzionamento sconti in Linea Premium. Serve per aggiornare il wiki interno e formare i junior. Il sistema funziona come attseo, si richiede solo conferma teorica della formula. Da gestire a tempo perso come attività di knowledge sharing.",Tecnico,bassa,53,265
171,Glitch intermittente: tabella ordini a volte vuota,"Domanda generica su logica funzionamento sconti in Linea Premuim. Serve per aggiornare il wiki interno e formare i junior. Il sistema funziona come atteso, si richiede solo conferma teorica della formula. Da gestire a tempo perso come attività di knowledge sharing. - relativo a controllo",Tecnico,media,50,288
172,Storico: dati storico ordini passati,Feedback su usabilità interfaccia ordini: i colori dei garfici sono poco leggibili. Probelma puramente cosmetico che non impatta le funzionalità. Valutare restyling grafico quando si metterà mnao al frontend. Segnalazione di bassa priorità per backlog UX.m,Tecnico,media,36,256
173,Instabilità DB: timeout random su update anagrafiche per scadenza,"Blocco totale inserimento ordini nel sistema. Impossibile salvare ordine ORD-63901 per cliente Martucci SPA. Modulo vendite restituisce errore ""ERR_CONNECTION_REFUSED"" e non completa operazione. Processo commerciale fermo da 10 ore. Cliente attened conferma per ordine da 450.8. Assistenza tecnica immediata rihciesta per sblocco.. Segnalato anche accessou",Tecnico,media,65,356
174,Pianificazione: upgrade minore v3.0.0,"Domanda generica su logica funzionamento sconti in Linea Pro. Serve per aggiornare il wiki interno e formare i junior. Il sistema funzoina come atteso, si richiede solo conferma teorica della formula. Da gestire a tempo perso come attività di knowledge sharing.",Tecnico,bassa,37,261
175,Doc: manuale operativo vendite,Query di ricerca clienti lenta: manca indice sulla colonna 'Partita IVA'. Ogni ricerca fa full table scan. Creare indice per migliorare tempi di risposta. Attività di tuning DB standard.,Tecnico,bassa,30,186
176,Domanda: funzionamento teorico preventivi,Emergenza: rilevata perdita dati lciente Bixio-Gualtieri e figli su ambiente produzione. Informazioni inserite ieri in catalogo non più disponibili. Query ricerca restituiscono errore 500. Dati critici per fatzione ordine ORD-14113 e reportistica. Impossibile recuperare anagrafiche e storico transazioni. Richiesto intervento immediato per ripristino. con negoziazione con fattura,Tecnico,alta,41,381
177,"Emergenza: perdita dati cliente Tedesco, Ajello e Botticelli SPA su ambiente staging",error generazione PDF report vendite mensile. Il report esce con formattazione sballata nelle ultime pagine. I dati snoo leggibili ma il documento è brutto da inviare al board. Correggere template di stampa.,Tecnico,alta,84,207
178,Performance degradate: dashboard impiega 15s (utenti lamentano) con suggerimento fattura per pagamento,sys. completamente bloccato durante generazione preventivi per cliente Valmarana-Marangoni Group. Il modulo fatturazione va in crash con error 500 quando si tenta calcolo per Linea Accessori. Team commerciale impossibiltiato a inviare offerte. Scadenza opportunità entro entro 2 ore. Ripristino urgentissimo necessario per non perdere vendita.,Tecnico,alta,102,343
179,Disallineamento magazzino: giacenze web vs ERP errate con listino con pianificare - negoziazione,Qurey di ricerac clienti lenta: manca indice sulla colonna 'Partita IVA'. Ogni ricerca fa full table scan. Creare indice per migliorare tempi di risposta. Attività di tuning DB standard. per preventivo per preventivoa,Tecnico,bassa,96,217
180,Pianificazione: upgrade minore v2.3.1,nIfo su messaggio di cortesia in processo ordini. Il testo visualizzato è corretto ma potrebbe essere più gentile. Valutare rewording per prossima release testi. Modifica editoriale di bassa rilevanza tecnica. - scadenza,Tecnico,bassa,37,220
181,Performance degradate: dashboard impiega 15s (utenti lamentano) per listino con pagamento,"Domanda generica su logica funzionamento sconti in Linea Enterprsie. Serve per aggioranre il wiki interno e formare i junior. Il sistema funziona come atteso, si richiede solo conferma teorica della formula. Da gestire a tempo perso come attività di knowledge sharing. con lieve",Tecnico,media,89,278
182,Performance degradate: dashboard impiega 15s (utenti lamentano) con negoziazione importo,"L'utente giulia.verdi segnala error 'Access Denied' su una specifica cartella. I permessi sembrano corretti a sys. L'utente può lavorare su altre cartelle, ma quella specifica è inaccessibile. Verificare ACL su file server. con pianificare - negoziazione",Tecnico,media,88,254
183,Info: codice ERR_TIMEOUT (falso positivo),Il job notturno di miportazione dati ha saltato 5 record su 1000. Errore di validazione sui campi data. I restanti 995 record sono ok. Analizzare i 5 scrati e caprie perché il formato data era errato. con disponibilità - condizioni commerciali,Tecnico,media,41,243
184,Domanda: funzionamento teorico preventivi - suggerimento negoziazione,"Domanda generica su logica funzionamento sconti in Linea Basic. Serve per aggiornare il wiki interno e formare i junior. Il sys funziona come atteso, si richiede solo conferma teorica della formula. Da gestire a tempo perso come attività di knowledge sharing.. Segnalato anche  richiesta esterna",Tecnico,bassa,69,295
185,Segnalazione: glitch grafico test,"Blocco totale inserimento ordini nel sys. Impossibile salvare ordine ORD-72114 per cliente Mercadante, Mazzi e Trobbiani Group. Modulo assistenza restituisce error ""504"" e non completa operazione. Processo comm fermo da 15 or.e Cliente attende conferma per ordine da 1154.67. Assistenza tecnica immediata richiesta per sblocco., problema su configurazione - sconto scadenza con preventivo",Tecnico,media,33,388
186,Wishlist: estetica interfaccia reportistica,"L'utente admin_01 segnala errore 'Access Denied' su una specifica cartella. I permessi sembrano corretti a system. L'utente può lavorare su altre cartelle, ma quella specifica è inaccessibile. Verificare ACL su file server.",Tecnico,media,43,223
187,Disallineamento magazzino: giacenze web vs ERP errate,Lentezza eccessiva nel caricamento della dashboard report evndite. Impiega 15 secondi per aprirsi invece dei soliti 2. Il sistema è utilizzabile ma la navigazione è frustrante per gli utenti. Probabile query non ottimizzata su DB produzione.r,Tecnico,media,53,242
188,sys bloccato durante generazione preventivi per Gabbana-Ioppi SPA,err. generazione PDF report vendite mensile. Il report esce con formattazione sballata nelle ultime pagine. I dtai sono leggibili ma il documento è brutto da inviare al board. Correggere template di stampa.. Segnalato anche modulo negoziazione per condizioni commerciali,Tecnico,alta,65,270
189,Pianificazione: upgrade minore v3.0.0,Glitch visuale nella tabella ordnii: la colonna 'Totale' a volte appare vuota. Facendo refresh della pagina i dati compaiono. pb intermittente che genera confusione nel reparto vendite. Non blocca gli rodini ma genera chiamate di assistenza inutili.,Tecnico,media,37,249
190,Domanda: funzionamento teorico preventivi,"Domanda generica su logica funzionamento sconti in Linea Premium. Serve per aggiornare il wiki interno e formare i junior. Il system funziona come atteso, si richiede solo conferma teorica della formula. Da gestire a tempo perso come attività di knowledge sharing., problema su timeout per lieve ordine urgente per bonifico",Tecnico,alta,41,323
191,Info: tracciamento attività clienti,problem generazione PDF report vendite mensile. Il report esce con formattazione sballata nelle ultime pagine. I dati sono leggibili ma il documento è brutto da inviare al board. Correggere template di stampa.. Segnalato anche assistenza,Tecnico,bassa,35,237
192,Roadmap: supporto futuro Sistema Gestionale,Anomalia nel calcolo sconti: il modulo vendite applica l'IVA al 22% anche sull'esente. Succede solo con clienti esteri. Gli ordini venogno processati ma con impotri errati che vanno corretit a mano. Bug funzionale da risolvere per evitare lavoro manuale.,Tecnico,media,43,254
193,Wishlist: estetica interfaccia vendite,Anomalia nel calcolo sconti: il modulo vendite applica l'IVA al 22% anche sull'esente. Succede solo con clienti esteri. Gli ordini vengono processati ma con importi errati che vanno corretti a mano. Bug funzionale da risolvere per evitare lvaoro manuale.,Tecnico,media,38,254
194,login negato parziale: cartella specifica inaccessibile,Info su messaggio di cortesia in processo ordini. Il testo visualizzato è corretto ma potrebbe essere più gentile. Valutare rewording per prossima release testi. Modifica editoriale di bassa rilevanza tecnica.,Tecnico,media,55,209
195,Pianificazione: upgrade minore v2.3.1,"Curiosità su dati storcii cliente: ho notato record vecchi di 5 anni. Non creano problemi, ma volevo capire la policy di retention. Solo per mia informazione personale, nessuna azione correttiva richiesta. Chiudere il ticket dopo breve risposta informativa.. Segnalato anche account",Tecnico,bassa,37,282
196,Info: codice NullPointerException (falso positivo) - sconto per pianificare per scadenza,Glitch visuale nella tabella ordini: la colonna 'Totale' a volte appare vuota. Facendo refresh della pagina i dati compaiono. Problema intermittente che genera confusione nel reparto vendite. Non blocca gli ordini ma genera chimaate di assistenza inutili. - condizioni commerciali con pianificare,Tecnico,media,88,296
197,"Emergenza: perdita dati cliente Trupiano, Goldstein e Biagi s.r.l. su ambiente produzione",Glitch visuale nella tabella ordini: la colonna 'Totale' a volte appare vuota. Facendo refresh della pagina i dati compaiono. Problema intermittente che genera confusione nel reparto vendite. Non blocca gli ordini ma genera chiamate di assistenza inutili.,Tecnico,alta,89,255
198,Roadmap: supporto futuro ERP - pianificare,"Log del server application pieno di warning 'Connection Reset'. Il servizio non è mai andato down, ma i log crescono di 1GB al giorno. Rischio saturazione disco se non si indaga la causa. Situazione da monitorare e correggere prima che diventi critica.",Tecnico,bassa,42,252
199,URGENTE: Sistema produzione down - impossibile accedere a fatturazione - scadenza - condizioni commerciali,Lentezza eccessiva nel caricamento della dashboard gestione utenti. Impiega 15 secondi per aprirsi invece dei soliti 2. Il sistema è utilizzabile ma la navigazione è frustrante per gli utenti. Probabile query non ottimizzata su DB produzione.,Tecnico,alta,106,242
200,URGENTE: Sistema sviluppo down - impossibile accedere a fatturazione,"Log del server application pieno di warning 'Connection Reset'. Il servizio non è mai andato down, ma i log crescono di 1GB al giorno. Rischio saturazione disco se non si indaga la causa. Situazione da monitorare e correggere prima che diventi critica. con listino",Tecnico,alta,68,264
201,Coda email bloccata: 50 messaggi in attesa (ritardo comunicazioni),"Richiesta PDF aggiornato del manuale utente modulo catalogo. La versione sul server è obsoleta (manca capitolo 5). Non sevre per attività correnti, ma per completezza archivio documentale. Inviare file uqando disponibile.",Tecnico,bassa,66,221
202,Disallineamento magazzino: giacenze web vs ERP errate,Feedback su usabilità interfaccia ordini: i colori dei grafici sono poco leggibili. rPoblema puramente cosmetico che non impatta le funzionalità. Valutare restyling grafico uqando si metterà mano al frontend. Segnalazione di bassa priorità per backlog UX. con negoziazione disponibilità fatturac,Tecnico,media,53,295
203,Analisi: statistiche log fatturazione,"Blocco totale inserimento oridni nel sistem.a Impossibile salvare ordine ORD-51958 per cliente Baroffio s.r.l.. Modulo fatturazione restituisce errore ""NullPointerException"" e non completa operazione. Processo commericale fermo da 15 ore. Cliente tatende conferma per ordine da 1223.5. Assistenza tecnica immediata richiesta per sblocco., problema su sistemai",Tecnico,media,37,359
